PMID,Title,Authors,Citation,First Author,Journal/Book,Publication Year,Create Date,PMCID,NIHMS ID,DOI
"39987688","Using artificial intelligence tools for data quality evaluation in the context of microplastic human health risk assessments","Qiu Y, Mintenig S, Barchiesi M, Koelmans AA.","Environ Int. 2025 Mar;197:109341. doi: 10.1016/j.envint.2025.109341. Epub 2025 Feb 17.","Qiu Y","Environ Int","2025","2025/02/23","","","10.1016/j.envint.2025.109341"
"40002637","Addressing Multi-Center Variability in Radiomic Analysis: A Comparative Study of Image Acquisition Methods Across Two 3T MRI Scanners","Tocilă-Mătășel C, Dudea SM, Iana G.","Diagnostics (Basel). 2025 Feb 17;15(4):485. doi: 10.3390/diagnostics15040485.","Tocilă-Mătășel C","Diagnostics (Basel)","2025","2025/02/26","PMC11854186","","10.3390/diagnostics15040485"
"38977450","Response to ""Letter to the Editor-Exploring the Unknown: Evaluating ChatGPT's Performance in Uncovering Novel Aspects of Plastic Surgery and Identifying Areas for Future Innovation""","Seth I, Lim B, Rozen WM.","Aesthetic Plast Surg. 2024 Jul 8. doi: 10.1007/s00266-024-04210-y. Online ahead of print.","Seth I","Aesthetic Plast Surg","2024","2024/07/08","","","10.1007/s00266-024-04210-y"
"39917120","Evaluation of the Accuracy of Artificial Intelligence (AI) Models in Dermatological Diagnosis and Comparison With Dermatology Specialists","Yamamura Y, Fujii K, Nakashima C, Otsuka A.","Cureus. 2025 Jan 7;17(1):e77067. doi: 10.7759/cureus.77067. eCollection 2025 Jan.","Yamamura Y","Cureus","2025","2025/02/07","PMC11801811","","10.7759/cureus.77067"
"38222433","Backdoor Adjustment of Confounding by Provenance for Robust Text Classification of Multi-institutional Clinical Notes","Ding X, Sheng Z, Yetişgen M, Pakhomov S, Cohen T.","AMIA Annu Symp Proc. 2024 Jan 11;2023:923-932. eCollection 2023.","Ding X","AMIA Annu Symp Proc","2024","2024/01/15","PMC10785933","",""
"39924308","Assessment of Digital Capabilities by 9 Countries in the Alliance for Healthy Cities Using AI: Cross-Sectional Analysis","Lee H.","JMIR Form Res. 2025 Feb 7;9:e62935. doi: 10.2196/62935.","Lee H","JMIR Form Res","2025","2025/02/09","PMC11830481","","10.2196/62935"
"39327389","Automated Mass Extraction of Over 680,000 PICOs from Clinical Study Abstracts Using Generative AI: A Proof-of-Concept Study","Reason T, Langham J, Gimblett A.","Pharmaceut Med. 2024 Sep;38(5):365-372. doi: 10.1007/s40290-024-00539-6. Epub 2024 Sep 26.","Reason T","Pharmaceut Med","2024","2024/09/26","PMC11473607","","10.1007/s40290-024-00539-6"
"31272093","Impact of image preprocessing on the scanner dependence of multi-parametric MRI radiomic features and covariate shift in multi-institutional glioblastoma datasets","Um H, Tixier F, Bermudez D, Deasy JO, Young RJ, Veeraraghavan H.","Phys Med Biol. 2019 Aug 21;64(16):165011. doi: 10.1088/1361-6560/ab2f44.","Um H","Phys Med Biol","2019","2019/07/05","","","10.1088/1361-6560/ab2f44"
"29103145","Increased signal intensity within glioblastoma resection cavities on fluid-attenuated inversion recovery imaging to detect early progressive disease in patients receiving radiotherapy with concomitant temozolomide therapy","Perry LA, Korfiatis P, Agrawal JP, Erickson BJ.","Neuroradiology. 2018 Jan;60(1):35-42. doi: 10.1007/s00234-017-1941-9. Epub 2017 Nov 4.","Perry LA","Neuroradiology","2018","2017/11/06","","","10.1007/s00234-017-1941-9"
"32537587","Selected Abstracts From the Proceedings of the 2019 Society of Teachers of Family Medicine Conference on Medical Student Education","Norris DR, Jortberg B.","PRiMER. 2019 May 28;3:16. doi: 10.22454/PRiMER.2019.619113. eCollection 2019.","Norris DR","PRiMER","2019","2020/06/16","PMC7205125","","10.22454/PRiMER.2019.619113"
"40146672","Evaluating the value of AI-generated questions for USMLE step 1 preparation: A study using ChatGPT-3.5","Balu A, Prvulovic ST, Fernandez Perez C, Kim A, Donoho DA, Keating G.","Med Teach. 2025 Mar 27:1-9. doi: 10.1080/0142159X.2025.2478872. Online ahead of print.","Balu A","Med Teach","2025","2025/03/27","","","10.1080/0142159X.2025.2478872"
"38544748","Identifying incarceration status in the electronic health record using large language models in emergency department settings","Huang T, Socrates V, Gilson A, Safranek C, Chi L, Wang EA, Puglisi LB, Brandt C, Taylor RA, Wang K.","J Clin Transl Sci. 2024 Mar 11;8(1):e53. doi: 10.1017/cts.2024.496. eCollection 2024.","Huang T","J Clin Transl Sci","2024","2024/03/28","PMC10966832","","10.1017/cts.2024.496"
"38440617","ChatGPT in Head and Neck Oncology-Opportunities and Challenges","Sarma G, Kashyap H, Medhi PP.","Indian J Otolaryngol Head Neck Surg. 2024 Feb;76(1):1425-1429. doi: 10.1007/s12070-023-04201-6. Epub 2023 Aug 31.","Sarma G","Indian J Otolaryngol Head Neck Surg","2024","2024/03/05","PMC10908741","","10.1007/s12070-023-04201-6"
"37087108","Using AI-generated suggestions from ChatGPT to optimize clinical decision support","Liu S, Wright AP, Patterson BL, Wanderer JP, Turer RW, Nelson SD, McCoy AB, Sittig DF, Wright A.","J Am Med Inform Assoc. 2023 Jun 20;30(7):1237-1245. doi: 10.1093/jamia/ocad072.","Liu S","J Am Med Inform Assoc","2023","2023/04/22","PMC10280357","","10.1093/jamia/ocad072"
"36819954","ChatGPT Output Regarding Compulsory Vaccination and COVID-19 Vaccine Conspiracy: A Descriptive Study at the Outset of a Paradigm Shift in Online Search for Information","Sallam M, Salim NA, Al-Tammemi AB, Barakat M, Fayyad D, Hallit S, Harapan H, Hallit R, Mahafzah A.","Cureus. 2023 Feb 15;15(2):e35029. doi: 10.7759/cureus.35029. eCollection 2023 Feb.","Sallam M","Cureus","2023","2023/02/23","PMC9931398","","10.7759/cureus.35029"
"37958000","Performance of ChatGPT on Registered Nurse License Exam in Taiwan: A Descriptive Study","Huang H.","Healthcare (Basel). 2023 Oct 30;11(21):2855. doi: 10.3390/healthcare11212855.","Huang H","Healthcare (Basel)","2023","2023/11/14","PMC10649156","","10.3390/healthcare11212855"
"38218231","Artificial Intelligence and Machine Learning May Resolve Health Care Information Overload","Siegel MG, Rossi MJ, Lubowitz JH.","Arthroscopy. 2024 Jun;40(6):1721-1723. doi: 10.1016/j.arthro.2024.01.007. Epub 2024 Jan 12.","Siegel MG","Arthroscopy","2024","2024/01/13","","","10.1016/j.arthro.2024.01.007"
"37746294","Commentary: AI-based online chat and the future of oncology care: a promising technology or a solution in search of a problem?","Zhang H, Guan Y, Chen J, Tong W.","Front Oncol. 2023 Sep 7;13:1239932. doi: 10.3389/fonc.2023.1239932. eCollection 2023.","Zhang H","Front Oncol","2023","2023/09/25","PMC10517627","","10.3389/fonc.2023.1239932"
"38894617","Assessing the quality of artificial intelligence-generated patient counseling for rhinosinusitis","Hill GS, Fischer JL, Watson NL, Riley CA, Tolisano AM.","Int Forum Allergy Rhinol. 2024 Oct;14(10):1634-1637. doi: 10.1002/alr.23387. Epub 2024 Jun 18.","Hill GS","Int Forum Allergy Rhinol","2024","2024/06/19","","","10.1002/alr.23387"
"36507318","Improving the detection of new lesions in multiple sclerosis with a cascaded 3D fully convolutional neural network approach","Salem M, Ryan MA, Oliver A, Hussain KF, Lladó X.","Front Neurosci. 2022 Nov 24;16:1007619. doi: 10.3389/fnins.2022.1007619. eCollection 2022.","Salem M","Front Neurosci","2022","2022/12/12","PMC9730806","","10.3389/fnins.2022.1007619"
"37285018","ChatGPT's quiz skills in different otolaryngology subspecialties: an analysis of 2576 single-choice and multiple-choice board certification preparation questions","Hoch CC, Wollenberg B, Lüers JC, Knoedler S, Knoedler L, Frank K, Cotofana S, Alfertshofer M.","Eur Arch Otorhinolaryngol. 2023 Sep;280(9):4271-4278. doi: 10.1007/s00405-023-08051-4. Epub 2023 Jun 7.","Hoch CC","Eur Arch Otorhinolaryngol","2023","2023/06/07","PMC10382366","","10.1007/s00405-023-08051-4"
"40035077","BCG therapy for bladder cancer: Exploring patient experiences and concerns through artificial intelligence-based social media analysis","Khene ZE, Tachibana I, Bhanvadia R, Ausmann H, Margulis V, Lotan Y.","Bladder Cancer. 2024 Dec 23;10(4):290-299. doi: 10.1177/23523735241304907. eCollection 2024 Dec.","Khene ZE","Bladder Cancer","2024","2025/03/04","PMC11864235","","10.1177/23523735241304907"
"39118057","Language discrepancies in the performance of generative artificial intelligence models: an examination of infectious disease queries in English and Arabic","Sallam M, Al-Mahzoum K, Alshuaib O, Alhajri H, Alotaibi F, Alkhurainej D, Al-Balwah MY, Barakat M, Egger J.","BMC Infect Dis. 2024 Aug 8;24(1):799. doi: 10.1186/s12879-024-09725-y.","Sallam M","BMC Infect Dis","2024","2024/08/08","PMC11308449","","10.1186/s12879-024-09725-y"
"37975063","Using Deep Learning to Identify Linguistic Features that Facilitate or Inhibit the Propagation of Anti- and Pro-Vaccine Content on Social Media","Argyris YA, Zhang N, Bashyal B, Tan PN.","2022 IEEE Int Conf Digit Health IEEE IDCH 2022 (2022). 2022 Jul;2022:107-116. doi: 10.1109/icdh55609.2022.00025. Epub 2022 Aug 24.","Argyris YA","2022 IEEE Int Conf Digit Health IEEE IDCH 2022 (2022)","2022","2023/11/17","PMC10652839","NIHMS1816749","10.1109/icdh55609.2022.00025"
"33564103","Late-life depression accentuates cognitive weaknesses in older adults with small vessel disease","Oberlin LE, Respino M, Victoria L, Abreu L, Hoptman MJ, Alexopoulos GS, Gunning FM.","Neuropsychopharmacology. 2022 Jan;47(2):580-587. doi: 10.1038/s41386-021-00973-z. Epub 2021 Feb 9.","Oberlin LE","Neuropsychopharmacology","2022","2021/02/10","PMC8674355","","10.1038/s41386-021-00973-z"
"38046053","Navigating Generative AI: Opportunities, Limitations, and Ethical Considerations in Massage Therapy and Beyond","Baskwill A.","Int J Ther Massage Bodywork. 2023 Dec 1;16(4):1-4. doi: 10.3822/ijtmb.v16i4.949. eCollection 2023 Dec.","Baskwill A","Int J Ther Massage Bodywork","2023","2023/12/04","PMC10665080","","10.3822/ijtmb.v16i4.949"
"36939830","Calibrating a Transformer-Based Model's Confidence on Community-Engaged Research Studies: Decision Support Evaluation Study","Ferrell B, Raskin SE, Zimmerman EB.","JMIR Form Res. 2023 Mar 20;7:e41516. doi: 10.2196/41516.","Ferrell B","JMIR Form Res","2023","2023/03/20","PMC10131979","","10.2196/41516"
"39928916","Can the Use of Artificial Intelligence-Generated Content Bridge the Cancer Knowledge Gap? A Longitudinal Study With Health Self-Efficacy as a Mediator and Educational Level as a Moderator","Xie Z, Chen R, Ding W.","Cancer Control. 2025 Jan-Dec;32:10732748251319487. doi: 10.1177/10732748251319487.","Xie Z","Cancer Control","2025","2025/02/10","PMC11811976","","10.1177/10732748251319487"
"38953081","Using ChatGPT in the Development of Clinical Reasoning Cases: A Qualitative Study","Wong K, Fayngersh A, Traba C, Cennimo D, Kothari N, Chen S.","Cureus. 2024 May 31;16(5):e61438. doi: 10.7759/cureus.61438. eCollection 2024 May.","Wong K","Cureus","2024","2024/07/02","PMC11215020","","10.7759/cureus.61438"
"38846858","The scientific knowledge of three large language models in cardiology: multiple-choice questions examination-based performance","Altamimi I, Alhumimidi A, Alshehri S, Alrumayan A, Al-Khlaiwi T, Meo SA, Temsah MH.","Ann Med Surg (Lond). 2024 May 6;86(6):3261-3266. doi: 10.1097/MS9.0000000000002120. eCollection 2024 Jun.","Altamimi I","Ann Med Surg (Lond)","2024","2024/06/07","PMC11152788","","10.1097/MS9.0000000000002120"
"37974429","Leveraging ChatGPT for ophthalmic education: A critical appraisal","Gurnani B, Kaur K.","Eur J Ophthalmol. 2024 Mar;34(2):323-327. doi: 10.1177/11206721231215862. Epub 2023 Nov 16.","Gurnani B","Eur J Ophthalmol","2024","2023/11/17","","","10.1177/11206721231215862"
"37814667","Use of ChatGPT in medical research and scientific writing","Lee PY, Salim H, Abdullah A, Teo CH.","Malays Fam Physician. 2023 Sep 25;18:58. doi: 10.51866/cm0006. eCollection 2023.","Lee PY","Malays Fam Physician","2023","2023/10/10","PMC10560470","","10.51866/cm0006"
"39388702","Navigating Nephrology's Decline Through a GPT-4 Analysis of Internal Medicine Specialties in the United States: Qualitative Study","Miao J, Thongprayoon C, Garcia Valencia O, Craici IM, Cheungpasitporn W.","JMIR Med Educ. 2024 Oct 10;10:e57157. doi: 10.2196/57157.","Miao J","JMIR Med Educ","2024","2024/10/10","PMC11486450","","10.2196/57157"
"39180023","A cross sectional investigation of ChatGPT-like large language models application among medical students in China","Pan G, Ni J.","BMC Med Educ. 2024 Aug 23;24(1):908. doi: 10.1186/s12909-024-05871-8.","Pan G","BMC Med Educ","2024","2024/08/23","PMC11342543","","10.1186/s12909-024-05871-8"
"38109889","Benchmarking the symptom-checking capabilities of ChatGPT for a broad range of diseases","Chen A, Chen DO, Tian L.","J Am Med Inform Assoc. 2024 Sep 1;31(9):2084-2088. doi: 10.1093/jamia/ocad245.","Chen A","J Am Med Inform Assoc","2024","2023/12/18","PMC11339504","","10.1093/jamia/ocad245"
"37720897","The plasticity of ChatGPT's mentalizing abilities: personalization for personality structures","Hadar-Shoval D, Elyoseph Z, Lvovsky M.","Front Psychiatry. 2023 Sep 1;14:1234397. doi: 10.3389/fpsyt.2023.1234397. eCollection 2023.","Hadar-Shoval D","Front Psychiatry","2023","2023/09/18","PMC10503434","","10.3389/fpsyt.2023.1234397"
"39756334","De novo generation of colorectal patient educational materials using large language models: Prompt engineering key to improved readability","Ellison IE, Oslock WM, Abdullah A, Wood L, Thirumalai M, English N, Jones BA, Hollis R, Rubyan M, Chu DI.","Surgery. 2025 Apr;180:109024. doi: 10.1016/j.surg.2024.109024. Epub 2025 Jan 4.","Ellison IE","Surgery","2025","2025/01/05","PMC11936715","NIHMS2041208","10.1016/j.surg.2024.109024"
"39185518","CarD-T: Interpreting Carcinomic Lexicon via Transformers","O'Neill J, Reddy GA, Dhillon N, Tripathi O, Alexandrov L, Katira P.","medRxiv [Preprint]. 2024 Aug 31:2024.08.13.24311948. doi: 10.1101/2024.08.13.24311948.","O'Neill J","medRxiv","2024","2024/08/26","PMC11343268","","10.1101/2024.08.13.24311948"
"38480700","Disease progression strikingly differs in research and real-world Parkinson's populations","Beaulieu-Jones BK, Frau F, Bozzi S, Chandross KJ, Peterschmitt MJ, Cohen C, Coulovrat C, Kumar D, Kruger MJ, Lipnick SL, Fitzsimmons L, Kohane IS, Scherzer CR.","NPJ Parkinsons Dis. 2024 Mar 13;10(1):58. doi: 10.1038/s41531-024-00667-5.","Beaulieu-Jones BK","NPJ Parkinsons Dis","2024","2024/03/14","PMC10937726","","10.1038/s41531-024-00667-5"
"38405736","Disease progression strikingly differs in research and real-world Parkinson's populations","Beaulieu-Jones BK, Frau F, Bozzi S, Chandross KJ, Peterschmitt MJ, Cohen C, Coulovrat C, Kumar D, Kruger MJ, Lipnick SL, Fitzsimmons L, Kohane IS, Scherzer CR.","medRxiv [Preprint]. 2024 Feb 18:2024.02.17.24302981. doi: 10.1101/2024.02.17.24302981.","Beaulieu-Jones BK","medRxiv","2024","2024/02/26","PMC10889035","","10.1101/2024.02.17.24302981"
"38252483","Uncovering Language Disparity of ChatGPT on Retinal Vascular Disease Classification: Cross-Sectional Study","Liu X, Wu J, Shao A, Shen W, Ye P, Wang Y, Ye J, Jin K, Yang J.","J Med Internet Res. 2024 Jan 22;26:e51926. doi: 10.2196/51926.","Liu X","J Med Internet Res","2024","2024/01/22","PMC10845019","","10.2196/51926"
"30676951","A Universal Intensity Standardization Method Based on a Many-to-One Weak-Paired Cycle Generative Adversarial Network for Magnetic Resonance Images","Gao Y, Liu Y, Wang Y, Shi Z, Yu J.","IEEE Trans Med Imaging. 2019 Sep;38(9):2059-2069. doi: 10.1109/TMI.2019.2894692. Epub 2019 Jan 24.","Gao Y","IEEE Trans Med Imaging","2019","2019/01/25","","","10.1109/TMI.2019.2894692"
"37336830","An overview of meta-analyses on radiomics: more evidence is needed to support clinical translation","Zhong J, Lu J, Zhang G, Mao S, Chen H, Yin Q, Hu Y, Xing Y, Ding D, Ge X, Zhang H, Yao W.","Insights Imaging. 2023 Jun 19;14(1):111. doi: 10.1186/s13244-023-01437-2.","Zhong J","Insights Imaging","2023","2023/06/19","PMC10279606","","10.1186/s13244-023-01437-2"
"35075670","Toward MR-only proton therapy planning for pediatric brain tumors: Synthesis of relative proton stopping power images with multiple sequence MRI and development of an online quality assurance tool","Wang C, Uh J, Patni T, Merchant T, Li Y, Hua CH, Acharya S.","Med Phys. 2022 Mar;49(3):1559-1570. doi: 10.1002/mp.15479. Epub 2022 Feb 11.","Wang C","Med Phys","2022","2022/01/25","","","10.1002/mp.15479"
"38584142","Perspectives on AI-based recommendations for mask-wearing and COVID-19 vaccination for transplant recipients in the post-COVID-19 era","Garcia Valencia OA, Thongprayoon C, Miao J, Bruminhent J, Craici IM, Cheungpasitporn W.","Ren Fail. 2024 Dec;46(1):2337291. doi: 10.1080/0886022X.2024.2337291. Epub 2024 Apr 7.","Garcia Valencia OA","Ren Fail","2024","2024/04/07","PMC11000603","","10.1080/0886022X.2024.2337291"
"37065505","Open Data and transparency in artificial intelligence and machine learning: A new era of research","Rodgers CM, Ellingson SR, Chatterjee P.","F1000Res. 2023 Apr 12;12:387. doi: 10.12688/f1000research.133019.1. eCollection 2023.","Rodgers CM","F1000Res","2023","2023/04/17","PMC10098385","","10.12688/f1000research.133019.1"
"39531187","Functional and vascular neuroimaging in maritime pilots with long-term sleep disruption","Mentink LJ, van Osch MJP, Bakker LJ, Olde Rikkert MGM, Beckmann CF, Claassen JAHR, Haak KV.","Geroscience. 2024 Nov 12. doi: 10.1007/s11357-024-01417-4. Online ahead of print.","Mentink LJ","Geroscience","2024","2024/11/12","","","10.1007/s11357-024-01417-4"
"38749478","Enhancing Readability of Online Patient-Facing Content: The Role of AI Chatbots in Improving Cancer Information Accessibility","Abreu AA, Murimwa GZ, Farah E, Stewart JW, Zhang L, Rodriguez J, Sweetenham J, Zeh HJ, Wang SC, Polanco PM.","J Natl Compr Canc Netw. 2024 May 15;22(2 D):e237334. doi: 10.6004/jnccn.2023.7334.","Abreu AA","J Natl Compr Canc Netw","2024","2024/05/15","","","10.6004/jnccn.2023.7334"
"37971395","Cognitive decline assessment using semantic linguistic content and transformer deep learning architecture","Pl R, Ks G.","Int J Lang Commun Disord. 2024 May-Jun;59(3):1110-1127. doi: 10.1111/1460-6984.12973. Epub 2023 Nov 16.","Pl R","Int J Lang Commun Disord","2024","2023/11/16","","","10.1111/1460-6984.12973"
"38539420","Impact of Targeted Agents on Survival of Chronic Lymphocytic Leukemia Patients Fit for Fludarabine, Cyclophosphamide, and Rituximab (FCR) Relative to Age- and Sex-Matched Population","Molica S, Shanafelt TD, Allsup D, Giannarelli D.","Cancers (Basel). 2024 Mar 7;16(6):1085. doi: 10.3390/cancers16061085.","Molica S","Cancers (Basel)","2024","2024/03/28","PMC10968865","","10.3390/cancers16061085"
"39406959","ChatGPT as an effective tool for quality evaluation of radiomics research","Mese I, Kocak B.","Eur Radiol. 2025 Apr;35(4):2030-2042. doi: 10.1007/s00330-024-11122-7. Epub 2024 Oct 15.","Mese I","Eur Radiol","2025","2024/10/15","","","10.1007/s00330-024-11122-7"
"38954915","Assessing ChatGPT's ability to emulate human reviewers in scientific research: A descriptive and qualitative approach","Suleiman A, von Wedel D, Munoz-Acuna R, Redaelli S, Santarisi A, Seibold EL, Ratajczak N, Kato S, Said N, Sundar E, Goodspeed V, Schaefer MS.","Comput Methods Programs Biomed. 2024 Sep;254:108313. doi: 10.1016/j.cmpb.2024.108313. Epub 2024 Jun 28.","Suleiman A","Comput Methods Programs Biomed","2024","2024/07/02","","","10.1016/j.cmpb.2024.108313"
"38556123","The Application of Knowledge Engineering via the Use of a Biomimetic Digital Twin Ecosystem, Phenotype-Driven Variant Analysis, and Exome Sequencing to Understand the Molecular Mechanisms of Disease","Kearns WG, Stamoulis G, Glick J, Baisch L, Benner A, Brough D, Du L, Wilson B, Kearns L, Ng N, Seshan M, Anchan R.","J Mol Diagn. 2024 Jul;26(7):543-551. doi: 10.1016/j.jmoldx.2024.03.004. Epub 2024 Mar 29.","Kearns WG","J Mol Diagn","2024","2024/03/31","","","10.1016/j.jmoldx.2024.03.004"
"38310972","Assessment of Correctness, Content Omission, and Risk of Harm in Large Language Model Responses to Dermatology Continuing Medical Education Questions","Cai ZR, Chen ML, Kim J, Novoa RA, Barnes LA, Beam A, Linos E.","J Invest Dermatol. 2024 Aug;144(8):1877-1879. doi: 10.1016/j.jid.2024.01.015. Epub 2024 Feb 2.","Cai ZR","J Invest Dermatol","2024","2024/02/04","","","10.1016/j.jid.2024.01.015"
"40025837","Exploration of Using an Open-Source Large Language Model for Analyzing Trial Information: A Case Study of Clinical Trials With Decentralized Elements","Huh KY, Song I, Kim Y, Park J, Ryu H, Koh J, Yu KS, Kim KH, Lee S.","Clin Transl Sci. 2025 Mar;18(3):e70183. doi: 10.1111/cts.70183.","Huh KY","Clin Transl Sci","2025","2025/03/03","PMC11873368","","10.1111/cts.70183"
"39525124","Assessing the Clinical Appropriateness and Practical Utility of ChatGPT as an Educational Resource for Patients Considering Minimally Invasive Spine Surgery","Sarikonda A, Abishek R, Isch EL, Momin AA, Self M, Sambangi A, Carreras A, Jallo J, Harrop J, Sivaganesan A.","Cureus. 2024 Oct 8;16(10):e71105. doi: 10.7759/cureus.71105. eCollection 2024 Oct.","Sarikonda A","Cureus","2024","2024/11/11","PMC11548952","","10.7759/cureus.71105"
"39470681","Assessment of Artificial Intelligence Chatbot Responses to Common Patient Questions on Bone Sarcoma","Khabaz K, Newman-Hung NJ, Kallini JR, Kendal J, Christ AB, Bernthal NM, Wessel LE.","J Surg Oncol. 2024 Oct 29. doi: 10.1002/jso.27966. Online ahead of print.","Khabaz K","J Surg Oncol","2024","2024/10/29","","","10.1002/jso.27966"
"39438057","Gender and Ethnicity Bias of Text-to-Image Generative Artificial Intelligence in Medical Imaging, Part 1: Preliminary Evaluation","Currie G, Hewis J, Hawk E, Rohren E.","J Nucl Med Technol. 2024 Dec 4;52(4):356-359. doi: 10.2967/jnmt.124.268332.","Currie G","J Nucl Med Technol","2024","2024/10/22","","","10.2967/jnmt.124.268332"
"39207784","Generative Artificial Intelligence and Large Language Models in Primary Care Medical Education","Parente DJ.","Fam Med. 2024 Oct;56(9):534-540. doi: 10.22454/FamMed.2024.775525. Epub 2024 Aug 8.","Parente DJ","Fam Med","2024","2024/08/29","PMC11493110","","10.22454/FamMed.2024.775525"
"38913203","Exploring the Unknown: Evaluating ChatGPT's Performance in Uncovering Novel Aspects of Plastic Surgery and Identifying Areas for Future Innovation","Qi W, Niu F.","Aesthetic Plast Surg. 2024 Jun 24. doi: 10.1007/s00266-024-04200-0. Online ahead of print.","Qi W","Aesthetic Plast Surg","2024","2024/06/24","","","10.1007/s00266-024-04200-0"
"38175720","Utility of ChatGPT for Automated Creation of Patient Education Handouts: An Application in Neuro-Ophthalmology","Tao BK, Handzic A, Hua NJ, Vosoughi AR, Margolin EA, Micieli JA.","J Neuroophthalmol. 2024 Mar 1;44(1):119-124. doi: 10.1097/WNO.0000000000002074. Epub 2024 Jan 4.","Tao BK","J Neuroophthalmol","2024","2024/01/04","","","10.1097/WNO.0000000000002074"
"37610808","Can AI Mitigate Bias in Writing Letters of Recommendation?","Leung TI, Sagar A, Shroff S, Henry TL.","JMIR Med Educ. 2023 Aug 23;9:e51494. doi: 10.2196/51494.","Leung TI","JMIR Med Educ","2023","2023/08/23","PMC10483302","","10.2196/51494"
"37279048","The Advent of Generative Language Models in Medical Education","Karabacak M, Ozkara BB, Margetis K, Wintermark M, Bisdas S.","JMIR Med Educ. 2023 Jun 6;9:e48163. doi: 10.2196/48163.","Karabacak M","JMIR Med Educ","2023","2023/06/06","PMC10282912","","10.2196/48163"
"39722800","Gender and racial diversity Assumed by text-to-image generators in microsurgery and plastic surgery-related subspecialities","Shiraishi M, Banda CH, Nakajima M, Nakazwe M, Wong ZY, Tomioka Y, Moriwaki Y, Takeishi H, Lee H, Kurita D, Furuse K, Ohba J, Fujisawa K, Miyamoto S, Okazaki M.","J Hand Microsurg. 2024 Nov 30;17(1):100196. doi: 10.1016/j.jham.2024.100196. eCollection 2025 Jan.","Shiraishi M","J Hand Microsurg","2024","2024/12/26","PMC11666935","","10.1016/j.jham.2024.100196"
"39673022","Utility of Chatbot Literature Search in Radiation Oncology","Wong J, Kriegler C, Shrivastava A, Duimering A, Le C.","J Cancer Educ. 2024 Dec 14. doi: 10.1007/s13187-024-02547-1. Online ahead of print.","Wong J","J Cancer Educ","2024","2024/12/13","","","10.1007/s13187-024-02547-1"
"39232303","Bias Perpetuates Bias: ChatGPT Learns Gender Inequities in Academic Surgery Promotions","Desai P, Wang H, Davis L, Ullmann TM, DiBrito SR.","J Surg Educ. 2024 Nov;81(11):1553-1557. doi: 10.1016/j.jsurg.2024.07.023. Epub 2024 Sep 3.","Desai P","J Surg Educ","2024","2024/09/04","","","10.1016/j.jsurg.2024.07.023"
"39149010","Evaluating the performance of ChatGPT-3.5 and ChatGPT-4 on the Taiwan plastic surgery board examination","Hsieh CH, Hsieh HY, Lin HP.","Heliyon. 2024 Jul 18;10(14):e34851. doi: 10.1016/j.heliyon.2024.e34851. eCollection 2024 Jul 30.","Hsieh CH","Heliyon","2024","2024/08/16","PMC11324965","","10.1016/j.heliyon.2024.e34851"
"39054373","Influence of believed AI involvement on the perception of digital medical advice","Reis M, Reis F, Kunde W.","Nat Med. 2024 Nov;30(11):3098-3100. doi: 10.1038/s41591-024-03180-7. Epub 2024 Jul 25.","Reis M","Nat Med","2024","2024/07/25","PMC11564086","","10.1038/s41591-024-03180-7"
"39042979","Digital Ink and Surgical Dreams: Perceptions of Artificial Intelligence-Generated Essays in Residency Applications","Crawford LM, Hendzlik P, Lam J, Cannon LM, Qi Y, DeCaporale-Ryan L, Wilson NA.","J Surg Res. 2024 Sep;301:504-511. doi: 10.1016/j.jss.2024.06.020. Epub 2024 Jul 22.","Crawford LM","J Surg Res","2024","2024/07/23","","","10.1016/j.jss.2024.06.020"
"38887420","Assessing Risk of Bias Using ChatGPT-4 and Cochrane ROB2 Tool","Treviño-Juarez AS.","Med Sci Educ. 2024 Apr 5;34(3):691-694. doi: 10.1007/s40670-024-02034-8. eCollection 2024 Jun.","Treviño-Juarez AS","Med Sci Educ","2024","2024/06/18","PMC11180068","","10.1007/s40670-024-02034-8"
