PMID,Title,Authors,Citation,First Author,Journal/Book,Publication Year,Create Date,PMCID,NIHMS ID,DOI
"37080559","Automatic extraction of social determinants of health from medical notes of chronic lower back pain patients","Lituiev DS, Lacar B, Pak S, Abramowitsch PL, De Marchis EH, Peterson TA.","J Am Med Inform Assoc. 2023 Jul 19;30(8):1438-1447. doi: 10.1093/jamia/ocad054.","Lituiev DS","J Am Med Inform Assoc","2023","2023/04/20","PMC10354762","","10.1093/jamia/ocad054"
"40035027","Multi-Branch CNN-LSTM Fusion Network-Driven System With BERT Semantic Evaluator for Radiology Reporting in Emergency Head CTs","Tomassini S, Duranti D, Zeggada A, Cosimo Quattrocchi C, Melgani F, Giorgini P.","IEEE J Transl Eng Health Med. 2025 Jan 28;13:61-74. doi: 10.1109/JTEHM.2025.3535676. eCollection 2025.","Tomassini S","IEEE J Transl Eng Health Med","2025","2025/03/04","PMC11875635","","10.1109/JTEHM.2025.3535676"
"39135584","CLINICAL REASONING AND ARTIFICIAL INTELLIGENCE: CAN AI REALLY THINK?","Schwartzstein RM.","Trans Am Clin Climatol Assoc. 2024;134:133-145.","Schwartzstein RM","Trans Am Clin Climatol Assoc","2024","2024/08/13","PMC11316886","",""
"39252056","Clinician voices on ethics of LLM integration in healthcare: a thematic analysis of ethical concerns and implications","Mirzaei T, Amini L, Esmaeilzadeh P.","BMC Med Inform Decis Mak. 2024 Sep 9;24(1):250. doi: 10.1186/s12911-024-02656-3.","Mirzaei T","BMC Med Inform Decis Mak","2024","2024/09/09","PMC11382443","","10.1186/s12911-024-02656-3"
"39059040","Evaluating generative AI responses to real-world drug-related questions","Giorgi S, Isman K, Liu T, Fried Z, Sedoc J, Curtis B.","Psychiatry Res. 2024 Sep;339:116058. doi: 10.1016/j.psychres.2024.116058. Epub 2024 Jun 26.","Giorgi S","Psychiatry Res","2024","2024/07/26","PMC11705880","NIHMS2011535","10.1016/j.psychres.2024.116058"
"37450276","Towards Precision Medicine in Spinal Surgery: Leveraging AI Technologies","Lawson McLean A.","Ann Biomed Eng. 2024 Apr;52(4):735-737. doi: 10.1007/s10439-023-03315-w. Epub 2023 Jul 14.","Lawson McLean A","Ann Biomed Eng","2024","2023/07/14","PMC10940418","","10.1007/s10439-023-03315-w"
"39046535","The Picasso's skepticism on computer science and the dawn of generative AI: questions after the answers to keep ""machines-in-the-loop""","Pesapane F, Cuocolo R, Sardanelli F.","Eur Radiol Exp. 2024 Jul 24;8(1):81. doi: 10.1186/s41747-024-00485-7.","Pesapane F","Eur Radiol Exp","2024","2024/07/24","PMC11269548","","10.1186/s41747-024-00485-7"
"40068371","Retrieval-Augmented Generation: Advancing personalized care and research in oncology","Zarfati M, Soffer S, Nadkarni GN, Klang E.","Eur J Cancer. 2025 Mar 6;220:115341. doi: 10.1016/j.ejca.2025.115341. Online ahead of print.","Zarfati M","Eur J Cancer","2025","2025/03/11","","","10.1016/j.ejca.2025.115341"
"39211884","Large Language Models Improve the Identification of Emergency Department Visits for Symptomatic Kidney Stones","Bejan CA, Reed AM, Mikula M, Zhang S, Xu Y, Fabbri D, Embí PJ, Hsi RS.","medRxiv [Preprint]. 2024 Aug 13:2024.08.12.24311870. doi: 10.1101/2024.08.12.24311870.","Bejan CA","medRxiv","2024","2024/08/30","PMC11361237","","10.1101/2024.08.12.24311870"
"38826441","Large Language Models for Social Determinants of Health Information Extraction from Clinical Notes - A Generalizable Approach across Institutions","Keloth VK, Selek S, Chen Q, Gilman C, Fu S, Dang Y, Chen X, Hu X, Zhou Y, He H, Fan JW, Wang K, Brandt C, Tao C, Liu H, Xu H.","medRxiv [Preprint]. 2024 May 22:2024.05.21.24307726. doi: 10.1101/2024.05.21.24307726.","Keloth VK","medRxiv","2024","2024/06/03","PMC11142292","","10.1101/2024.05.21.24307726"
"38266214","The Promise and Perils of Artificial Intelligence in Health Professions Education Practice and Scholarship","Patino GA, Amiel JM, Brown M, Lypson ML, Chan TM.","Acad Med. 2024 May 1;99(5):477-481. doi: 10.1097/ACM.0000000000005636. Epub 2024 Jan 24.","Patino GA","Acad Med","2024","2024/01/24","","","10.1097/ACM.0000000000005636"
"38804330","Simplifying Data Analysis in Biomedical Research: An Automated, User-Friendly Tool","Araújo R, Ramalhete L, Viegas A, Von Rekowski CP, Fonseca TAH, Calado CRC, Bento L.","Methods Protoc. 2024 Apr 24;7(3):36. doi: 10.3390/mps7030036.","Araújo R","Methods Protoc","2024","2024/05/28","PMC11130801","","10.3390/mps7030036"
"39176994","Zero- and few-shot prompting of generative large language models provides weak assessment of risk of bias in clinical trials","Šuster S, Baldwin T, Verspoor K.","Res Synth Methods. 2024 Nov;15(6):988-1000. doi: 10.1002/jrsm.1749. Epub 2024 Aug 23.","Šuster S","Res Synth Methods","2024","2024/08/23","","","10.1002/jrsm.1749"
"34867743","Focal Seizures and Posterior Reversible Encephalopathy Syndrome as Presenting Signs of IgA Vasculitis/Henoch-Schoenlein Purpura-An Educative Case and Systematic Review of the Literature","Funken D, Götz F, Bültmann E, Hennies I, Gburek-Augustat J, Hempel J, Dressler F, Baumann U, Klemann C.","Front Neurol. 2021 Nov 15;12:759386. doi: 10.3389/fneur.2021.759386. eCollection 2021.","Funken D","Front Neurol","2021","2021/12/06","PMC8634645","","10.3389/fneur.2021.759386"
"38046089","Brain versus bot: Distinguishing letters of recommendation authored by humans compared with artificial intelligence","Preiksaitis C, Nash C, Gottlieb M, Chan TM, Alvarez A, Landry A.","AEM Educ Train. 2023 Nov 30;7(6):10.1002/aet2.10924. doi: 10.1002/aet2.10924. eCollection 2023 Dec.","Preiksaitis C","AEM Educ Train","2023","2023/12/04","PMC10688127","","10.1002/aet2.10924"
"38152714","Navigating the Ethical Landmines of ChatGPT: Implications of Intelligent Chatbots in Plastic Surgery Clinical Practice","Oleck NC, Naga HI, Nichols DS, Morris MX, Dhingra B, Patel A.","Plast Reconstr Surg Glob Open. 2023 Sep 15;11(9):e5290. doi: 10.1097/GOX.0000000000005290. eCollection 2023 Sep.","Oleck NC","Plast Reconstr Surg Glob Open","2023","2023/12/28","PMC10752483","","10.1097/GOX.0000000000005290"
"40050981","Harnessing the power of artificial intelligence for disease-surveillance purposes","Tornimbene B, Leiva Rioja ZB, Brownstein J, Dunn A, Faye S, Kong J, Malou N, Nordon C, Rader B, Morgan O.","BMC Proc. 2025 Mar 6;19(Suppl 4):7. doi: 10.1186/s12919-025-00320-w.","Tornimbene B","BMC Proc","2025","2025/03/06","PMC11887143","","10.1186/s12919-025-00320-w"
"39156049","Evaluating cognitive performance: Traditional methods vs. ChatGPT","Fei X, Tang Y, Zhang J, Zhou Z, Yamamoto I, Zhang Y.","Digit Health. 2024 Aug 16;10:20552076241264639. doi: 10.1177/20552076241264639. eCollection 2024 Jan-Dec.","Fei X","Digit Health","2024","2024/08/19","PMC11329975","","10.1177/20552076241264639"
"40012663","Characterizing Emergency Department Care for Patients With Histories of Incarceration","Huang T, Socrates V, Ovchinnikova P, Faustino I, Kumar A, Safranek C, Chi L, Wang EA, Puglisi L, Wong AH, Wang KH, Taylor RA.","J Am Coll Emerg Physicians Open. 2025 Jan 10;6(1):100022. doi: 10.1016/j.acepjo.2024.100022. eCollection 2025 Feb.","Huang T","J Am Coll Emerg Physicians Open","2025","2025/02/27","PMC11852703","","10.1016/j.acepjo.2024.100022"
"38889023","PhraseAug: An Augmented Medical Report Generation Model With Phrasebook","Mei X, Yang L, Gao D, Cai X, Han J, Liu T.","IEEE Trans Med Imaging. 2024 Dec;43(12):4211-4223. doi: 10.1109/TMI.2024.3416190. Epub 2024 Dec 2.","Mei X","IEEE Trans Med Imaging","2024","2024/06/18","","","10.1109/TMI.2024.3416190"
"38626597","The influence of the COVID-19 pandemic on the adoption and impact of AI ChatGPT: Challenges, applications, and ethical considerations","Hussain T, Wang D, Li B.","Acta Psychol (Amst). 2024 Jun;246:104264. doi: 10.1016/j.actpsy.2024.104264. Epub 2024 Apr 15.","Hussain T","Acta Psychol (Amst)","2024","2024/04/16","","","10.1016/j.actpsy.2024.104264"
"36046150","Asian hate speech detection on Twitter during COVID-19","Toliyat A, Levitan SI, Peng Z, Etemadpour R.","Front Artif Intell. 2022 Aug 15;5:932381. doi: 10.3389/frai.2022.932381. eCollection 2022.","Toliyat A","Front Artif Intell","2022","2022/09/01","PMC9421075","","10.3389/frai.2022.932381"
"39511117","Bias Sensitivity in Diagnostic Decision-Making: Comparing ChatGPT with Residents","Schmidt HG, Rotgans JI, Mamede S.","J Gen Intern Med. 2025 Mar;40(4):790-795. doi: 10.1007/s11606-024-09177-9. Epub 2024 Nov 7.","Schmidt HG","J Gen Intern Med","2025","2024/11/07","PMC11914423","","10.1007/s11606-024-09177-9"
"38609507","Large language models could change the future of behavioral healthcare: a proposal for responsible development and evaluation","Stade EC, Stirman SW, Ungar LH, Boland CL, Schwartz HA, Yaden DB, Sedoc J, DeRubeis RJ, Willer R, Eichstaedt JC.","Npj Ment Health Res. 2024 Apr 2;3(1):12. doi: 10.1038/s44184-024-00056-z.","Stade EC","Npj Ment Health Res","2024","2024/04/12","PMC10987499","","10.1038/s44184-024-00056-z"
"39975915","Learning neuroimaging models from health system-scale data","Lyu Y, Harake S, Chowdury A, Banerjee S, Gologorsky R, Liu S, Meissner AK, Rao A, Kondepudi A, Jiang C, Hou X, Joshi R, Neuschmelting V, Srinivasan A, Kleindorfer D, Athey B, Gulani V, Pandey A, Lee H, Hollon T.","Res Sq [Preprint]. 2025 Feb 7:rs.3.rs-5932803. doi: 10.21203/rs.3.rs-5932803/v1.","Lyu Y","Res Sq","2025","2025/02/20","PMC11838732","","10.21203/rs.3.rs-5932803/v1"
"39216786","Disability Ethics and Education in the Age of Artificial Intelligence: Identifying Ability Bias in ChatGPT and Gemini","Urbina JT, Vu PD, Nguyen MV.","Arch Phys Med Rehabil. 2025 Jan;106(1):14-19. doi: 10.1016/j.apmr.2024.08.014. Epub 2024 Aug 30.","Urbina JT","Arch Phys Med Rehabil","2025","2024/08/31","","","10.1016/j.apmr.2024.08.014"
"40053730","Characterizing Public Sentiments and Drug Interactions in the COVID-19 Pandemic Using Social Media: Natural Language Processing and Network Analysis","Li W, Hua Y, Zhou P, Zhou L, Xu X, Yang J.","J Med Internet Res. 2025 Mar 5;27:e63755. doi: 10.2196/63755.","Li W","J Med Internet Res","2025","2025/03/07","PMC11923463","","10.2196/63755"
"38779779","How much can ChatGPT really help computational biologists in programming?","Rahman CR, Wong L.","J Bioinform Comput Biol. 2024 Apr;22(2):2471001. doi: 10.1142/S021972002471001X. Epub 2024 May 22.","Rahman CR","J Bioinform Comput Biol","2024","2024/05/23","","","10.1142/S021972002471001X"
"39759269","The doctor will polygraph you now","Anibal J, Gunkel J, Awan S, Huth H, Nguyen H, Le T, Bélisle-Pipon JC, Boyer M, Hazen L; Bridge2AI Voice Consortium; Bensoussan Y, Clifton D, Wood B.","Npj Health Syst. 2024;1(1):1. doi: 10.1038/s44401-024-00001-4. Epub 2024 Dec 5.","Anibal J","Npj Health Syst","2024","2025/01/06","PMC11698301","","10.1038/s44401-024-00001-4"
"38662419","Large Language Models and User Trust: Consequence of Self-Referential Learning Loop and the Deskilling of Health Care Professionals","Choudhury A, Chaudhry Z.","J Med Internet Res. 2024 Apr 25;26:e56764. doi: 10.2196/56764.","Choudhury A","J Med Internet Res","2024","2024/04/25","PMC11082730","","10.2196/56764"
"31095055","Measuring Exposure to Incarceration Using the Electronic Health Record","Wang EA, Long JB, McGinnis KA, Wang KH, Wildeman CJ, Kim C, Bucklen KB, Fiellin DA, Bates J, Brandt C, Justice AC.","Med Care. 2019 Jun;57 Suppl 6 Suppl 2(Suppl 6 2):S157-S163. doi: 10.1097/MLR.0000000000001049.","Wang EA","Med Care","2019","2019/05/17","PMC8352066","NIHMS1514521","10.1097/MLR.0000000000001049"
"39946180","Laypeople's Use of and Attitudes Toward Large Language Models and Search Engines for Health Queries: Survey Study","Mendel T, Singh N, Mann DM, Wiesenfeld B, Nov O.","J Med Internet Res. 2025 Feb 13;27:e64290. doi: 10.2196/64290.","Mendel T","J Med Internet Res","2025","2025/02/13","PMC11888097","","10.2196/64290"
"39987667","Fine-tuning large language models for improved health communication in low-resource languages","Bui N, Nguyen G, Nguyen N, Vo B, Vo L, Huynh T, Tang A, Tran VN, Huynh T, Nguyen HQ, Dinh M.","Comput Methods Programs Biomed. 2025 May;263:108655. doi: 10.1016/j.cmpb.2025.108655. Epub 2025 Feb 12.","Bui N","Comput Methods Programs Biomed","2025","2025/02/23","","","10.1016/j.cmpb.2025.108655"
"39451418","GPT-Driven Radiology Report Generation with Fine-Tuned Llama 3","Voinea ȘV, Mămuleanu M, Teică RV, Florescu LM, Selișteanu D, Gheonea IA.","Bioengineering (Basel). 2024 Oct 18;11(10):1043. doi: 10.3390/bioengineering11101043.","Voinea ȘV","Bioengineering (Basel)","2024","2024/10/25","PMC11504957","","10.3390/bioengineering11101043"
"40121315","Evaluating the quality of medical content on YouTube using large language models","Khalil M, Mohamed F, Shoufan A.","Sci Rep. 2025 Mar 22;15(1):9906. doi: 10.1038/s41598-025-94208-6.","Khalil M","Sci Rep","2025","2025/03/23","PMC11929840","","10.1038/s41598-025-94208-6"
"38269900","Developing Robust Clinical Text Deep Learning Models - A ""Painless"" Approach","Wu Y, Hughes JA, Lyrstedt AL, Hazelwood S, Brown NJ, Jones L, Douglas C, Jarugula R, Chu K, Nguyen A.","Stud Health Technol Inform. 2024 Jan 25;310:705-709. doi: 10.3233/SHTI231056.","Wu Y","Stud Health Technol Inform","2024","2024/01/25","","","10.3233/SHTI231056"
"38900185","Zero-shot learning to extract assessment criteria and medical services from the preventive healthcare guidelines using large language models","Luo X, Tahabi FM, Marc T, Haunert LA, Storey S.","J Am Med Inform Assoc. 2024 Aug 1;31(8):1743-1753. doi: 10.1093/jamia/ocae145.","Luo X","J Am Med Inform Assoc","2024","2024/06/20","PMC11258407","","10.1093/jamia/ocae145"
"39230947","Evaluating the Capabilities of Generative AI Tools in Understanding Medical Papers: Qualitative Study","Akyon SH, Akyon FC, Camyar AS, Hızlı F, Sari T, Hızlı Ş.","JMIR Med Inform. 2024 Sep 4;12:e59258. doi: 10.2196/59258.","Akyon SH","JMIR Med Inform","2024","2024/09/04","PMC11411230","","10.2196/59258"
"37358808","Examining the Prevailing Negative Sentiments Surrounding Measles Vaccination: Unsupervised Deep Learning of Twitter Posts from 2017 to 2022","Ng QX, Teo YQJ, Kiew CY, Lim BP, Lim YL, Liew TM.","Cyberpsychol Behav Soc Netw. 2023 Aug;26(8):621-630. doi: 10.1089/cyber.2023.0025. Epub 2023 Jun 26.","Ng QX","Cyberpsychol Behav Soc Netw","2023","2023/06/26","","","10.1089/cyber.2023.0025"
"38876484","Large Language Models Versus Expert Clinicians in Crisis Prediction Among Telemental Health Patients: Comparative Study","Lee C, Mohebbi M, O'Callaghan E, Winsberg M.","JMIR Ment Health. 2024 Aug 2;11:e58129. doi: 10.2196/58129.","Lee C","JMIR Ment Health","2024","2024/06/14","PMC11329850","","10.2196/58129"
"38986153","Use of Generative AI for Improving Health Literacy in Reproductive Health: Case Study","Burns C, Bakaj A, Berishaj A, Hristidis V, Deak P, Equils O.","JMIR Form Res. 2024 Aug 6;8:e59434. doi: 10.2196/59434.","Burns C","JMIR Form Res","2024","2024/07/10","PMC11336497","","10.2196/59434"
"39079602","Generative Pre-trained Transformer 4 analysis of cardiovascular magnetic resonance reports in suspected myocarditis: A multicenter study","Kaya K, Gietzen C, Hahnfeldt R, Zoubi M, Emrich T, Halfmann MC, Sieren MM, Elser Y, Krumm P, Brendel JM, Nikolaou K, Haag N, Borggrefe J, Krüchten RV, Müller-Peltzer K, Ehrengut C, Denecke T, Hagendorff A, Goertz L, Gertz RJ, Bunck AC, Maintz D, Persigehl T, Lennartz S, Luetkens JA, Jaiswal A, Iuga AI, Pennig L, Kottlors J.","J Cardiovasc Magn Reson. 2024 Winter;26(2):101068. doi: 10.1016/j.jocmr.2024.101068. Epub 2024 Jul 28.","Kaya K","J Cardiovasc Magn Reson","2024","2024/07/30","PMC11414660","","10.1016/j.jocmr.2024.101068"
"38349846","Estimation of racial and language disparities in pediatric emergency department triage using statistical modeling and natural language processing","Lee SJ, Alzeen M, Ahmed A.","J Am Med Inform Assoc. 2024 Apr 3;31(4):958-967. doi: 10.1093/jamia/ocae018.","Lee SJ","J Am Med Inform Assoc","2024","2024/02/13","PMC10990499","","10.1093/jamia/ocae018"
"39707270","Efficient analysis of drug interactions in liver injury: a retrospective study leveraging natural language processing and machine learning","Ma J, Chen H, Sun J, Huang J, He G, Yang G.","BMC Med Res Methodol. 2024 Dec 20;24(1):312. doi: 10.1186/s12874-024-02443-8.","Ma J","BMC Med Res Methodol","2024","2024/12/20","PMC11660714","","10.1186/s12874-024-02443-8"
"39985409","ChatGPT Achieves Only Fair Agreement with ACFAS Expert Panelist Clinical Consensus Statements","Casciato DJ, Calhoun J.","Foot Ankle Spec. 2025 Feb 22:19386400251319567. doi: 10.1177/19386400251319567. Online ahead of print.","Casciato DJ","Foot Ankle Spec","2025","2025/02/22","","","10.1177/19386400251319567"
"39963973","The Promise and Perils of Artificial Intelligence in Advancing Participatory Science and Health Equity in Public Health","King AC, Doueiri ZN, Kaulberg A, Goldman Rosas L.","JMIR Public Health Surveill. 2025 Feb 14;11:e65699. doi: 10.2196/65699.","King AC","JMIR Public Health Surveill","2025","2025/02/18","PMC11844874","","10.2196/65699"
"40046117","Deductively coding psychosocial autopsy interview data using a few-shot learning large language model","Balt E, Salmi S, Bhulai S, Vrinzen S, Eikelenboom M, Gilissen R, Creemers D, Popma A, Mérelle S.","Front Public Health. 2025 Feb 19;13:1512537. doi: 10.3389/fpubh.2025.1512537. eCollection 2025.","Balt E","Front Public Health","2025","2025/03/06","PMC11879832","","10.3389/fpubh.2025.1512537"
"38206661","Comprehensiveness, Accuracy, and Readability of Exercise Recommendations Provided by an AI-Based Chatbot: Mixed Methods Study","Zaleski AL, Berkowsky R, Craig KJT, Pescatello LS.","JMIR Med Educ. 2024 Jan 11;10:e51308. doi: 10.2196/51308.","Zaleski AL","JMIR Med Educ","2024","2024/01/11","PMC10811574","","10.2196/51308"
"34531007","Aspect-based sentiment analysis with graph convolution over syntactic dependencies","Žunić A, Corcoran P, Spasić I.","Artif Intell Med. 2021 Sep;119:102138. doi: 10.1016/j.artmed.2021.102138. Epub 2021 Aug 9.","Žunić A","Artif Intell Med","2021","2021/09/17","","","10.1016/j.artmed.2021.102138"
"38112589","(How) ChatGPT-Artificial Intelligence Thinks It Can Help/Harm Physiatry","Jačisko J, Veselý V, Chang KV, Özçakar L.","Am J Phys Med Rehabil. 2024 Apr 1;103(4):346-349. doi: 10.1097/PHM.0000000000002370. Epub 2023 Oct 17.","Jačisko J","Am J Phys Med Rehabil","2024","2023/12/19","","","10.1097/PHM.0000000000002370"
"38929638","The Sociodemographic Biases in Machine Learning Algorithms: A Biomedical Informatics Perspective","Franklin G, Stephens R, Piracha M, Tiosano S, Lehouillier F, Koppel R, Elkin PL.","Life (Basel). 2024 May 21;14(6):652. doi: 10.3390/life14060652.","Franklin G","Life (Basel)","2024","2024/06/27","PMC11204917","","10.3390/life14060652"
"36535219","The efficacy and safety of alteplase treatment in patients with acute ischemic stroke with unknown time of onset: -Real world data","Terasawa Y, Shimomura R, Sato K, Himeno T, Inoue T, Kohriyama T.","J Clin Neurosci. 2023 Jan;107:124-128. doi: 10.1016/j.jocn.2022.11.018. Epub 2022 Dec 17.","Terasawa Y","J Clin Neurosci","2023","2022/12/19","","","10.1016/j.jocn.2022.11.018"
"34459833","Social Media Polarization and Echo Chambers in the Context of COVID-19: Case Study","Jiang J, Ren X, Ferrara E.","JMIRx Med. 2021 Aug 5;2(3):e29570. doi: 10.2196/29570. eCollection 2021 Jul-Sep.","Jiang J","JMIRx Med","2021","2021/08/30","PMC8371575","","10.2196/29570"
"38575326","Generative artificial intelligence and non-pharmacological bias: an experimental study on cancer patient sexual health communications","Hanai A, Ishikawa T, Kawauchi S, Iida Y, Kawakami E.","BMJ Health Care Inform. 2024 Apr 4;31(1):e100924. doi: 10.1136/bmjhci-2023-100924.","Hanai A","BMJ Health Care Inform","2024","2024/04/04","PMC11002430","","10.1136/bmjhci-2023-100924"
"37889368","Bariatric Evaluation Through AI: a Survey of Expert Opinions Versus ChatGPT-4 (BETA-SEOV)","Jazi AHD, Mahjoubi M, Shahabi S, Alqahtani AR, Haddad A, Pazouki A, Prasad A, Safadi BY, Chiappetta S, Taskin HE, Billy HT, Kasama K, Mahawar K, Gawdat K, Rheinwalt KP, Miller KA, Kow L, Neto MG, Yang W, Palermo M, Ghanem OM, Lainas P, Peterli R, Kassir R, Puy RV, Da Silva Ribeiro RJ, Verboonen S, Pintar T, Shabbir A, Musella M, Kermansaravi M.","Obes Surg. 2023 Dec;33(12):3971-3980. doi: 10.1007/s11695-023-06903-w. Epub 2023 Oct 27.","Jazi AHD","Obes Surg","2023","2023/10/27","","","10.1007/s11695-023-06903-w"
"30120616","MRI quality assurance based on 3D FLAIR brain images","Peltonen JI, Mäkelä T, Salli E.","MAGMA. 2018 Dec;31(6):689-699. doi: 10.1007/s10334-018-0699-3. Epub 2018 Aug 17.","Peltonen JI","MAGMA","2018","2018/08/19","","","10.1007/s10334-018-0699-3"
"39836952","Applications of Natural Language Processing and Large Language Models for Social Determinants of Health: Protocol for a Systematic Review","Rajwal S, Zhang Z, Chen Y, Rogers H, Sarker A, Xiao Y.","JMIR Res Protoc. 2025 Jan 21;14:e66094. doi: 10.2196/66094.","Rajwal S","JMIR Res Protoc","2025","2025/01/21","PMC11795155","","10.2196/66094"
"38679900","Mixed methods assessment of the influence of demographics on medical advice of ChatGPT","Andreadis K, Newman DR, Twan C, Shunk A, Mann DM, Stevens ER.","J Am Med Inform Assoc. 2024 Sep 1;31(9):2002-2009. doi: 10.1093/jamia/ocae086.","Andreadis K","J Am Med Inform Assoc","2024","2024/04/29","PMC11339520","","10.1093/jamia/ocae086"
"39484238","Assessing Retrieval-Augmented Large Language Model Performance in Emergency Department ICD-10-CM Coding Compared to Human Coders","Klang E, Tessler I, Apakama DU, Abbott E, Glicksberg BS, Arnold M, Moses A, Sakhuja A, Soroush A, Charney AW, Reich DL, McGreevy J, Gavin N, Carr B, Freeman R, Nadkarni GN.","medRxiv [Preprint]. 2024 Oct 17:2024.10.15.24315526. doi: 10.1101/2024.10.15.24315526.","Klang E","medRxiv","2024","2024/11/01","PMC11527068","","10.1101/2024.10.15.24315526"
"29743531","Identifying Suicide Ideation and Suicidal Attempts in a Psychiatric Clinical Research Database using Natural Language Processing","Fernandes AC, Dutta R, Velupillai S, Sanyal J, Stewart R, Chandran D.","Sci Rep. 2018 May 9;8(1):7426. doi: 10.1038/s41598-018-25773-2.","Fernandes AC","Sci Rep","2018","2018/05/11","PMC5943451","","10.1038/s41598-018-25773-2"
"38977396","The new frontier: utilizing ChatGPT to expand craniofacial research","Zhang A, Dimock E, Gupta R, Chen K.","Arch Craniofac Surg. 2024 Jun;25(3):116-122. doi: 10.7181/acfs.2024.00115. Epub 2024 Jun 20.","Zhang A","Arch Craniofac Surg","2024","2024/07/08","PMC11231409","","10.7181/acfs.2024.00115"
"31361300","Development of a global infectious disease activity database using natural language processing, machine learning, and human expertise","Feldman J, Thomas-Bachli A, Forsyth J, Patel ZH, Khan K.","J Am Med Inform Assoc. 2019 Nov 1;26(11):1355-1359. doi: 10.1093/jamia/ocz112.","Feldman J","J Am Med Inform Assoc","2019","2019/07/31","PMC7647217","","10.1093/jamia/ocz112"
"37090406","Breaking Bias: The Role of Artificial Intelligence in Improving Clinical Decision-Making","Brown C, Nazeer R, Gibbs A, Le Page P, Mitchell AR.","Cureus. 2023 Mar 20;15(3):e36415. doi: 10.7759/cureus.36415. eCollection 2023 Mar.","Brown C","Cureus","2023","2023/04/24","PMC10115193","","10.7759/cureus.36415"
"38817773","ChatGPT-4 Can Help Hand Surgeons Communicate Better With Patients","Browne R, Gull K, Hurley CM, Sugrue RM, O'Sullivan JB.","J Hand Surg Glob Online. 2024 Apr 6;6(3):436-438. doi: 10.1016/j.jhsg.2024.03.008. eCollection 2024 May.","Browne R","J Hand Surg Glob Online","2024","2024/05/31","PMC11133925","","10.1016/j.jhsg.2024.03.008"
"39148849","Foundational model aided automatic high-throughput drug screening using self-controlled cohort study","Xu S, Cobzaru R, Finkelstein SN, Welsch RE, Ng K, Middleton L.","medRxiv [Preprint]. 2024 Sep 16:2024.08.04.24311480. doi: 10.1101/2024.08.04.24311480.","Xu S","medRxiv","2024","2024/08/16","PMC11326319","","10.1101/2024.08.04.24311480"
"38712224","Using Large Language Models to Annotate Complex Cases of Social Determinants of Health in Longitudinal Clinical Records","Ralevski A, Taiyab N, Nossal M, Mico L, Piekos SN, Hadlock J.","medRxiv [Preprint]. 2024 Apr 27:2024.04.25.24306380. doi: 10.1101/2024.04.25.24306380.","Ralevski A","medRxiv","2024","2024/05/07","PMC11071574","","10.1101/2024.04.25.24306380"
"38626625","Enhancing psychiatric rehabilitation outcomes through a multimodal multitask learning model based on BERT and TabNet: An approach for personalized treatment and improved decision-making","Yang H, Zhu D, He S, Xu Z, Liu Z, Zhang W, Cai J.","Psychiatry Res. 2024 Jun;336:115896. doi: 10.1016/j.psychres.2024.115896. Epub 2024 Apr 6.","Yang H","Psychiatry Res","2024","2024/04/16","","","10.1016/j.psychres.2024.115896"
"39936096","Voice EHR: introducing multimodal audio data for health","Anibal J, Huth H, Li M, Hazen L, Daoud V, Ebedes D, Lam YM, Nguyen H, Hong PV, Kleinman M, Ost S, Jackson C, Sprabery L, Elangovan C, Krishnaiah B, Akst L, Lina I, Elyazar I, Ekawati L, Jansen S, Nduwayezu R, Garcia C, Plum J, Brenner J, Song M, Ricotta E, Clifton D, Thwaites CL, Bensoussan Y, Wood B.","Front Digit Health. 2025 Jan 28;6:1448351. doi: 10.3389/fdgth.2024.1448351. eCollection 2024.","Anibal J","Front Digit Health","2025","2025/02/12","PMC11812063","","10.3389/fdgth.2024.1448351"
"40111287","Exploring Biases of Large Language Models in the Field of Mental Health: Comparative Questionnaire Study of the Effect of Gender and Sexual Orientation in Anorexia Nervosa and Bulimia Nervosa Case Vignettes","Schnepper R, Roemmel N, Schaefert R, Lambrecht-Walzinger L, Meinlschmidt G.","JMIR Ment Health. 2025 Mar 20;12:e57986. doi: 10.2196/57986.","Schnepper R","JMIR Ment Health","2025","2025/03/20","PMC11949086","","10.2196/57986"
