PMID,Title,Authors,Citation,First Author,Journal/Book,Publication Year,Create Date,PMCID,NIHMS ID,DOI
"35615042","Classifying Characteristics of Opioid Use Disorder From Hospital Discharge Summaries Using Natural Language Processing","Poulsen MN, Freda PJ, Troiani V, Davoudi A, Mowery DL.","Front Public Health. 2022 May 9;10:850619. doi: 10.3389/fpubh.2022.850619. eCollection 2022.","Poulsen MN","Front Public Health","2022","2022/05/26","PMC9124945","","10.3389/fpubh.2022.850619"
"38749026","Natural Language Processing for Work-Related Stress Detection Among Health Professionals: Protocol for a Scoping Review","Bieri JS, Ikae C, Souissi SB, Müller TJ, Schlunegger MC, Golz C.","JMIR Res Protoc. 2024 May 15;13:e56267. doi: 10.2196/56267.","Bieri JS","JMIR Res Protoc","2024","2024/05/15","PMC11137421","","10.2196/56267"
"39173690","Currently Available Large Language Models Do Not Provide Musculoskeletal Treatment Recommendations That Are Concordant With Evidence-Based Clinical Practice Guidelines","Nwachukwu BU, Varady NH, Allen AA, Dines JS, Altchek DW, Williams RJ 3rd, Kunze KN.","Arthroscopy. 2025 Feb;41(2):263-275.e6. doi: 10.1016/j.arthro.2024.07.040. Epub 2024 Aug 22.","Nwachukwu BU","Arthroscopy","2025","2024/08/22","","","10.1016/j.arthro.2024.07.040"
"38971715","Ethical Considerations and Fundamental Principles of Large Language Models in Medical Education: Viewpoint","Zhui L, Fenghe L, Xuehu W, Qining F, Wei R.","J Med Internet Res. 2024 Aug 1;26:e60083. doi: 10.2196/60083.","Zhui L","J Med Internet Res","2024","2024/07/06","PMC11327620","","10.2196/60083"
"38712037","Leveraging a Large Language Model to Assess Quality-of-Care: Monitoring ADHD Medication Side Effects","Bannett Y, Gunturkun F, Pillai M, Herrmann JE, Luo I, Huffman LC, Feldman HM.","medRxiv [Preprint]. 2024 Apr 24:2024.04.23.24306225. doi: 10.1101/2024.04.23.24306225.","Bannett Y","medRxiv","2024","2024/05/07","PMC11071552","","10.1101/2024.04.23.24306225"
"37553423","Disparities in cannabis use and documentation in electronic health records among children and young adults","Tavabi N, Raza M, Singh M, Golchin S, Singh H, Hogue GD, Kiapour AM.","NPJ Digit Med. 2023 Aug 8;6(1):138. doi: 10.1038/s41746-023-00885-w.","Tavabi N","NPJ Digit Med","2023","2023/08/08","PMC10409778","","10.1038/s41746-023-00885-w"
"38827059","ChatGPT and Vaccine Hesitancy: A Comparison of English, Spanish, and French Responses Using a Validated Scale","Joshi S, Ha E, Rivera Y, Singh VK.","AMIA Jt Summits Transl Sci Proc. 2024 May 31;2024:266-275. eCollection 2024.","Joshi S","AMIA Jt Summits Transl Sci Proc","2024","2024/06/03","PMC11141820","",""
"31329877","Social determinants of health in mental health care and research: a case for greater inclusion","Deferio JJ, Breitinger S, Khullar D, Sheth A, Pathak J.","J Am Med Inform Assoc. 2019 Aug 1;26(8-9):895-899. doi: 10.1093/jamia/ocz049.","Deferio JJ","J Am Med Inform Assoc","2019","2019/07/23","PMC6696493","","10.1093/jamia/ocz049"
"38046016","Artificial intelligence: a new field of knowledge for nephrologists?","Fayos De Arizón L, Viera ER, Pilco M, Perera A, De Maeztu G, Nicolau A, Furlano M, Torra R.","Clin Kidney J. 2023 Jul 29;16(12):2314-2326. doi: 10.1093/ckj/sfad182. eCollection 2023 Dec.","Fayos De Arizón L","Clin Kidney J","2023","2023/12/04","PMC10689169","","10.1093/ckj/sfad182"
"40032513","Which AI doctor would you like to see? Emulating healthcare provider-patient communication models with GPT-4: proof-of-concept and ethical exploration","Zohny H, Allen JW, Wilkinson D, Savulescu J.","J Med Ethics. 2025 Mar 3:jme-2024-110256. doi: 10.1136/jme-2024-110256. Online ahead of print.","Zohny H","J Med Ethics","2025","2025/03/03","","","10.1136/jme-2024-110256"
"40033130","Assessing and alleviating state anxiety in large language models","Ben-Zion Z, Witte K, Jagadish AK, Duek O, Harpaz-Rotem I, Khorsandian MC, Burrer A, Seifritz E, Homan P, Schulz E, Spiller TR.","NPJ Digit Med. 2025 Mar 3;8(1):132. doi: 10.1038/s41746-025-01512-6.","Ben-Zion Z","NPJ Digit Med","2025","2025/03/03","PMC11876565","","10.1038/s41746-025-01512-6"
"39018490","Applying natural language processing to patient messages to identify depression concerns in cancer patients","van Buchem MM, de Hond AAH, Fanconi C, Shah V, Schuessler M, Kant IMJ, Steyerberg EW, Hernandez-Boussard T.","J Am Med Inform Assoc. 2024 Oct 1;31(10):2255-2262. doi: 10.1093/jamia/ocae188.","van Buchem MM","J Am Med Inform Assoc","2024","2024/07/17","PMC11413442","","10.1093/jamia/ocae188"
"39476380","Ensuring Accuracy and Equity in Vaccination Information From ChatGPT and CDC: Mixed-Methods Cross-Language Evaluation","Joshi S, Ha E, Amaya A, Mendoza M, Rivera Y, Singh VK.","JMIR Form Res. 2024 Oct 30;8:e60939. doi: 10.2196/60939.","Joshi S","JMIR Form Res","2024","2024/10/30","PMC11561424","","10.2196/60939"
"39222957","A Multi-Institutional Natural Language Processing Pipeline to Extract Performance Status From Electronic Health Records","Maghsoudi A, Sada YH, Nowakowski S, Guffey D, Zhu H, Yarlagadda SR, Li A, Razjouyan J.","Cancer Control. 2024 Jan-Dec;31:10732748241279518. doi: 10.1177/10732748241279518.","Maghsoudi A","Cancer Control","2024","2024/09/02","PMC11369884","","10.1177/10732748241279518"
"37350895","Natural Language Processing Methods to Identify Oncology Patients at High Risk for Acute Care with Clinical Notes","Fanconi C, van Buchem M, Hernandez-Boussard T.","AMIA Jt Summits Transl Sci Proc. 2023 Jun 16;2023:138-147. eCollection 2023.","Fanconi C","AMIA Jt Summits Transl Sci Proc","2023","2023/06/23","PMC10283145","",""
"39281744","Large language models outperform traditional natural language processing methods in extracting patient-reported outcomes in IBD","Patel PV, Davis C, Ralbovsky A, Tinoco D, Williams CYK, Slatter S, Naderalvojoud B, Rosen MJ, Hernandez-Boussard T, Rudrapatna V.","medRxiv [Preprint]. 2024 Sep 6:2024.09.05.24313139. doi: 10.1101/2024.09.05.24313139.","Patel PV","medRxiv","2024","2024/09/16","PMC11398594","","10.1101/2024.09.05.24313139"
"40053817","Competency of Large Language Models in Evaluating Appropriate Responses to Suicidal Ideation: Comparative Study","McBain RK, Cantor JH, Zhang LA, Baker O, Zhang F, Halbisen A, Kofner A, Breslau J, Stein B, Mehrotra A, Yu H.","J Med Internet Res. 2025 Mar 5;27:e67891. doi: 10.2196/67891.","McBain RK","J Med Internet Res","2025","2025/03/07","PMC11928068","","10.2196/67891"
"40093243","LLM-Guided Pain Management: Examining Socio-Demographic Gaps in Cancer vs non-Cancer cases","Omar M, Soffer S, Agbareia R, Bragazzi NL, Glicksberg BS, Hurd YL, Apakama DU, Charney AW, Reich DL, Nadkarni GN, Klang E.","medRxiv [Preprint]. 2025 Mar 5:2025.03.04.25323396. doi: 10.1101/2025.03.04.25323396.","Omar M","medRxiv","2025","2025/03/17","PMC11908302","","10.1101/2025.03.04.25323396"
"39801619","Demystifying Large Language Models for Medicine: A Primer","Jin Q, Wan N, Leaman R, Tian S, Wang Z, Yang Y, Wang Z, Xiong G, Lai PT, Zhu Q, Hou B, Sarfo-Gyamfi M, Zhang G, Gilson A, Bhasuran B, He Z, Zhang A, Sun J, Weng C, Summers RM, Chen Q, Peng Y, Lu Z.","ArXiv [Preprint]. 2024 Nov 20:arXiv:2410.18856v3.","Jin Q","ArXiv","2024","2025/01/13","PMC11722506","",""
"39677375","Debiasing large language models: research opportunities","Yogarajan V, Dobbie G, Keegan TT.","J R Soc N Z. 2024 Sep 16;55(2):372-395. doi: 10.1080/03036758.2024.2398567. eCollection 2025.","Yogarajan V","J R Soc N Z","2024","2024/12/16","PMC11639098","","10.1080/03036758.2024.2398567"
"36865144","Assessing the Value of ChatGPT for Clinical Decision Support Optimization","Liu S, Wright AP, Patterson BL, Wanderer JP, Turer RW, Nelson SD, McCoy AB, Sittig DF, Wright A.","medRxiv [Preprint]. 2023 Feb 23:2023.02.21.23286254. doi: 10.1101/2023.02.21.23286254.","Liu S","medRxiv","2023","2023/03/03","PMC9980251","","10.1101/2023.02.21.23286254"
"38239824","Benchmarking Transformer-Based Models for Identifying Social Determinants of Health in Clinical Notes","Wang X, Gupta D, Killian M, He Z.","Proc (IEEE Int Conf Healthc Inform). 2023 Jun;2023:570-574. doi: 10.1109/ichi57859.2023.00102. Epub 2023 Dec 11.","Wang X","Proc (IEEE Int Conf Healthc Inform)","2023","2024/01/19","PMC10795706","NIHMS1957582","10.1109/ichi57859.2023.00102"
"39601443","Applying natural language processing to understand symptoms among older adult home healthcare patients with urinary incontinence","Scharp D, Song J, Hobensack M, Palmer MH, Barcelona V, Topaz M.","J Nurs Scholarsh. 2025 Jan;57(1):152-164. doi: 10.1111/jnu.13038. Epub 2024 Nov 27.","Scharp D","J Nurs Scholarsh","2025","2024/11/27","PMC11772115","NIHMS2037787","10.1111/jnu.13038"
"38100393","GPT-4 can pass the Korean National Licensing Examination for Korean Medicine Doctors","Jang D, Yun TR, Lee CY, Kwon YK, Kim CE.","PLOS Digit Health. 2023 Dec 15;2(12):e0000416. doi: 10.1371/journal.pdig.0000416. eCollection 2023 Dec.","Jang D","PLOS Digit Health","2023","2023/12/15","PMC10723673","","10.1371/journal.pdig.0000416"
"38076944","ChatGPT Influence on Medical Decision-Making, Bias, and Equity: A Randomized Study of Clinicians Evaluating Clinical Vignettes","Goh E, Bunning B, Khoong E, Gallo R, Milstein A, Centola D, Chen JH.","medRxiv [Preprint]. 2023 Nov 27:2023.11.24.23298844. doi: 10.1101/2023.11.24.23298844.","Goh E","medRxiv","2023","2023/12/11","PMC10705632","","10.1101/2023.11.24.23298844"
"39974103","The Clinical Value of ChatGPT for Epilepsy Presurgical Decision Making: Systematic Evaluation on Seizure Semiology Interpretation","Luo Y, Jiao M, Fotedar N, Ding JE, Karakis I, Rao VR, Asmar M, Xian X, Aboud O, Wen Y, Lin JJ, Hung FM, Sun H, Rosenow F, Liu F.","medRxiv [Preprint]. 2025 Feb 3:2024.04.13.24305773. doi: 10.1101/2024.04.13.24305773.","Luo Y","medRxiv","2025","2025/02/20","PMC11838686","","10.1101/2024.04.13.24305773"
"30818342","Natural language processing and machine learning algorithm to identify brain MRI reports with acute ischemic stroke","Kim C, Zhu V, Obeid J, Lenert L.","PLoS One. 2019 Feb 28;14(2):e0212778. doi: 10.1371/journal.pone.0212778. eCollection 2019.","Kim C","PLoS One","2019","2019/03/01","PMC6394972","","10.1371/journal.pone.0212778"
"37093597","Artificial Intelligence-Enabled Analysis of Statin-Related Topics and Sentiments on Social Media","Somani S, van Buchem MM, Sarraju A, Hernandez-Boussard T, Rodriguez F.","JAMA Netw Open. 2023 Apr 3;6(4):e239747. doi: 10.1001/jamanetworkopen.2023.9747.","Somani S","JAMA Netw Open","2023","2023/04/24","PMC10126874","","10.1001/jamanetworkopen.2023.9747"
"38955389","Advancing equity in breast cancer care: natural language processing for analysing treatment outcomes in under-represented populations","Park JI, Park JW, Zhang K, Kim D.","BMJ Health Care Inform. 2024 Jul 1;31(1):e100966. doi: 10.1136/bmjhci-2023-100966.","Park JI","BMJ Health Care Inform","2024","2024/07/02","PMC11218025","","10.1136/bmjhci-2023-100966"
"33902657","5335 days of Implementation Science: using natural language processing to examine publication trends and topics","Scaccia JP, Scott VC.","Implement Sci. 2021 Apr 26;16(1):47. doi: 10.1186/s13012-021-01120-4.","Scaccia JP","Implement Sci","2021","2021/04/27","PMC8077727","","10.1186/s13012-021-01120-4"
"40093199","irAE-GPT: Leveraging large language models to identify immune-related adverse events in electronic health records and clinical trial datasets","Bejan CA, Wang M, Venkateswaran S, Bergmann EA, Hiles L, Xu Y, Chandler GS, Brondfield S, Silverstein J, Wright F, de Dios K, Kim D, Mukherjee E, Krantz MS, Yao L, Johnson DB, Phillips EJ, Balko JM, Mohindra R, Quandt Z.","medRxiv [Preprint]. 2025 Mar 6:2025.03.05.25323445. doi: 10.1101/2025.03.05.25323445.","Bejan CA","medRxiv","2025","2025/03/17","PMC11908319","","10.1101/2025.03.05.25323445"
"38879943","The American Journal of Emergency Medicine's policy on large language model usage in manuscript preparation: Balancing innovation and responsibility","Hartka T.","Am J Emerg Med. 2024 Aug;82:105-106. doi: 10.1016/j.ajem.2024.06.002. Epub 2024 Jun 8.","Hartka T","Am J Emerg Med","2024","2024/06/16","","","10.1016/j.ajem.2024.06.002"
"33615222","Radiogenomic modeling predicts survival-associated prognostic groups in glioblastoma","Nuechterlein N, Li B, Feroze A, Holland EC, Shapiro L, Haynor D, Fink J, Cimino PJ.","Neurooncol Adv. 2021 Feb 15;3(1):vdab004. doi: 10.1093/noajnl/vdab004. eCollection 2021 Jan-Dec.","Nuechterlein N","Neurooncol Adv","2021","2021/02/22","PMC7883769","","10.1093/noajnl/vdab004"
"39178303","The digital Balint: using AI in reflective practice","Lewis M, Hayhoe B.","Educ Prim Care. 2024 Nov;35(6):198-202. doi: 10.1080/14739879.2024.2372606. Epub 2024 Aug 23.","Lewis M","Educ Prim Care","2024","2024/08/23","","","10.1080/14739879.2024.2372606"
"39399661","Language-model-based patient embedding using electronic health records facilitates phenotyping, disease forecasting, and progression analysis","Xian S, Grabowska ME, Kullo IJ, Luo Y, Smoller JW, Wei WQ, Jarvik G, Mooney S, Crosslin D.","Res Sq [Preprint]. 2024 Sep 23:rs.3.rs-4708839. doi: 10.21203/rs.3.rs-4708839/v1.","Xian S","Res Sq","2024","2024/10/14","PMC11469380","","10.21203/rs.3.rs-4708839/v1"
"38032714","Can we use ChatGPT for Mental Health and Substance Use Education? Examining Its Quality and Potential Harms","Spallek S, Birrell L, Kershaw S, Devine EK, Thornton L.","JMIR Med Educ. 2023 Nov 30;9:e51243. doi: 10.2196/51243.","Spallek S","JMIR Med Educ","2023","2023/11/30","PMC10722374","","10.2196/51243"
"39454500","Advancing health coaching: A comparative study of large language model and health coaches","Ong QC, Ang CS, Chee DZY, Lawate A, Sundram F, Dalakoti M, Pasalic L, To D, Erlikh Fox T, Bojic I, Car J.","Artif Intell Med. 2024 Nov;157:103004. doi: 10.1016/j.artmed.2024.103004. Epub 2024 Oct 19.","Ong QC","Artif Intell Med","2024","2024/10/25","","","10.1016/j.artmed.2024.103004"
"39657144","ChatGPT May Improve Access to Language-Concordant Care for Patients With Non-English Language Preferences","Dzuali F, Seiger K, Novoa R, Aleshin M, Teng J, Lester J, Daneshjou R.","JMIR Med Educ. 2024 Dec 10;10:e51435. doi: 10.2196/51435.","Dzuali F","JMIR Med Educ","2024","2024/12/10","PMC11651640","","10.2196/51435"
"38481027","Disparities in seizure outcomes revealed by large language models","Xie K, Ojemann WKS, Gallagher RS, Shinohara RT, Lucas A, Hill CE, Hamilton RH, Johnson KB, Roth D, Litt B, Ellis CA.","J Am Med Inform Assoc. 2024 May 20;31(6):1348-1355. doi: 10.1093/jamia/ocae047.","Xie K","J Am Med Inform Assoc","2024","2024/03/14","PMC11105138","","10.1093/jamia/ocae047"
"40080818","Assessing Racial and Ethnic Bias in Text Generation by Large Language Models for Health Care-Related Tasks: Cross-Sectional Study","Hanna JJ, Wakene AD, Johnson AO, Lehmann CU, Medford RJ.","J Med Internet Res. 2025 Mar 13;27:e57257. doi: 10.2196/57257.","Hanna JJ","J Med Internet Res","2025","2025/03/13","PMC11950697","","10.2196/57257"
"39416584","Fairness in AI-Driven Oncology: Investigating Racial and Gender Biases in Large Language Models","Agrawal A.","Cureus. 2024 Sep 16;16(9):e69541. doi: 10.7759/cureus.69541. eCollection 2024 Sep.","Agrawal A","Cureus","2024","2024/10/17","PMC11482645","","10.7759/cureus.69541"
"38961161","Early detection of pediatric health risks using maternal and child health data","Ilin C.","Sci Rep. 2024 Jul 4;14(1):15350. doi: 10.1038/s41598-024-65449-8.","Ilin C","Sci Rep","2024","2024/07/03","PMC11222373","","10.1038/s41598-024-65449-8"
"38684792","Large language models leverage external knowledge to extend clinical insight beyond language boundaries","Wu J, Wu X, Qiu Z, Li M, Lin S, Zhang Y, Zheng Y, Yuan C, Yang J.","J Am Med Inform Assoc. 2024 Sep 1;31(9):2054-2064. doi: 10.1093/jamia/ocae079.","Wu J","J Am Med Inform Assoc","2024","2024/04/29","PMC11339525","","10.1093/jamia/ocae079"
"40069766","Knowledge, attitudes, and practices toward AI technology (ChatGPT) among nursing students at Palestinian universities","Salama N, Bsharat R, Alwawi A, Khlaif ZN.","BMC Nurs. 2025 Mar 11;24(1):269. doi: 10.1186/s12912-025-02913-4.","Salama N","BMC Nurs","2025","2025/03/12","PMC11895262","","10.1186/s12912-025-02913-4"
"39652394","Use of ChatGPT to Explore Gender and Geographic Disparities in Scientific Peer Review","Sebo P.","J Med Internet Res. 2024 Dec 9;26:e57667. doi: 10.2196/57667.","Sebo P","J Med Internet Res","2024","2024/12/09","PMC11667125","","10.2196/57667"
"39105505","Use of a large language model with instruction-tuning for reliable clinical frailty scoring","Kee XLJ, Sng GGR, Lim DYZ, Tung JYM, Abdullah HR, Chowdury AR.","J Am Geriatr Soc. 2024 Dec;72(12):3849-3854. doi: 10.1111/jgs.19114. Epub 2024 Aug 6.","Kee XLJ","J Am Geriatr Soc","2024","2024/08/06","","","10.1111/jgs.19114"
"39980823","Advancing Medical Research Through Artificial Intelligence: Progressive and Transformative Strategies: A Literature Review","Al-Qudimat AR, Fares ZE, Elaarag M, Osman M, Al-Zoubi RM, Aboumarzouk OM.","Health Sci Rep. 2025 Feb 19;8(2):e70200. doi: 10.1002/hsr2.70200. eCollection 2025 Feb.","Al-Qudimat AR","Health Sci Rep","2025","2025/02/21","PMC11839394","","10.1002/hsr2.70200"
"39365655","The Utility and Implications of Ambient Scribes in Primary Care","Seth P, Carretas R, Rudzicz F.","JMIR AI. 2024 Oct 4;3:e57673. doi: 10.2196/57673.","Seth P","JMIR AI","2024","2024/10/04","PMC11489790","","10.2196/57673"
"29966483","Spontaneous Labyrinthine Hemorrhage: A Case Series","Vivas EX, Panella NJ, Baugnon KL.","Otolaryngol Head Neck Surg. 2018 Nov;159(5):908-913. doi: 10.1177/0194599818785900. Epub 2018 Jul 3.","Vivas EX","Otolaryngol Head Neck Surg","2018","2018/07/04","","","10.1177/0194599818785900"
"39618089","Implications of Large Language Models for Clinical Practice: Ethical Analysis Through the Principlism Framework","Armitage RC.","J Eval Clin Pract. 2025 Feb;31(1):e14250. doi: 10.1111/jep.14250.","Armitage RC","J Eval Clin Pract","2025","2024/12/02","PMC11609490","","10.1111/jep.14250"
"40059391","The Need to Improve the Medical Subject Headings (MeSH) and the Excerpta Medica Tree (EMTREE) Thesauri to Perform Systematic Review on Oral Potentially Malignant Disorders","Caponio VCA, Musella G, Pérez-Sayáns M, Lo Muzio L, Amaral Mendes R, López-Pintor RM.","J Oral Pathol Med. 2025 Mar 9. doi: 10.1111/jop.13616. Online ahead of print.","Caponio VCA","J Oral Pathol Med","2025","2025/03/10","","","10.1111/jop.13616"
"39012633","Large Language Model-Based Responses to Patients' In-Basket Messages","Small WR, Wiesenfeld B, Brandfield-Harvey B, Jonassen Z, Mandal S, Stevens ER, Major VJ, Lostraglio E, Szerencsy A, Jones S, Aphinyanaphongs Y, Johnson SB, Nov O, Mann D.","JAMA Netw Open. 2024 Jul 1;7(7):e2422399. doi: 10.1001/jamanetworkopen.2024.22399.","Small WR","JAMA Netw Open","2024","2024/07/16","PMC11252893","","10.1001/jamanetworkopen.2024.22399"
"35084481","Examination of Stigmatizing Language in the Electronic Health Record","Himmelstein G, Bates D, Zhou L.","JAMA Netw Open. 2022 Jan 4;5(1):e2144967. doi: 10.1001/jamanetworkopen.2021.44967.","Himmelstein G","JAMA Netw Open","2022","2022/01/27","PMC8796019","","10.1001/jamanetworkopen.2021.44967"
"36451354","T1w/FLAIR ratio standardization as a myelin marker in MS patients","Cappelle S, Pareto D, Sunaert S, Smets I, Laenen A, Dubois B, Demaerel P.","Neuroimage Clin. 2022;36:103248. doi: 10.1016/j.nicl.2022.103248. Epub 2022 Oct 25.","Cappelle S","Neuroimage Clin","2022","2022/12/01","PMC9668645","","10.1016/j.nicl.2022.103248"
"38928668","Google Bard and ChatGPT in Orthopedics: Which Is the Better Doctor in Sports Medicine and Pediatric Orthopedics? The Role of AI in Patient Education","Giorgino R, Alessandri-Bonetti M, Del Re M, Verdoni F, Peretti GM, Mangiavini L.","Diagnostics (Basel). 2024 Jun 13;14(12):1253. doi: 10.3390/diagnostics14121253.","Giorgino R","Diagnostics (Basel)","2024","2024/06/27","PMC11202930","","10.3390/diagnostics14121253"
"39284061","On the development and validation of large language model-based classifiers for identifying social determinants of health","Gabriel RA, Litake O, Simpson S, Burton BN, Waterman RS, Macias AA.","Proc Natl Acad Sci U S A. 2024 Sep 24;121(39):e2320716121. doi: 10.1073/pnas.2320716121. Epub 2024 Sep 16.","Gabriel RA","Proc Natl Acad Sci U S A","2024","2024/09/16","PMC11441499","","10.1073/pnas.2320716121"
"37223985","Text Analysis of Trends in Health Equity and Disparities From the Internal Revenue Service Tax Documentation Submitted by US Nonprofit Hospitals Between 2010 and 2019: Exploratory Study","Hadley E, Marcial LH, Quattrone W, Bobashev G.","J Med Internet Res. 2023 May 24;25:e44330. doi: 10.2196/44330.","Hadley E","J Med Internet Res","2023","2023/05/24","PMC10248774","","10.2196/44330"
"40063081","Application of unified health large language model evaluation framework to In-Basket message replies: bridging qualitative and quantitative assessments","Hong C, Chowdhury A, Sorrentino AD, Wang H, Agrawal M, Bedoya A, Bessias S, Economou-Zavlanos NJ, Wong I, Pean C, Li F, Pollak KI, Poon EG, Pencina MJ.","J Am Med Inform Assoc. 2025 Mar 10:ocaf023. doi: 10.1093/jamia/ocaf023. Online ahead of print.","Hong C","J Am Med Inform Assoc","2025","2025/03/10","","","10.1093/jamia/ocaf023"
"37553439","ThoughtSource: A central hub for large language model reasoning data","Ott S, Hebenstreit K, Liévin V, Hother CE, Moradi M, Mayrhauser M, Praas R, Winther O, Samwald M.","Sci Data. 2023 Aug 8;10(1):528. doi: 10.1038/s41597-023-02433-3.","Ott S","Sci Data","2023","2023/08/08","PMC10409727","","10.1038/s41597-023-02433-3"
"39001657","Enhancing Care for Older Adults and Dementia Patients With Large Language Models: Proceedings of the National Institute on Aging-Artificial Intelligence & Technology Collaboratory for Aging Research Symposium","Abadir PM, Battle A, Walston JD, Chellappa R.","J Gerontol A Biol Sci Med Sci. 2024 Sep 1;79(9):glae176. doi: 10.1093/gerona/glae176.","Abadir PM","J Gerontol A Biol Sci Med Sci","2024","2024/07/13","PMC11341983","","10.1093/gerona/glae176"
"39365643","Engine of Innovation in Hospital Pharmacy: Applications and Reflections of ChatGPT","Li X, Guo H, Li D, Zheng Y.","J Med Internet Res. 2024 Oct 4;26:e51635. doi: 10.2196/51635.","Li X","J Med Internet Res","2024","2024/10/04","PMC11489799","","10.2196/51635"
"39228726","Generative Large Language Models in Electronic Health Records for Patient Care Since 2023: A Systematic Review","Du X, Zhou Z, Wang Y, Chuang YW, Yang R, Zhang W, Wang X, Zhang R, Hong P, Bates DW, Zhou L.","medRxiv [Preprint]. 2024 Aug 19:2024.08.11.24311828. doi: 10.1101/2024.08.11.24311828.","Du X","medRxiv","2024","2024/09/04","PMC11370524","","10.1101/2024.08.11.24311828"
"39823022","Artificial Intelligence Scribe and Large Language Model Technology in Healthcare Documentation: Advantages, Limitations, and Recommendations","Mess SA, Mackey AJ, Yarowsky DE.","Plast Reconstr Surg Glob Open. 2025 Jan 16;13(1):e6450. doi: 10.1097/GOX.0000000000006450. eCollection 2025 Jan.","Mess SA","Plast Reconstr Surg Glob Open","2025","2025/01/17","PMC11737491","","10.1097/GOX.0000000000006450"
"37480515","Non-response Bias in Social Risk Factor Screening Among Adult Emergency Department Patients","Vest JR, Mazurenko O.","J Med Syst. 2023 Jul 22;47(1):78. doi: 10.1007/s10916-023-01975-8.","Vest JR","J Med Syst","2023","2023/07/22","PMC10439727","NIHMS1922222","10.1007/s10916-023-01975-8"
"38224784","Proceedings from the inaugural Artificial Intelligence in Primary Immune Deficiencies (AIPID) conference","Rivière JG, Soler Palacín P, Butte MJ.","J Allergy Clin Immunol. 2024 Mar;153(3):637-642. doi: 10.1016/j.jaci.2024.01.002. Epub 2024 Jan 13.","Rivière JG","J Allergy Clin Immunol","2024","2024/01/15","PMC11402388","NIHMS2020912","10.1016/j.jaci.2024.01.002"
"38642997","Distributions of recorded pain in mental health records: a natural language processing based study","Chaturvedi J, Stewart R, Ashworth M, Roberts A.","BMJ Open. 2024 Apr 19;14(4):e079923. doi: 10.1136/bmjopen-2023-079923.","Chaturvedi J","BMJ Open","2024","2024/04/20","PMC11033644","","10.1136/bmjopen-2023-079923"
"39953146","Improving medical machine learning models with generative balancing for equity and excellence","Theodorou B, Danek B, Tummala V, Kumar SP, Malin B, Sun J.","NPJ Digit Med. 2025 Feb 14;8(1):100. doi: 10.1038/s41746-025-01438-z.","Theodorou B","NPJ Digit Med","2025","2025/02/14","PMC11828851","","10.1038/s41746-025-01438-z"
"38688841","The Evaluation of Generative AI Should Include Repetition to Assess Stability","Zhu L, Mou W, Hong C, Yang T, Lai Y, Qi C, Lin A, Zhang J, Luo P.","JMIR Mhealth Uhealth. 2024 May 6;12:e57978. doi: 10.2196/57978.","Zhu L","JMIR Mhealth Uhealth","2024","2024/04/30","PMC11106698","","10.2196/57978"
"33936440","Facilitating information extraction without annotated data using unsupervised and positive-unlabeled learning","Korach ZT, Yerneni S, Einbinder J, Kallenberg C, Zhou L.","AMIA Annu Symp Proc. 2021 Jan 25;2020:658-667. eCollection 2020.","Korach ZT","AMIA Annu Symp Proc","2021","2021/05/03","PMC8075513","",""
"39347259","Artificial Intelligence-Powered Surgical Consent: Patient Insights","Teasdale A, Mills L, Costello R.","Cureus. 2024 Aug 29;16(8):e68134. doi: 10.7759/cureus.68134. eCollection 2024 Aug.","Teasdale A","Cureus","2024","2024/09/30","PMC11438496","","10.7759/cureus.68134"
"37790442","Disparities in seizure outcomes revealed by large language models","Xie K, Ojemann WKS, Gallagher RS, Lucas A, Hill CE, Hamilton RH, Johnson KB, Roth D, Litt B, Ellis CA.","medRxiv [Preprint]. 2023 Sep 22:2023.09.20.23295842. doi: 10.1101/2023.09.20.23295842.","Xie K","medRxiv","2023","2023/10/04","PMC10543059","","10.1101/2023.09.20.23295842"
