PMID,Title,Authors,Citation,First Author,Journal/Book,Publication Year,Create Date,PMCID,NIHMS ID,DOI
"37438534","Large language models encode clinical knowledge","Singhal K, Azizi S, Tu T, Mahdavi SS, Wei J, Chung HW, Scales N, Tanwani A, Cole-Lewis H, Pfohl S, Payne P, Seneviratne M, Gamble P, Kelly C, Babiker A, Schärli N, Chowdhery A, Mansfield P, Demner-Fushman D, Agüera Y Arcas B, Webster D, Corrado GS, Matias Y, Chou K, Gottweis J, Tomasev N, Liu Y, Rajkomar A, Barral J, Semturs C, Karthikesalingam A, Natarajan V.","Nature. 2023 Aug;620(7972):172-180. doi: 10.1038/s41586-023-06291-2. Epub 2023 Jul 12.","Singhal K","Nature","2023","2023/07/12","PMC10396962","","10.1038/s41586-023-06291-2"
"37566454","Ethical Considerations of Using ChatGPT in Health Care","Wang C, Liu S, Yang H, Guo J, Wu Y, Liu J.","J Med Internet Res. 2023 Aug 11;25:e48009. doi: 10.2196/48009.","Wang C","J Med Internet Res","2023","2023/08/11","PMC10457697","","10.2196/48009"
"37824352","ChatGPT: ethical concerns and challenges in academics and research","Guleria A, Krishan K, Sharma V, Kanchan T.","J Infect Dev Ctries. 2023 Sep 30;17(9):1292-1299. doi: 10.3855/jidc.18738.","Guleria A","J Infect Dev Ctries","2023","2023/10/12","","","10.3855/jidc.18738"
"37874780","Centering health equity in large language model deployment","Singh N, Lawrence K, Richardson S, Mann DM.","PLOS Digit Health. 2023 Oct 24;2(10):e0000367. doi: 10.1371/journal.pdig.0000367. eCollection 2023 Oct.","Singh N","PLOS Digit Health","2023","2023/10/24","PMC10597518","","10.1371/journal.pdig.0000367"
"37261894","Large Language Models in Medical Education: Opportunities, Challenges, and Future Directions","Abd-Alrazaq A, AlSaad R, Alhuwail D, Ahmed A, Healy PM, Latifi S, Aziz S, Damseh R, Alabed Alrazak S, Sheikh J.","JMIR Med Educ. 2023 Jun 1;9:e48291. doi: 10.2196/48291.","Abd-Alrazaq A","JMIR Med Educ","2023","2023/06/01","PMC10273039","","10.2196/48291"
"39974299","DeepSeek in Healthcare: Revealing Opportunities and Steering Challenges of a New Open-Source Artificial Intelligence Frontier","Temsah A, Alhasan K, Altamimi I, Jamal A, Al-Eyadhy A, Malki KH, Temsah MH.","Cureus. 2025 Feb 18;17(2):e79221. doi: 10.7759/cureus.79221. eCollection 2025 Feb.","Temsah A","Cureus","2025","2025/02/20","PMC11836063","","10.7759/cureus.79221"
"37515957","Revolutionizing nursing education through Ai integration: A reflection on the disruptive impact of ChatGPT","Castonguay A, Farthing P, Davies S, Vogelsang L, Kleib M, Risling T, Green N.","Nurse Educ Today. 2023 Oct;129:105916. doi: 10.1016/j.nedt.2023.105916. Epub 2023 Jul 18.","Castonguay A","Nurse Educ Today","2023","2023/07/29","","","10.1016/j.nedt.2023.105916"
"38776081","Assessing the Risk of Bias in Randomized Clinical Trials With Large Language Models","Lai H, Ge L, Sun M, Pan B, Huang J, Hou L, Yang Q, Liu J, Liu J, Ye Z, Xia D, Zhao W, Wang X, Liu M, Talukdar JR, Tian J, Yang K, Estill J.","JAMA Netw Open. 2024 May 1;7(5):e2412687. doi: 10.1001/jamanetworkopen.2024.12687.","Lai H","JAMA Netw Open","2024","2024/05/22","PMC11112444","","10.1001/jamanetworkopen.2024.12687"
"38214966","Automated Paper Screening for Clinical Reviews Using Large Language Models: Data Analysis Study","Guo E, Gupta M, Deng J, Park YJ, Paget M, Naugler C.","J Med Internet Res. 2024 Jan 12;26:e48996. doi: 10.2196/48996.","Guo E","J Med Internet Res","2024","2024/01/12","PMC10818236","","10.2196/48996"
"37976385","ChatGPT's Ability to Assist with Clinical Documentation: A Randomized Controlled Trial","Baker HP, Dwyer E, Kalidoss S, Hynes K, Wolf J, Strelzow JA.","J Am Acad Orthop Surg. 2024 Feb 1;32(3):123-129. doi: 10.5435/JAAOS-D-23-00474. Epub 2023 Nov 17.","Baker HP","J Am Acad Orthop Surg","2024","2023/11/17","","","10.5435/JAAOS-D-23-00474"
"38506920","Incorporating ChatGPT in Medical Informatics Education: Mixed Methods Study on Student Perceptions and Experiential Integration Proposals","Magalhães Araujo S, Cruz-Correia R.","JMIR Med Educ. 2024 Mar 20;10:e51151. doi: 10.2196/51151.","Magalhães Araujo S","JMIR Med Educ","2024","2024/03/20","PMC10993110","","10.2196/51151"
"38145471","AI-Enabled Medical Education: Threads of Change, Promising Futures, and Risky Realities Across Four Potential Future Worlds","Knopp MI, Warm EJ, Weber D, Kelleher M, Kinnear B, Schumacher DJ, Santen SA, Mendonça E, Turner L.","JMIR Med Educ. 2023 Dec 25;9:e50373. doi: 10.2196/50373.","Knopp MI","JMIR Med Educ","2023","2023/12/25","PMC10786199","","10.2196/50373"
"38123252","Assessing the potential of GPT-4 to perpetuate racial and gender biases in health care: a model evaluation study","Zack T, Lehman E, Suzgun M, Rodriguez JA, Celi LA, Gichoya J, Jurafsky D, Szolovits P, Bates DW, Abdulnour RE, Butte AJ, Alsentzer E.","Lancet Digit Health. 2024 Jan;6(1):e12-e22. doi: 10.1016/S2589-7500(23)00225-X.","Zack T","Lancet Digit Health","2024","2023/12/20","","","10.1016/S2589-7500(23)00225-X"
"38446502","Readability and Health Literacy Scores for ChatGPT-Generated Dermatology Public Education Materials: Cross-Sectional Analysis of Sunscreen and Melanoma Questions","Roster K, Kann RB, Farabi B, Gronbeck C, Brownstone N, Lipner SR.","JMIR Dermatol. 2024 Mar 6;7:e50163. doi: 10.2196/50163.","Roster K","JMIR Dermatol","2024","2024/03/06","PMC10955394","","10.2196/50163"
"37692694","ChatGPT and Artificial Intelligence in Medical Writing: Concerns and Ethical Considerations","Doyal AS, Sender D, Nanda M, Serrano RA.","Cureus. 2023 Aug 10;15(8):e43292. doi: 10.7759/cureus.43292. eCollection 2023 Aug.","Doyal AS","Cureus","2023","2023/09/11","PMC10492634","","10.7759/cureus.43292"
"36346105","Discrimination and Suicidality Among Hispanic Mental Health Patients, 2010-2020: A Natural Language Processing Approach","Goldstein EV, Bailey EV, Wilson FA.","Psychiatr Serv. 2022 Nov 1;73(11):1313-1314. doi: 10.1176/appi.ps.20220240.","Goldstein EV","Psychiatr Serv","2022","2022/11/08","","","10.1176/appi.ps.20220240"
"31241574","Algorithmic Bias and Computer-Assisted Scoring of Patient Notes in the USMLE Step 2 Clinical Skills Exam","Spadafore M, Monrad SU.","Acad Med. 2019 Jul;94(7):926. doi: 10.1097/ACM.0000000000002746.","Spadafore M","Acad Med","2019","2019/06/27","","","10.1097/ACM.0000000000002746"
"37644945","Harnessing the Power of Large Language Models (LLMs) for Electronic Health Records (EHRs) Optimization","Nashwan AJ, AbuJaber AA.","Cureus. 2023 Jul 29;15(7):e42634. doi: 10.7759/cureus.42634. eCollection 2023 Jul.","Nashwan AJ","Cureus","2023","2023/08/30","PMC10461074","","10.7759/cureus.42634"
"37203482","Health-Related Content in Transformer-Based Language Models: Exploring Bias in Domain General vs. Domain Specific Training Sets","Samo G, Bonan C.","Stud Health Technol Inform. 2023 May 18;302:743-744. doi: 10.3233/SHTI230252.","Samo G","Stud Health Technol Inform","2023","2023/05/19","","","10.3233/SHTI230252"
"37465807","Harnessing Large Language Models in Nursing Care Planning: Opportunities, Challenges, and Ethical Considerations","Nashwan AJ, Abujaber AA.","Cureus. 2023 Jun 16;15(6):e40542. doi: 10.7759/cureus.40542. eCollection 2023 Jun.","Nashwan AJ","Cureus","2023","2023/07/19","PMC10350541","","10.7759/cureus.40542"
"37972180","Humans are biocultural, science should be too","Fuentes A.","Science. 2023 Nov 17;382(6672):eadl1517. doi: 10.1126/science.adl1517. Epub 2023 Nov 17.","Fuentes A","Science","2023","2023/11/16","","","10.1126/science.adl1517"
"39023885","Development and Evaluation of a Retrieval-Augmented Large Language Model Framework for Ophthalmology","Luo MJ, Pang J, Bi S, Lai Y, Zhao J, Shang Y, Cui T, Yang Y, Lin Z, Zhao L, Wu X, Lin D, Chen J, Lin H.","JAMA Ophthalmol. 2024 Sep 1;142(9):798-805. doi: 10.1001/jamaophthalmol.2024.2513.","Luo MJ","JAMA Ophthalmol","2024","2024/07/18","PMC11258636","","10.1001/jamaophthalmol.2024.2513"
"38107365","Artificial Intelligence: Impact and Challenges to Authors, Journals and Medical Publishing","Peh W, Saw A.","Malays Orthop J. 2023 Nov;17(3):1-4. doi: 10.5704/MOJ.2311.001.","Peh W","Malays Orthop J","2023","2023/12/18","PMC10723007","","10.5704/MOJ.2311.001"
"39359332","OpenAI o1-Preview vs. ChatGPT in Healthcare: A New Frontier in Medical AI Reasoning","Temsah MH, Jamal A, Alhasan K, Temsah AA, Malki KH.","Cureus. 2024 Oct 1;16(10):e70640. doi: 10.7759/cureus.70640. eCollection 2024 Oct.","Temsah MH","Cureus","2024","2024/10/03","PMC11444422","","10.7759/cureus.70640"
"37268890","An analysis of entity normalization evaluation biases in specialized domains","Ferré A, Langlais P.","BMC Bioinformatics. 2023 Jun 2;24(1):227. doi: 10.1186/s12859-023-05350-9.","Ferré A","BMC Bioinformatics","2023","2023/06/02","PMC10236701","","10.1186/s12859-023-05350-9"
"38712148","A Systematic Review of ChatGPT and Other Conversational Large Language Models in Healthcare","Wang L, Wan Z, Ni C, Song Q, Li Y, Clayton EW, Malin BA, Yin Z.","medRxiv [Preprint]. 2024 Apr 27:2024.04.26.24306390. doi: 10.1101/2024.04.26.24306390.","Wang L","medRxiv","2024","2024/05/07","PMC11071576","","10.1101/2024.04.26.24306390"
"38231545","ChatGPT in Medical Education: A Precursor for Automation Bias?","Nguyen T.","JMIR Med Educ. 2024 Jan 17;10:e50174. doi: 10.2196/50174.","Nguyen T","JMIR Med Educ","2024","2024/01/17","PMC10831594","","10.2196/50174"
"38144532","Corrigendum: Commentary: AI-based online chat and the future of oncology care: a promising technology or a solution in search of a problem?","Zhang H, Guan Y, Chen J, Tong W.","Front Oncol. 2023 Dec 7;13:1334176. doi: 10.3389/fonc.2023.1334176. eCollection 2023.","Zhang H","Front Oncol","2023","2023/12/25","PMC10746848","","10.3389/fonc.2023.1334176"
"37904073","Chatting Beyond ChatGPT: Advancing Equity Through AI-Driven Language Interpretation","Bakdash L, Abid A, Gourisankar A, Henry TL.","J Gen Intern Med. 2024 Feb;39(3):492-495. doi: 10.1007/s11606-023-08497-6. Epub 2023 Oct 30.","Bakdash L","J Gen Intern Med","2024","2023/10/31","PMC10897100","","10.1007/s11606-023-08497-6"
"39864170","Responsible Design, Integration, and Use of Generative AI in Mental Health","Asman O, Torous J, Tal A.","JMIR Ment Health. 2025 Jan 20;12:e70439. doi: 10.2196/70439.","Asman O","JMIR Ment Health","2025","2025/01/26","PMC11769776","","10.2196/70439"
"37949485","ChatGPT and mental healthcare: balancing benefits with risks of harms","Blease C, Torous J.","BMJ Ment Health. 2023 Nov;26(1):e300884. doi: 10.1136/bmjment-2023-300884.","Blease C","BMJ Ment Health","2023","2023/11/10","PMC10649440","","10.1136/bmjment-2023-300884"
"37440696","What Should ChatGPT Mean for Bioethics?","Cohen IG.","Am J Bioeth. 2023 Oct;23(10):8-16. doi: 10.1080/15265161.2023.2233357. Epub 2023 Jul 13.","Cohen IG","Am J Bioeth","2023","2023/07/13","","","10.1080/15265161.2023.2233357"
"37494894","Diagnostic and Management Performance of ChatGPT in Obstetrics and Gynecology","Allahqoli L, Ghiasvand MM, Mazidimoradi A, Salehiniya H, Alkatout I.","Gynecol Obstet Invest. 2023;88(5):310-313. doi: 10.1159/000533177. Epub 2023 Jul 26.","Allahqoli L","Gynecol Obstet Invest","2023","2023/07/26","","","10.1159/000533177"
"33989164","Authors' Reply to: Minimizing Selection and Classification Biases Comment on ""Clinical Characteristics and Prognostic Factors for Intensive Care Unit Admission of Patients With COVID-19: Retrospective Study Using Machine Learning and Natural Language Processing""","Izquierdo JL, Soriano JB.","J Med Internet Res. 2021 May 26;23(5):e29405. doi: 10.2196/29405.","Izquierdo JL","J Med Internet Res","2021","2021/05/14","PMC8190644","","10.2196/29405"
"33989163","Minimizing Selection and Classification Biases. Comment on ""Clinical Characteristics and Prognostic Factors for Intensive Care Unit Admission of Patients With COVID-19: Retrospective Study Using Machine Learning and Natural Language Processing""","Martos Pérez F, Gomez Huelgas R, Martín Escalante MD, Casas Rojo JM.","J Med Internet Res. 2021 May 26;23(5):e27142. doi: 10.2196/27142.","Martos Pérez F","J Med Internet Res","2021","2021/05/14","PMC8190647","","10.2196/27142"
"35738008","Natural Language Processing and Psychosis: On the Need for Comprehensive Psychometric Evaluation","Cohen AS, Rodriguez Z, Warren KK, Cowan T, Masucci MD, Edvard Granrud O, Holmlund TB, Chandler C, Foltz PW, Strauss GP.","Schizophr Bull. 2022 Sep 1;48(5):939-948. doi: 10.1093/schbul/sbac051.","Cohen AS","Schizophr Bull","2022","2022/06/23","PMC9434462","","10.1093/schbul/sbac051"
"37694729","Validity of the large language model ChatGPT (GPT4) as a patient information source in otolaryngology by a variety of doctors in a tertiary otorhinolaryngology department","Nielsen JPS, von Buchwald C, Grønhøj C.","Acta Otolaryngol. 2023 Sep;143(9):779-782. doi: 10.1080/00016489.2023.2254809. Epub 2023 Sep 11.","Nielsen JPS","Acta Otolaryngol","2023","2023/09/11","","","10.1080/00016489.2023.2254809"
"37699647","ChatGPT and Patient Information in Nuclear Medicine: GPT-3.5 Versus GPT-4","Currie G, Robbie S, Tually P.","J Nucl Med Technol. 2023 Dec 5;51(4):307-313. doi: 10.2967/jnmt.123.266151.","Currie G","J Nucl Med Technol","2023","2023/09/12","","","10.2967/jnmt.123.266151"
"38188345","The opportunities and challenges of adopting ChatGPT in medical research","Alsadhan A, Al-Anezi F, Almohanna A, Alnaim N, Alzahrani H, Shinawi R, AboAlsamh H, Bakhshwain A, Alenazy M, Arif W, Alyousef S, Alhamidi S, Alghamdi A, AlShrayfi N, Rubaian NB, Alanzi T, AlSahli A, Alturki R, Herzallah N.","Front Med (Lausanne). 2023 Dec 22;10:1259640. doi: 10.3389/fmed.2023.1259640. eCollection 2023.","Alsadhan A","Front Med (Lausanne)","2023","2024/01/08","PMC10766839","","10.3389/fmed.2023.1259640"
"39476977","Assessing the diagnostic performance of ChatGPT in dermatology across Fitzpatrick phototypes and skin of color","Lau CB, Kwa M, Shen L, Smith GP.","J Am Acad Dermatol. 2025 Mar;92(3):578-579. doi: 10.1016/j.jaad.2024.10.038. Epub 2024 Oct 28.","Lau CB","J Am Acad Dermatol","2025","2024/10/30","","","10.1016/j.jaad.2024.10.038"
"39443582","Large language model use in clinical oncology","Carl N, Schramm F, Haggenmüller S, Kather JN, Hetz MJ, Wies C, Michel MS, Wessels F, Brinker TJ.","NPJ Precis Oncol. 2024 Oct 23;8(1):240. doi: 10.1038/s41698-024-00733-4.","Carl N","NPJ Precis Oncol","2024","2024/10/24","PMC11499929","","10.1038/s41698-024-00733-4"
"37485160","Eyes on AI: ChatGPT's Transformative Potential Impact on Ophthalmology","Dossantos J, An J, Javan R.","Cureus. 2023 Jun 21;15(6):e40765. doi: 10.7759/cureus.40765. eCollection 2023 Jun.","Dossantos J","Cureus","2023","2023/07/24","PMC10362525","","10.7759/cureus.40765"
"31671140","An exploration of automated narrative analysis via machine learning","Jones S, Fox C, Gillam S, Gillam RB.","PLoS One. 2019 Oct 31;14(10):e0224634. doi: 10.1371/journal.pone.0224634. eCollection 2019.","Jones S","PLoS One","2019","2019/11/01","PMC6822746","","10.1371/journal.pone.0224634"
"38453475","Central vein sign and trigeminal lesions of multiple sclerosis visualised by 7T MRI","Jing J, Zhang Z, Su L, Gao C, Guo A, Liu X, Wang H, Zhang X, Liu Y, Comi G, Waubant E, Shi FD, Tian DC.","J Neurol Neurosurg Psychiatry. 2024 Jul 15;95(8):761-766. doi: 10.1136/jnnp-2023-332566.","Jing J","J Neurol Neurosurg Psychiatry","2024","2024/03/07","PMC11287640","","10.1136/jnnp-2023-332566"
"34224606","Gender bias in resident evaluations: Natural language processing and competency evaluation","Andrews J, Chartash D, Hay S.","Med Educ. 2021 Dec;55(12):1383-1387. doi: 10.1111/medu.14593. Epub 2021 Jul 30.","Andrews J","Med Educ","2021","2021/07/05","","","10.1111/medu.14593"
"38361805","ChatGPT and mental health: Friends or foes?","Kalam KT, Rahman JM, Islam MR, Dewan SMR.","Health Sci Rep. 2024 Feb 15;7(2):e1912. doi: 10.1002/hsr2.1912. eCollection 2024 Feb.","Kalam KT","Health Sci Rep","2024","2024/02/16","PMC10867692","","10.1002/hsr2.1912"
"34709718","Risk of bias assessment in preclinical literature using natural language processing","Wang Q, Liao J, Lapata M, Macleod M.","Res Synth Methods. 2022 May;13(3):368-380. doi: 10.1002/jrsm.1533. Epub 2021 Nov 5.","Wang Q","Res Synth Methods","2022","2021/10/28","PMC9298308","","10.1002/jrsm.1533"
"38200151","Large language models to identify social determinants of health in electronic health records","Guevara M, Chen S, Thomas S, Chaunzwa TL, Franco I, Kann BH, Moningi S, Qian JM, Goldstein M, Harper S, Aerts HJWL, Catalano PJ, Savova GK, Mak RH, Bitterman DS.","NPJ Digit Med. 2024 Jan 11;7(1):6. doi: 10.1038/s41746-023-00970-0.","Guevara M","NPJ Digit Med","2024","2024/01/10","PMC10781957","","10.1038/s41746-023-00970-0"
"37352529","ChatGPT encounters multiple opportunities and challenges in neurosurgery","Kuang YR, Zou MX, Niu HQ, Zheng BY, Zhang TL, Zheng BW.","Int J Surg. 2023 Oct 1;109(10):2886-2891. doi: 10.1097/JS9.0000000000000571.","Kuang YR","Int J Surg","2023","2023/06/23","PMC10583932","","10.1097/JS9.0000000000000571"
"39541580","Economics and Equity of Large Language Models: Health Care Perspective","Nagarajan R, Kondo M, Salas F, Sezgin E, Yao Y, Klotzman V, Godambe SA, Khan N, Limon A, Stephenson G, Taraman S, Walton N, Ehwerhemuepha L, Pandit J, Pandita D, Weiss M, Golden C, Gold A, Henderson J, Shippy A, Celi LA, Hogan WR, Oermann EK, Sanger T, Martel S.","J Med Internet Res. 2024 Nov 14;26:e64226. doi: 10.2196/64226.","Nagarajan R","J Med Internet Res","2024","2024/11/14","PMC11605263","","10.2196/64226"
"37128554","Natural language processing to identify reasons for sex disparity in statin prescriptions","Witting C, Azizi Z, Gomez SE, Zammit A, Sarraju A, Ngo S, Hernandez-Boussard T, Rodriguez F.","Am J Prev Cardiol. 2023 Apr 11;14:100496. doi: 10.1016/j.ajpc.2023.100496. eCollection 2023 Jun.","Witting C","Am J Prev Cardiol","2023","2023/05/02","PMC10147966","","10.1016/j.ajpc.2023.100496"
"38153778","Empathy and Equity: Key Considerations for Large Language Model Adoption in Health Care","Koranteng E, Rao A, Flores E, Lev M, Landman A, Dreyer K, Succi M.","JMIR Med Educ. 2023 Dec 28;9:e51199. doi: 10.2196/51199.","Koranteng E","JMIR Med Educ","2023","2023/12/28","PMC10884892","","10.2196/51199"
"37271011","ChatGPT in medical imaging higher education","Currie G, Singh C, Nelson T, Nabasenja C, Al-Hayek Y, Spuur K.","Radiography (Lond). 2023 Jul;29(4):792-799. doi: 10.1016/j.radi.2023.05.011. Epub 2023 Jun 2.","Currie G","Radiography (Lond)","2023","2023/06/04","","","10.1016/j.radi.2023.05.011"
"36706848","DR.BENCH: Diagnostic Reasoning Benchmark for Clinical Natural Language Processing","Gao Y, Dligach D, Miller T, Caskey J, Sharma B, Churpek MM, Afshar M.","J Biomed Inform. 2023 Feb;138:104286. doi: 10.1016/j.jbi.2023.104286. Epub 2023 Jan 25.","Gao Y","J Biomed Inform","2023","2023/01/27","PMC9993808","NIHMS1868157","10.1016/j.jbi.2023.104286"
"39010845","Gender-based linguistic differences in letters of recommendation for rhinology fellowship over time: A dual-institutional follow-up study using natural language processing and deep learning","Vasan V, Cheng CP, Edalati S, Mandloi S, Lerner DK, Del Signore A, Schaberg M, Govindaraj S, Rabinowitz M, Nyquist G, Iloreta AM.","Int Forum Allergy Rhinol. 2024 Nov;14(11):1814-1817. doi: 10.1002/alr.23411. Epub 2024 Jul 16.","Vasan V","Int Forum Allergy Rhinol","2024","2024/07/16","","","10.1002/alr.23411"
"37387067","Revolutionizing Healthcare with Foundation AI Models","Ali H, Qadir J, Alam T, Househ M, Shah Z.","Stud Health Technol Inform. 2023 Jun 29;305:469-470. doi: 10.3233/SHTI230533.","Ali H","Stud Health Technol Inform","2023","2023/06/30","","","10.3233/SHTI230533"
"39773666","Revolutionizing Health Care: The Transformative Impact of Large Language Models in Medicine","Zhang K, Meng X, Yan X, Ji J, Liu J, Xu H, Zhang H, Liu D, Wang J, Wang X, Gao J, Wang YG, Shao C, Wang W, Li J, Zheng MQ, Yang Y, Tang YD.","J Med Internet Res. 2025 Jan 7;27:e59069. doi: 10.2196/59069.","Zhang K","J Med Internet Res","2025","2025/01/08","PMC11751657","","10.2196/59069"
"34918101","Gender-sensitive word embeddings for healthcare","Agmon S, Gillis P, Horvitz E, Radinsky K.","J Am Med Inform Assoc. 2022 Jan 29;29(3):415-423. doi: 10.1093/jamia/ocab279.","Agmon S","J Am Med Inform Assoc","2022","2021/12/17","PMC8800511","","10.1093/jamia/ocab279"
"37369892","Relief in Sight? Chatbots, In-baskets, and the Overwhelmed Primary Care Clinician","Matulis J, McCoy R.","J Gen Intern Med. 2023 Sep;38(12):2808-2815. doi: 10.1007/s11606-023-08271-8. Epub 2023 Jun 27.","Matulis J","J Gen Intern Med","2023","2023/06/27","PMC10506981","","10.1007/s11606-023-08271-8"
"38925234","The Large Language Model ChatGPT-4 Exhibits Excellent Triage Capabilities and Diagnostic Performance for Patients Presenting With Various Causes of Knee Pain","Kunze KN, Varady NH, Mazzucco M, Lu AZ, Chahla J, Martin RK, Ranawat AS, Pearle AD, Williams RJ 3rd.","Arthroscopy. 2024 Jun 24:S0749-8063(24)00456-0. doi: 10.1016/j.arthro.2024.06.021. Online ahead of print.","Kunze KN","Arthroscopy","2024","2024/06/26","","","10.1016/j.arthro.2024.06.021"
"37510487","ChatGPT Knowledge Evaluation in Basic and Clinical Medical Sciences: Multiple Choice Question Examination-Based Performance","Meo SA, Al-Masri AA, Alotaibi M, Meo MZS, Meo MOS.","Healthcare (Basel). 2023 Jul 17;11(14):2046. doi: 10.3390/healthcare11142046.","Meo SA","Healthcare (Basel)","2023","2023/07/29","PMC10379728","","10.3390/healthcare11142046"
"40142791","Breaking Bones, Breaking Barriers: ChatGPT, DeepSeek, and Gemini in Hand Fracture Management","Marcaccini G, Seth I, Xie Y, Susini P, Pozzi M, Cuomo R, Rozen WM.","J Clin Med. 2025 Mar 14;14(6):1983. doi: 10.3390/jcm14061983.","Marcaccini G","J Clin Med","2025","2025/03/27","PMC11942733","","10.3390/jcm14061983"
"37254486","Correspondence on Letter 1 regarding ""Assessing the performance of ChatGPT in answering questions regarding cirrhosis and hepatocellular carcinoma""","Yeo YH, Samaan JS, Ng WH.","Clin Mol Hepatol. 2023 Jul;29(3):821-822. doi: 10.3350/cmh.2023.0183. Epub 2023 May 31.","Yeo YH","Clin Mol Hepatol","2023","2023/05/31","PMC10366788","","10.3350/cmh.2023.0183"
"39715549","Reassessing AI in Medicine: Exploring the Capabilities of AI in Academic Abstract Synthesis","Wang Z, Zhou C.","J Med Internet Res. 2024 Dec 23;26:e55920. doi: 10.2196/55920.","Wang Z","J Med Internet Res","2024","2024/12/23","PMC11734639","","10.2196/55920"
"37516680","ChatGPT and Clinical Decision Support: Scope, Application, and Limitations","Ferdush J, Begum M, Hossain ST.","Ann Biomed Eng. 2024 May;52(5):1119-1124. doi: 10.1007/s10439-023-03329-4. Epub 2023 Jul 29.","Ferdush J","Ann Biomed Eng","2024","2023/07/29","","","10.1007/s10439-023-03329-4"
"38942593","Large language model-driven sentiment analysis for facilitating fibromyalgia diagnosis","Venerito V, Iannone F.","RMD Open. 2024 Jun 28;10(2):e004367. doi: 10.1136/rmdopen-2024-004367.","Venerito V","RMD Open","2024","2024/06/28","PMC11227845","","10.1136/rmdopen-2024-004367"
"38726506","ChatGPT's performance in dentistry and allergyimmunology assessments: a comparative study","Fuchs A, Trachsel T, Weiger R, Eggmann F.","Swiss Dent J. 2023 Oct 4;134(2):1-17. doi: 10.61872/sdj-2024-06-01.","Fuchs A","Swiss Dent J","2023","2024/05/10","","","10.61872/sdj-2024-06-01"
"40053403","Health equity in the era of large language models","Tierney AA, Reed ME, Grant RW, Doo FX, Payán DD, Liu VX.","Am J Manag Care. 2025 Mar;31(3):112-117. doi: 10.37765/ajmc.2025.89695.","Tierney AA","Am J Manag Care","2025","2025/03/07","","","10.37765/ajmc.2025.89695"
"40038550","Physician clinical decision modification and bias assessment in a randomized controlled trial of AI assistance","Goh E, Bunning B, Khoong EC, Gallo RJ, Milstein A, Centola D, Chen JH.","Commun Med (Lond). 2025 Mar 4;5(1):59. doi: 10.1038/s43856-025-00781-2.","Goh E","Commun Med (Lond)","2025","2025/03/04","PMC11880198","","10.1038/s43856-025-00781-2"
"38739445","Potential of Large Language Models in Health Care: Delphi Study","Denecke K, May R; LLMHealthGroup; Rivera Romero O.","J Med Internet Res. 2024 May 13;26:e52399. doi: 10.2196/52399.","Denecke K","J Med Internet Res","2024","2024/05/13","PMC11130776","","10.2196/52399"
"38717811","ChatGPT as a Tool for Medical Education and Clinical Decision-Making on the Wards: Case Study","Skryd A, Lawrence K.","JMIR Form Res. 2024 May 8;8:e51346. doi: 10.2196/51346.","Skryd A","JMIR Form Res","2024","2024/05/08","PMC11112466","","10.2196/51346"
"37235847","Natural Language Processing Methods to Empirically Explore Social Contexts and Needs in Cancer Patient Notes","Derton A, Guevara M, Chen S, Moningi S, Kozono DE, Liu D, Miller TA, Savova GK, Mak RH, Bitterman DS.","JCO Clin Cancer Inform. 2023 May;7:e2200196. doi: 10.1200/CCI.22.00196.","Derton A","JCO Clin Cancer Inform","2023","2023/05/26","","","10.1200/CCI.22.00196"
"37693388","Assessing Racial and Ethnic Bias in Text Generation for Healthcare-Related Tasks by ChatGPT(1)","Hanna JJ, Wakene AD, Lehmann CU, Medford RJ.","medRxiv [Preprint]. 2023 Aug 28:2023.08.28.23294730. doi: 10.1101/2023.08.28.23294730.","Hanna JJ","medRxiv","2023","2023/09/11","PMC10491360","","10.1101/2023.08.28.23294730"
"39749996","Ethical engagement with artificial intelligence in medical education","Mondal H.","Adv Physiol Educ. 2025 Mar 1;49(1):163-165. doi: 10.1152/advan.00188.2024. Epub 2025 Jan 3.","Mondal H","Adv Physiol Educ","2025","2025/01/03","","","10.1152/advan.00188.2024"
"38596779","GPT-4 Performance for Neurologic Localization","Lee JH, Choi E, McDougal R, Lytton WW.","Neurol Clin Pract. 2024 Jun;14(3):e200293. doi: 10.1212/CPJ.0000000000200293. Epub 2024 Mar 27.","Lee JH","Neurol Clin Pract","2024","2024/04/10","PMC11003355","","10.1212/CPJ.0000000000200293"
