"Authors","Author full names","Author(s) ID","Title","Year","Source title","Volume","Issue","Art. No.","Page start","Page end","Page count","Cited by","DOI","Link","Abstract","Publisher","PubMed ID","Document Type","Publication Stage","Open Access","Source","EID"
"Davis V.H.; Qiang J.R.; MacCarthy I.A.; Howse D.; Seshie A.Z.; Kosowan L.; Delahunty-Pike A.; Abaga E.; Cooney J.; Robinson M.; Senior D.; Zsager A.; Aubrey-Bassler K.; Irwin M.; Jackson L.A.; Katz A.; Marshall E.G.; Muhajarine N.; Neudorf C.; Garies S.; Pinto A.D.","Davis, Victoria H. (57223873273); Qiang, Jinfan Rose (58161967600); MacCarthy, Itunuoluwa Adekoya (59680186400); Howse, Dana (36911805300); Seshie, Abigail Zita (59679536800); Kosowan, Leanne (57200563762); Delahunty-Pike, Alannah (56597996100); Abaga, Eunice (58068681600); Cooney, Jane (57202430210); Robinson, Marjeiry (57202428588); Senior, Dorothy (57212175268); Zsager, Alexander (57218136420); Aubrey-Bassler, Kris (23484237400); Irwin, Mandi (58068696300); Jackson, Lois A. (7402099010); Katz, Alan (26644863700); Marshall, Emily Gard (35752100700); Muhajarine, Nazeem (55898437500); Neudorf, Cory (15519916200); Garies, Stephanie (55595426900); Pinto, Andrew D. (7402306537)","57223873273; 58161967600; 59680186400; 36911805300; 59679536800; 57200563762; 56597996100; 58068681600; 57202430210; 57202428588; 57212175268; 57218136420; 23484237400; 58068696300; 7402099010; 26644863700; 35752100700; 55898437500; 15519916200; 55595426900; 7402306537","Perspectives on Using Artificial Intelligence to Derive Social Determinants of Health Data From Medical Records in Canada: Large Multijurisdictional Qualitative Study","2025","Journal of Medical Internet Research","27","","e52244","","","","0","10.2196/52244","https://www.scopus.com/inward/record.uri?eid=2-s2.0-86000533508&doi=10.2196%2f52244&partnerID=40&md5=a3e003dd9ee38c0c59cb6d4194716d6e","Background: Data on the social determinants of health could be used to improve care, support quality improvement initiatives, and track progress toward health equity. However, this data collection is not widespread. Artificial intelligence (AI), specifically natural language processing and machine learning, could be used to derive social determinants of health data from electronic medical records. This could reduce the time and resources required to obtain social determinants of health data. Objective: This study aimed to understand perspectives of a diverse sample of Canadians on the use of AI to derive social determinants of health information from electronic medical record data, including benefits and concerns. Methods: Using a qualitative description approach, in-depth interviews were conducted with 195 participants purposefully recruited from Ontario, Newfoundland and Labrador, Manitoba, and Saskatchewan. Transcripts were analyzed using an inductive and deductive content analysis. Results: A total of 4 themes were identified. First, AI was described as the inevitable future, facilitating more efficient, accessible social determinants of health information and use in primary care. Second, participants expressed concerns about potential health care harms and a distrust in AI and public systems. Third, some participants indicated that AI could lead to a loss of the human touch in health care, emphasizing a preference for strong relationships with providers and individualized care. Fourth, participants described the critical importance of consent and the need for strong safeguards to protect patient data and trust. Conclusions: These findings provide important considerations for the use of AI in health care, and particularly when health care administrators and decision makers seek to derive social determinants of health data. © Victoria H Davis, Jinfan Rose Qiang, Itunuoluwa Adekoya MacCarthy, Dana Howse, Abigail Zita Seshie, Leanne Kosowan, Alannah Delahunty-Pike, Eunice Abaga, Jane Cooney, Marjeiry Robinson, Dorothy Senior, Alexander Zsager, Kris Aubrey-Bassler, Mandi Irwin, Lois A Jackson, Alan Katz, Emily Gard Marshall, Nazeem Muhajarine, Cory Neudorf, Stephanie Garies, Andrew D Pinto.","JMIR Publications Inc.","40053728","Article","Final","All Open Access; Gold Open Access","Scopus","2-s2.0-86000533508"
"Qiu Y.; Mintenig S.; Barchiesi M.; Koelmans A.A.","Qiu, Yanning (56594111500); Mintenig, Svenja (56879071400); Barchiesi, Margherita (57220006748); Koelmans, Albert A. (7004747405)","56594111500; 56879071400; 57220006748; 7004747405","Using artificial intelligence tools for data quality evaluation in the context of microplastic human health risk assessments","2025","Environment International","197","","109341","","","","0","10.1016/j.envint.2025.109341","https://www.scopus.com/inward/record.uri?eid=2-s2.0-85218261581&doi=10.1016%2fj.envint.2025.109341&partnerID=40&md5=9e0a9d1683edf8ec048a51fad0f47d56","Concerns about the negative impacts of microplastics on human health are increasing in society, while exposure and risk assessments require high-quality, reliable data. Although quality assurance and –control (QA/QC) frameworks exist to evaluate the reliability of data for these purposes, manually assessing studies is too time-consuming and prone to inconsistencies due to semantic ambiguities and evaluator bias. The rapid growth of microplastic studies makes manually screening relevant data practically unfeasible. This study explores the potential of artificial intelligence (AI), specifically large language models (LLMs) such as OpenAI's ChatGPT and Google's Gemini, to streamline and standardize the QA/QC screening of data in microplastics research. We developed specific prompts based on previously published QA/QC criteria for the analysis of microplastics in drinking water and its sources, and used these to instruct AI tools to evaluate 73 studies published between 2011 and 2024. Our approach demonstrated the effectiveness of AI in extracting relevant information, interpreting the reliability of studies, and replicating human assessments. The findings indicate that AI-assisted assessments show promise in improving speed, consistency and applicability in QA/QC tasks, as well as in ranking studies or datasets based on their suitability for exposure and risk assessments. This groundbreaking application of LLMs in the environmental sciences suggests that AI can play a vital role in harmonizing microplastics risk assessments within regulatory frameworks and demonstrates how to meet the demands of an increasingly data-intensive application domain. © 2025 The Authors","Elsevier Ltd","","Article","Final","All Open Access; Gold Open Access","Scopus","2-s2.0-85218261581"
"Salama N.; Bsharat R.; Alwawi A.; Khlaif Z.N.","Salama, Nisreen (59654208300); Bsharat, Rebhi (55361883500); Alwawi, Abdallah (57216676391); Khlaif, Zuheir N. (36682701800)","59654208300; 55361883500; 57216676391; 36682701800","Knowledge, attitudes, and practices toward AI technology (ChatGPT) among nursing students at Palestinian universities","2025","BMC Nursing","24","1","269","","","","0","10.1186/s12912-025-02913-4","https://www.scopus.com/inward/record.uri?eid=2-s2.0-105000073977&doi=10.1186%2fs12912-025-02913-4&partnerID=40&md5=2834ba9acd065f3327eda0a665367071","Background: AI can improve medical practice, address staff shortages, and enhance diagnostic efficiency. The ChatGPT of Open AI, launched in 2022, uses AI in medical education. However, the long-term impact is uncertain, and integration varies globally, particularly in the Middle East. Aim: To explore the knowledge, practices, and attitudes of nursing students in Palestinian universities regarding AI, specifically the use of ChatGPT. Methodology: A cross-sectional design was used to conduct this study. The study was performed at 8 private and governmental universities in the West Bank, Palestine, from 1st May 2024 to 30 May 2024, and 304 nursing students participated. Results: The study revealed that 84.5% of nursing students at Palestinian universities were aware of AI technology, yet 69.9% lacked formal education or training related to ChatGPT. Despite this gap, 79% supported the integration of AI into nursing curricula and specialized training programs, reflecting strong optimism about its role in education and healthcare. While 58.6% had used AI in their coursework and 68.1% felt comfortable with technology, disparities in proficiency and access remain key barriers to effective AI integration. Major challenges to AI adoption in Palestine include insufficient training, the absence of AI-focused curricula, and financial constraints, underscoring the need for institutional and pedagogical reforms. Concerns about AI’s reliability, costs, and potential diagnostic errors persist, emphasizing the complexities of its integration into nursing education and practice. Conclusion: This study highlights the knowledge, attitudes, and practices of Palestinian nursing students regarding AI and ChatGPT. It reveals that, despite growing awareness, the lack of formal education on AI underscores the need for comprehensive curricula. While students’ express optimism about AI’s potential in healthcare, concerns about its reliability and integration persist. The study also reveals that barriers such as inadequate training, limited curricula, and financial constraints must be addressed to effectively integrate AI into nursing education and prepare students for its expanding role in healthcare. © The Author(s) 2025.","BioMed Central Ltd","","Article","Final","All Open Access; Gold Open Access","Scopus","2-s2.0-105000073977"
"Mess S.A.; Mackey A.J.; Yarowsky D.E.","Mess, Sarah A. (12775732300); Mackey, Alison J. (7006250192); Yarowsky, David E. (16410214900)","12775732300; 7006250192; 16410214900","Artificial Intelligence Scribe and Large Language Model Technology in Healthcare Documentation: Advantages, Limitations, and Recommendations","2025","Plastic and Reconstructive Surgery - Global Open","13","1","","e6450","","","0","10.1097/GOX.0000000000006450","https://www.scopus.com/inward/record.uri?eid=2-s2.0-85215842201&doi=10.1097%2fGOX.0000000000006450&partnerID=40&md5=d35bba30294394fe4669e98e03dd436b","Summary: Artificial intelligence (AI) scribe applications in the healthcare community are in the early adoption phase and offer unprecedented efficiency for medical documentation. They typically use an application programming interface with a large language model (LLM), for example, generative pretrained transformer 4. They use automatic speech recognition on the physician-patient interaction, generating a full medical note for the encounter, together with a draft follow-up e-mail for the patient and, often, recommendations, all within seconds or minutes. This provides physicians with increased cognitive freedom during medical encounters due to less time needed interfacing with electronic medical records. However, careful proofreading of the AI-generated language by the physician signing the note is essential. Insidious and potentially significant errors of omission, fabrication, or substitution may occur. The neural network algorithms of LLMs have unpredictable sensitivity to user input and inherent variability in their output. LLMs are unconstrained by established medical knowledge or rules. As they gain increasing levels of access to large corpora of medical records, the explosion of discovered knowledge comes with large potential risks, including to patient privacy, and potential bias in algorithms. Medical AI developers should use robust regulatory oversights, adhere to ethical guidelines, correct bias in algorithms, and improve detection and correction of deviations from the intended output.  © 2025 The Authors.","Lippincott Williams and Wilkins","","Article","Final","All Open Access; Gold Open Access","Scopus","2-s2.0-85215842201"
"Agnihotri A.P.; Nagel I.D.; Artiaga J.C.M.; Guevarra M.C.B.; Sosuan G.M.N.; Kalaw F.G.P.","Agnihotri, Akshay Prashant (59411627100); Nagel, Ines Doris (59383858100); Artiaga, Jose Carlo M. (57222355493); Guevarra, Ma. Carmela B. (57575620100); Sosuan, George Michael N. (57204447352); Kalaw, Fritz Gerald P. (58163571900)","59411627100; 59383858100; 57222355493; 57575620100; 57204447352; 58163571900","Large Language Models in Ophthalmology: A Review of Publications from Top Ophthalmology Journals","2025","Ophthalmology Science","5","3","100681","","","","0","10.1016/j.xops.2024.100681","https://www.scopus.com/inward/record.uri?eid=2-s2.0-85219503020&doi=10.1016%2fj.xops.2024.100681&partnerID=40&md5=bb1ad0c59f3b09527774caa624acfde6","Purpose: To review and evaluate the current literature on the application and impact of large language models (LLMs) in the field of ophthalmology, focusing on studies published in high-ranking ophthalmology journals. Design: This is a retrospective review of published articles. Participants: This study did not involve human participation. Methods: Articles published in the first quartile (Q1) of ophthalmology journals on Scimago Journal & Country Rank discussing different LLMs up to June 7, 2024, were reviewed, parsed, and analyzed. Main Outcome Measures: All available articles were parsed and analyzed, which included the article and author characteristics and data regarding the LLM used and its applications, focusing on its use in medical education, clinical assistance, research, and patient education. Results: There were 35 Q1-ranked journals identified, 19 of which contained articles discussing LLMs, with 101 articles eligible for review. One-third were original investigations (32%; 32/101), with an average of 5.3 authors per article. The United States (50.4%; 51/101) was the most represented country, followed by the United Kingdom (25.7%; 26/101) and Canada (16.8%; 17/101). ChatGPT was the most used LLM among the studies, with different versions discussed and compared. Large language model applications were discussed relevant to their implications in medical education, clinical assistance, research, and patient education. Conclusions: The numerous publications on the use of LLM in ophthalmology can provide valuable insights for stakeholders and consumers of these applications. Large language models present significant opportunities for advancement in ophthalmology, particularly in team science, education, clinical assistance, and research. Although LLMs show promise, they also show challenges such as performance inconsistencies, bias, and ethical concerns. The study emphasizes the need for ongoing artificial intelligence improvement, ethical guidelines, and multidisciplinary collaboration. Financial Disclosure(s): The author(s) have no proprietary or commercial interest in any materials discussed in this article. © 2024 American Academy of Ophthalmology","Elsevier Inc.","","Article","Final","All Open Access; Gold Open Access","Scopus","2-s2.0-85219503020"
"Lee H.","Lee, Hocheol (57211534531)","57211534531","Assessment of Digital Capabilities by 9 Countries in the Alliance for Healthy Cities Using AI: Cross-Sectional Analysis","2025","JMIR Formative Research","9","","e62935","","","","0","10.2196/62935","https://www.scopus.com/inward/record.uri?eid=2-s2.0-85217257121&doi=10.2196%2f62935&partnerID=40&md5=29849ea30ebb96129bd7dfe1f8bcd257","Background: The Alma-Ata Declaration of 1978 initiated a global focus on universal health, supported by the World Health Organization (WHO) through healthy cities policies. The concept emerged at the 1984 Toronto “Beyond Health Care” conference, leading to WHO’s first pilot project in Lisbon in 1986. The WHO continues to support regional healthy city networks, emphasizing digital transformation and data-driven health management in the digital era. Objective: This study explored the capabilities of digital healthy cities within the framework of digital transformation, focusing on member countries of the Asian Forum of Healthy Cities. It examined the cities’ preparedness and policy needs for transitioning to digital health. Methods: A cross-sectional survey was conducted of 9 countries—Australia, Cambodia, China, Japan, South Korea, Malaysia, Mongolia, the Philippines, and Vietnam—from August 1 to September 21, 2023. The 6-section SPIRIT (setting approach and sustainability; political commitment, policy, and community participation; information and innovation; resources and research; infrastructure and intersectoral; and training) checklist was modified to assess healthy cities’ digital capabilities. With input from 3 healthy city experts, the checklist was revised for digital capabilities, renaming “healthy city” to “digital healthy city.” The revised tool comprises 8 sections with 33 items. The survey leveraged ChatGPT (version 4.0; OpenAI, Microsoft), accessed via Python (Python Software Foundation) application programming interface. The openai library was installed, and an application programming interface key was entered to use ChatGPT (version 4.0). The “GPT-4 Turbo” model command was applied. A qualitative analysis of the collected data was conducted by 5 healthy city experts through group deep-discussions. Results: The results indicate that these countries should establish networks and committees for sustainable digital healthy cities. Cambodia showed the lowest access to electricity (70%) and significant digital infrastructure disparities. Efforts to sustain digital health initiatives varied, with countries such as Korea focusing on telemedicine, while China aimed to build a comprehensive digital health database, highlighting the need for tailored strategies in promoting digital healthy cities. Life expectancy was the highest in the Republic of Korea and Japan (both 84 y). Access to electricity was the lowest in Cambodia (70%) with the remaining countries having had 95% or higher access. The internet use rate was the highest in Malaysia (97.4%), followed by the Republic of Korea (97.2%), Australia (96.2%), and Japan (82.9%). Conclusions: This study highlights the importance of big data-driven policies and personal information protection systems. Collaborative efforts across sectors for effective implementation of digital healthy cities. The findings suggest that the effectiveness of digital healthy cities is diminished without adequate digital literacy among managers and users, suggesting the need for policies to improve digital literacy. © Hocheol Lee.","JMIR Publications Inc.","","Article","Final","All Open Access; Gold Open Access","Scopus","2-s2.0-85217257121"
"Andrew K.; Montalbano M.J.","Andrew, Kevlian (58528786000); Montalbano, Michael J. (57190378733)","58528786000; 57190378733","Through a Glass Darkly: Perceptions of Ethnoracial Identity in Artificial Intelligence Generated Medical Vignettes and Images","2025","Medical Science Educator","","","","","","","0","10.1007/s40670-025-02332-9","https://www.scopus.com/inward/record.uri?eid=2-s2.0-85219025934&doi=10.1007%2fs40670-025-02332-9&partnerID=40&md5=ec7b2b7f4dfb2fe0f61c21339ed57526","Purpose: Medical education professionals expect artificial intelligence (AI) systems to be an efficient faculty resource for content creation. However, prior findings suggest that machine learning algorithms may exacerbate negative stereotypes and undermine efforts for diversity, equity, and inclusivity. This investigation explores the potential of OpenAI’s ChatGPT (OCG) and Microsoft’s Bing A.I. Image Creator (MBIC) to perpetuate ethnoracial stereotypes in medical cases. Materials and Methods: A series of medically relevant vignettes and visual representatives were requested from ChatGPT and MBIC for five medical conditions traditionally associated with certain ethnoracial groups: sickle cell anemia, cystic fibrosis, Tay-Sachs disease, beta-thalassemia, and aldehyde dehydrogenase deficiency. Initial prompting, self-prompting, and prompt engineering were iteratively performed to ascertain the extent to which AI outputs for generated vignettes and imagery were mutable or fixed. Results: The ethnoracial identity in the vignettes of the clinical conditions adhered more closely than described in epidemiologic studies. Following prompt engineering and self-prompting, an increase in diversity was seen. On initial prompting, the most common ethnoracial identity depicted was Caucasian. Secondary prompting resulted in less diversity with higher conformation to the traditionally expected ethnoracial identity. Conclusion: The prevalence of dataset bias and AI’s user-dependent learning abilities underscore the importance of human stewardship. The increasing use of AI in generating medical education content, like MCQs, demands vigilant use of such tools to combat the reinforcement of the race-based stereotypes in medicine. © The Author(s) 2025.","Springer","","Article","Article in press","All Open Access; Hybrid Gold Open Access","Scopus","2-s2.0-85219025934"
"Kavak E.E.; Dilli İ.","Kavak, Engin Eren (56178529500); Dilli, İsmail (59557461800)","56178529500; 59557461800","Progression-Free Survival Prediction Performance of ChatGPT: Analysis With Real Life Data in Early and Locally Advanced Prostate Cancer","2025","Prostate","","","","","","","0","10.1002/pros.24871","https://www.scopus.com/inward/record.uri?eid=2-s2.0-85217777603&doi=10.1002%2fpros.24871&partnerID=40&md5=1e55279df4396b150c5337d71939d32a","Objective: To evaluate the progression-free survival (PFS) time in patients with early-stage and locally advanced prostate cancer and to compare the estimates provided by ChatGPT with actual survival data. Methods: A retrospective analysis was conducted on patients diagnosed with early-stage/locally advanced prostate cancer. Each patient's estimated PFS times were calculated using an artificial intelligence chatbot. These estimates were generated by considering several factors, including the patient's clinical characteristics, tumor stage, treatment modalities, and biochemical parameters. A statistical comparison was conducted between the predicted PFS and actual PFS times. Results: The AI chatbot tended to overestimate the overall PFS times. A statistically significant discrepancy was observed between the predicted and actual survival times (p < 0.05). A discrepancy of 9.19 months was observed between the PFS predictions made by ChatGPT and the actual PFS. The bias value was 48.57, yet this discrepancy had a negligible impact on clinical practice (Cohen's d = 0.189). Discussion: Artificial intelligence-based models have the potential to play an important role in the prediction of progression in cancers such as prostate cancer, where 5–10-year survival rates can reach 100%. However, this study's findings indicate that the AI model's predictions are not aligned with the actual clinical data. The reliability of the integration of artificial intelligence into clinical decision support systems can be enhanced through the undertaking of comprehensive future studies. Conclusion: The use of artificial intelligence in predictive modeling may prove an effective approach for forecasting the PFS of prostate cancer. It has the potential to supplant the nomograms that are currently in use. Nevertheless, further studies are required to substantiate the accuracy and reliability of these systems. © 2025 Wiley Periodicals LLC.","John Wiley and Sons Inc","","Article","Article in press","","Scopus","2-s2.0-85217777603"
