"Authors","Author full names","Author(s) ID","Title","Year","Source title","Volume","Issue","Art. No.","Page start","Page end","Page count","Cited by","DOI","Link","Abstract","Publisher","PubMed ID","Document Type","Publication Stage","Open Access","Source","EID"
"Sudha L.; Aruna K.B.; Sureka V.; Niveditha M.; Prema S.","Sudha, Lakshmanan (57207217074); Aruna, Kari Balakrishnan (57200138702); Sureka, Vijayakumar (57200141626); Niveditha, Mathavan (59459203800); Prema, S. (58906279800)","57207217074; 57200138702; 57200141626; 59459203800; 58906279800","Semantic Image Synthesis from Text: Current Trends and Future Horizons in Text-to-Image Generation","2025","EAI Endorsed Transactions on Internet of Things","11","","","","","","0","10.4108/eetiot.5336","https://www.scopus.com/inward/record.uri?eid=2-s2.0-85211156231&doi=10.4108%2feetiot.5336&partnerID=40&md5=35f74590e055df0c8e1aab64e6b9e797","Text-to-image generation, a captivating intersection of natural language processing and computer vision, has undergone a remarkable evolution in recent years. This research paper provides a comprehensive review of the state-of-the-art in text-to-image generation techniques, highlighting key advancements and emerging trends. We begin by surveying the foundational models, with a focus on Generative Adversarial Networks (GANs) and their pivotal role in generating realistic and diverse images from textual descriptions. We delve into the intricacies of training data, model architectures, and evaluation metrics, offering insights into the challenges and opportunities in this field. Furthermore, this paper explores the synergistic relationship between natural language processing and computer vision, showcasing multimodal models like DALL-E and CLIP. These models not only generate images from text but also understand the contextual relationships between textual descriptions and images, opening avenues for content recommendation, search engines, and visual storytelling. The paper discusses applications spanning art, design, e-commerce, healthcare, and education, where text-to-image generation has made significant inroads. We highlight the potential of this technology in automating content creation, aiding in diagnostics, and transforming the fashion and e-commerce industries. However, the journey of text-to-image generation is not without its challenges. We address ethical considerations, emphasizing responsible AI and the mitigation of biases in generated content. We also explore interpretability and model transparency, critical for ensuring trust and accountability. © 2024 L. Sudha et al.","European Alliance for Innovation","","Article","Final","All Open Access; Gold Open Access","Scopus","2-s2.0-85211156231"
"Gallo R.J.; Baiocchi M.; Savage T.R.; Chen J.H.","Gallo, Robert J. (58285262900); Baiocchi, Michael (36150428700); Savage, Thomas R. (57238513600); Chen, Jonathan H. (57112911000)","58285262900; 36150428700; 57238513600; 57112911000","Establishing best practices in large language model research: an application to repeat prompting","2025","Journal of the American Medical Informatics Association","32","2","","386","390","4","1","10.1093/jamia/ocae294","https://www.scopus.com/inward/record.uri?eid=2-s2.0-85216606586&doi=10.1093%2fjamia%2focae294&partnerID=40&md5=ec6f10d921d424c363d8964272a342ff","Objectives: We aimed to demonstrate the importance of establishing best practices in large language model research, using repeat prompting as an illustrative example. Materials and Methods: Using data from a prior study investigating potential model bias in peer review of medical abstracts, we compared methods that ignore correlation in model outputs from repeated prompting with a random effects method that accounts for this correlation. Results: High correlation within groups was found when repeatedly prompting the model, with intraclass correlation coefficient of 0.69. Ignoring the inherent correlation in the data led to over 100-fold inflation of effective sample size. After appropriately accounting for this issue, the authors’ results reverse from a small but highly significant finding to no evidence of model bias. Discussion: The establishment of best practices for LLM research is urgently needed, as demonstrated in this case where accounting for repeat prompting in analyses was critical for accurate study conclusions. © The Author(s) 2024. Published by Oxford University Press on behalf of the American Medical Informatics Association.","Oxford University Press","39656836","Article","Final","All Open Access; Hybrid Gold Open Access","Scopus","2-s2.0-85216606586"
"Young C.C.; Enichen E.; Rao A.; Succi M.D.","Young, Cameron C. (57222156516); Enichen, Elizabeth (59328205600); Rao, Arya (57210925940); Succi, Marc D. (55939445100)","57222156516; 59328205600; 57210925940; 55939445100","Racial, ethnic, and sex bias in large language model opioid recommendations for pain management","2025","Pain","166","3","","511","517","6","4","10.1097/j.pain.0000000000003388","https://www.scopus.com/inward/record.uri?eid=2-s2.0-85204024749&doi=10.1097%2fj.pain.0000000000003388&partnerID=40&md5=55dca7caa217086a2bba229ed6ec3d3b","Understanding how large language model (LLM) recommendations vary with patient race/ethnicity provides insight into how LLMs may counter or compound bias in opioid prescription. Forty real-world patient cases were sourced from the MIMIC-IV Note dataset with chief complaints of abdominal pain, back pain, headache, or musculoskeletal pain and amended to include all combinations of race/ethnicity and sex. Large language models were instructed to provide a subjective pain rating and comprehensive pain management recommendation. Univariate analyses were performed to evaluate the association between racial/ethnic group or sex and the specified outcome measures - subjective pain rating, opioid name, order, and dosage recommendations - suggested by 2 LLMs (GPT-4 and Gemini). Four hundred eighty real-world patient cases were provided to each LLM, and responses included pharmacologic and nonpharmacologic interventions. Tramadol was the most recommended weak opioid in 55.4% of cases, while oxycodone was the most frequently recommended strong opioid in 33.2% of cases. Relative to GPT-4, Gemini was more likely to rate a patient's pain as ""severe""(OR: 0.57 95% CI: [0.54, 0.60]; P < 0.001), recommend strong opioids (OR: 2.05 95% CI: [1.59, 2.66]; P < 0.001), and recommend opioids later (OR: 1.41 95% CI: [1.22, 1.62]; P < 0.001). Race/ethnicity and sex did not influence LLM recommendations. This study suggests that LLMs do not preferentially recommend opioid treatment for one group over another. Given that prior research shows race-based disparities in pain perception and treatment by healthcare providers, LLMs may offer physicians a helpful tool to guide their pain management and ensure equitable treatment across patient groups.  © 2024 International Association for the Study of Pain.","Lippincott Williams and Wilkins","39283333","Article","Final","","Scopus","2-s2.0-85204024749"
"Hsieh P.-H.","Hsieh, Pei-Hsun (57935269800)","57935269800","Psychological reactance to vaccine mandates on Twitter: a study of sentiments in the United States","2025","Journal of Public Health Policy","","","","","","","0","10.1057/s41271-025-00554-0","https://www.scopus.com/inward/record.uri?eid=2-s2.0-85217239858&doi=10.1057%2fs41271-025-00554-0&partnerID=40&md5=0f73dc354723d5900e9e9abad22edf6e","This study examines the relationship between vaccine mandates and public sentiment toward vaccines and health officials on Twitter. I analyzed 6.6 million vaccine-related tweets from July 2021 to February 2022 in the United States. Leveraging a large language model, BERT, I identified tweets discussing vaccine mandates even when lacking explicit keywords. Compared to non-mandate tweets, those mentioning mandates exhibit greater negativity, anger, and freedom-related language. Furthermore, increased state-level discussion of mandates correlates with rising levels of negativity and anger toward both vaccines and public health officials. Finally, greater disparity in vaccination progress across counties within a state is associated with increased anger in tweets directed toward both. © The Author(s) 2025.","Palgrave Macmillan","","Article","Article in press","All Open Access; Hybrid Gold Open Access","Scopus","2-s2.0-85217239858"
"Zhu M.; Yang Q.; Gao Z.; Yuan Y.; Liu J.","Zhu, Meilu (57200920263); Yang, Qiushi (57224307944); Gao, Zhifan (55320405200); Yuan, Yixuan (55932867600); Liu, Jun (57218181324)","57200920263; 57224307944; 55320405200; 55932867600; 57218181324","FedBM: Stealing knowledge from pre-trained language models for heterogeneous federated learning","2025","Medical Image Analysis","102","","103524","","","","0","10.1016/j.media.2025.103524","https://www.scopus.com/inward/record.uri?eid=2-s2.0-86000465365&doi=10.1016%2fj.media.2025.103524&partnerID=40&md5=3118a378046dbcf04b8b46e3654b824f","Federated learning (FL) has shown great potential in medical image computing since it provides a decentralized learning paradigm that allows multiple clients to train a model collaboratively without privacy leakage. However, current studies have shown that data heterogeneity incurs local learning bias in classifiers and feature extractors of client models during local training, leading to the performance degradation of a federation system. To address these issues, we propose a novel framework called Federated Bias eliMinating (FedBM) to get rid of local learning bias in heterogeneous federated learning (FL), which mainly consists of two modules, i.e., Linguistic Knowledge-based Classifier Construction (LKCC) and Concept-guided Global Distribution Estimation (CGDE). Specifically, LKCC exploits class concepts, prompts and pre-trained language models (PLMs) to obtain concept embeddings. These embeddings are used to estimate the latent concept distribution of each class in the linguistic space. Based on the theoretical derivation, we can rely on these distributions to pre-construct a high-quality classifier for clients to achieve classification optimization, which is frozen to avoid classifier bias during local training. CGDE samples probabilistic concept embeddings from the latent concept distributions to learn a conditional generator to capture the input space of the global model. Three regularization terms are introduced to improve the quality and utility of the generator. The generator is shared by all clients and produces pseudo data to calibrate updates of local feature extractors. Extensive comparison experiments and ablation studies on public datasets demonstrate the superior performance of FedBM over state-of-the-arts and confirm the effectiveness of each module, respectively. The code is available at https://github.com/CUHK-AIM-Group/FedBM. © 2025 Elsevier B.V.","Elsevier B.V.","","Article","Final","","Scopus","2-s2.0-86000465365"
"Arslan B.; Nuhoglu C.; Satici M.O.; Altinbilek E.","Arslan, B. (57832887600); Nuhoglu, C. (59363789200); Satici, M.O. (57217532209); Altinbilek, E. (55560900900)","57832887600; 59363789200; 57217532209; 55560900900","Evaluating LLM-based generative AI tools in emergency triage: A comparative study of ChatGPT Plus, Copilot Pro, and triage nurses","2025","American Journal of Emergency Medicine","89","","","174","181","7","1","10.1016/j.ajem.2024.12.024","https://www.scopus.com/inward/record.uri?eid=2-s2.0-85213016878&doi=10.1016%2fj.ajem.2024.12.024&partnerID=40&md5=5a79c14f7f9f65fdbcc8fea2b38d174d","Background: The number of emergency department (ED) visits has been on steady increase globally. Artificial Intelligence (AI) technologies, including Large Language Model (LLMs)-based generative AI models, have shown promise in improving triage accuracy. This study evaluates the performance of ChatGPT and Copilot in triage at a high-volume urban hospital, hypothesizing that these tools can match trained physicians' accuracy and reduce human bias amidst ED crowding challenges. Methods: This single-center, prospective observational study was conducted in an urban ED over one week. Adult patients were enrolled through random 24-h intervals. Exclusions included minors, trauma cases, and incomplete data. Triage nurses assessed patients while an emergency medicine (EM) physician documented clinical vignettes and assigned emergency severity index (ESI) levels. These vignettes were then introduced to ChatGPT and Copilot for comparison with the triage nurse's decision. Results: The overall triage accuracy was 65.2 % for nurses, 66.5 % for ChatGPT, and 61.8 % for Copilot, with no significant difference (p = 0.000). Moderate agreement was observed between the EM physician and ChatGPT, triage nurses, and Copilot (Cohen's Kappa = 0.537, 0.477, and 0.472, respectively). In recognizing high-acuity patients, ChatGPT and Copilot outperformed triage nurses (87.8 % and 85.7 % versus 32.7 %, respectively). Compared to ChatGPT and Copilot, nurses significantly under-triaged patients (p < 0.05). The analysis of predictive performance for ChatGPT, Copilot, and triage nurses demonstrated varying discrimination abilities across ESI levels, all of which were statistically significant (p < 0.05). ChatGPT and Copilot exhibited consistent accuracy across age, gender, and admission time, whereas triage nurses were more likely to mistriage patients under 45 years old. Conclusion: ChatGPT and Copilot outperform traditional nurse triage in identifying high-acuity patients, but real-time ED capacity data is crucial to prevent overcrowding and ensure high-quality of emergency care. © 2024 Elsevier Inc.","W.B. Saunders","39731895","Article","Final","","Scopus","2-s2.0-85213016878"
"Garcia Valencia O.A.; Thongprayoon C.; Jadlowiec C.C.; Mao S.A.; Leeaphorn N.; Budhiraja P.; Khoury N.; Pham J.H.; Craici I.M.; Gonzalez Suarez M.L.; Cheungpasitporn W.","Garcia Valencia, Oscar A. (57205373508); Thongprayoon, Charat (55512490600); Jadlowiec, Caroline C. (54379938500); Mao, Shennen A. (56096828900); Leeaphorn, Napat (54889052300); Budhiraja, Pooja (16068190900); Khoury, Nadeen (57196050788); Pham, Justin H. (58245302000); Craici, Iasmina M. (8730515900); Gonzalez Suarez, Maria L. (56005758800); Cheungpasitporn, Wisit (47160959700)","57205373508; 55512490600; 54379938500; 56096828900; 54889052300; 16068190900; 57196050788; 58245302000; 8730515900; 56005758800; 47160959700","Advancing health equity: evaluating AI translations of kidney donor information for Spanish speakers","2025","Frontiers in Public Health","13","","1484790","","","","0","10.3389/fpubh.2025.1484790","https://www.scopus.com/inward/record.uri?eid=2-s2.0-85217423319&doi=10.3389%2ffpubh.2025.1484790&partnerID=40&md5=4681c5c210eba700b78839c6d0cca744","Background: Health equity and access to essential medical information remain significant challenges, especially for the Spanish-speaking Hispanic population, which faces barriers in accessing living kidney donation opportunities. ChatGPT, an AI language model with sophisticated natural language processing capabilities, has been identified as a promising tool for translating critical health information into Spanish. This study aims to assess ChatGPT’s translation efficacy to ensure the information provided is accurate and culturally relevant. Methods: This study utilized ChatGPT versions 3.5 and 4.0 to translate 27 frequently asked questions (FAQs) from English to Spanish, sourced from Donate Life America’s website. The translated content was reviewed by native Spanish-speaking nephrologists using a standard rubric scale (1–5). The assessment focused on linguistic accuracy and cultural sensitivity, emphasizing retention of the original message, appropriate vocabulary and grammar, and cultural relevance. Results: The mean linguistic accuracy scores were 4.89 ± 0.32 for GPT-3.5 and 5.00 ± 0.00 for GPT-4.0 (p = 0.08). The percentage of excellent-quality translations (score = 5) in linguistic accuracy was 89% for GPT-3.5 and 100% for GPT-4.0 (p = 0.24). The mean cultural sensitivity scores were 4.89 ± 0.32 for both GPT-3.5 and GPT-4.0 (p = 1.00). Similarly, excellent-quality translations in cultural sensitivity were achieved in 89% of cases for both versions (p = 1.00). Conclusion: ChatGPT 4.0 demonstrates strong potential to enhance health equity by improving Spanish-speaking Hispanic patients’ access to LKD information through accurate and culturally sensitive translations. These findings highlight the role of AI in mitigating healthcare disparities and underscore the need for integrating AI-driven tools into healthcare systems. Future efforts should focus on developing accessible platforms and establishing guidelines to maximize AI’s impact on equitable healthcare delivery and patient education. Copyright © 2025 Garcia Valencia, Thongprayoon, Jadlowiec, Mao, Leeaphorn, Budhiraja, Khoury, Pham, Craici, Gonzalez Suarez and Cheungpasitporn.","Frontiers Media SA","39931300","Article","Final","","Scopus","2-s2.0-85217423319"
"Wang C.; Xiao C.; Zhang X.; Zhu Y.; Chen X.; Li Y.; Qi H.","Wang, Chen (57222561625); Xiao, Changqi (59564590400); Zhang, Xuejiao (59564894900); Zhu, Yingying (59564795800); Chen, Xueqing (59564276700); Li, Yilin (59312818500); Qi, Huiying (36705149700)","57222561625; 59564590400; 59564894900; 59564795800; 59564276700; 59312818500; 36705149700","Exploring medical students’ intention to use of ChatGPT from a programming course: a grounded theory study in China","2025","BMC Medical Education","25","1","209","","","","0","10.1186/s12909-025-06807-6","https://www.scopus.com/inward/record.uri?eid=2-s2.0-85218229852&doi=10.1186%2fs12909-025-06807-6&partnerID=40&md5=2ae6a72fcb7b798ea357f3ed4d9f2f1a","Background: In interdisciplinary general education courses, medical students face the daunting challenge of learning programming due to academic pressure, cognitive biases, and differences in thinking patterns. ChatGPT provides an effective way for people to acquire knowledge, improve learning efficiency, and quality. Objective: To explore whether medical students can be assisted in learning programming with the help of ChatGPT, it is necessary to investigate their experience and perception of using ChatGPT, and to study which factors influence their willingness to use ChatGPT. Methods: Drawing on the grounded theory research paradigm, this paper constructs a research model of the influencing factors of ChatGPT usage willingness for medical students in programming courses through the analysis of interview data from 30 undergraduate medical students. It analyzes and discusses the cognition and influencing factors of medical students’ willingness to use ChatGPT in programming learning. Results: The willingness to use ChatGPT in programming learning is divided into three types based on the students’ subjective degree of use: active use, neutral use, and negative use. It is also found that individual factors, technical factors, information factors, and environmental factors are four important dimensions affecting the willingness to use ChatGPT. Conclusions: Based on the analysis of influencing factors, strategies and suggestions such as preventing risks and focusing on ethical education, cultivating critical thinking and establishing a case library, and personalized teaching to enhance core literacy in programming are proposed. © The Author(s) 2025.","BioMed Central Ltd","39923098","Article","Final","All Open Access; Gold Open Access","Scopus","2-s2.0-85218229852"
"Al-Qudimat A.R.; Fares Z.E.; Elaarag M.; Osman M.; Al-Zoubi R.M.; Aboumarzouk O.M.","Al-Qudimat, Ahmad R. (57222188028); Fares, Zainab E. (58369434600); Elaarag, Mai (57769382700); Osman, Maha (59659982800); Al-Zoubi, Raed M. (24072809100); Aboumarzouk, Omar M. (29067501200)","57222188028; 58369434600; 57769382700; 59659982800; 24072809100; 29067501200","Advancing Medical Research Through Artificial Intelligence: Progressive and Transformative Strategies: A Literature Review","2025","Health Science Reports","8","2","e70200","","","","0","10.1002/hsr2.70200","https://www.scopus.com/inward/record.uri?eid=2-s2.0-85219164836&doi=10.1002%2fhsr2.70200&partnerID=40&md5=41fffd0f18c421839218d589eff8bba4","Background and Aims: Artificial intelligence (AI) has become integral to medical research, impacting various aspects such as data analysis, writing assistance, and publishing. This paper explores the multifaceted influence of AI on the process of writing medical research papers, encompassing data analysis, ethical considerations, writing assistance, and publishing efficiency. Methods: The review was conducted following the PRISMA guidelines; a comprehensive search was performed in Scopus, PubMed, EMBASE, and MEDLINE databases for research publications on artificial intelligence in medical research published up to October 2023. Results: AI facilitates the writing process by generating drafts, offering grammar and style suggestions, and enhancing manuscript quality through advanced models like ChatGPT. Ethical concerns regarding content ownership and potential biases in AI-generated content underscore the need for collaborative efforts among researchers, publishers, and AI creators to establish ethical standards. Moreover, AI significantly influences data analysis in healthcare, optimizing outcomes and patient care, particularly in fields such as obstetrics and gynecology and pharmaceutical research. The application of AI in publishing, ranging from peer review to manuscript quality control and journal matching, underscores its potential to streamline and enhance the entire research and publication process. Overall, while AI presents substantial benefits, ongoing research, and ethical guidelines are essential for its responsible integration into the evolving landscape of medical research and publishing. Conclusion: The integration of AI in medical research has revolutionized efficiency and innovation, impacting data analysis, writing assistance, publishing, and others. While AI tools offer significant benefits, ethical considerations such as biases and content ownership must be addressed. Ongoing research and collaborative efforts are crucial to ensure responsible and transparent AI implementation in the dynamic landscape of medical research and publishing. © 2024 The Authors. Health Science Reports published by Wiley Periodicals LLC.","John Wiley and Sons Inc","","Article","Final","","Scopus","2-s2.0-85219164836"
"Occhipinti J.-A.; Prodan A.; Hynes W.; Buchanan J.; Green R.; Burrow S.; Eyre H.A.; Skinner A.; Hickie I.B.; Heffernan M.; Song Y.J.C.; Ujdur G.; Tanner M.","Occhipinti, Jo-An (57958195900); Prodan, Ante (24469250600); Hynes, William (57191514063); Buchanan, John (8580073900); Green, Roy (7403916331); Burrow, Sharan (58970670600); Eyre, Harris A. (35519384100); Skinner, Adam (57211686695); Hickie, Ian B. (17734678500); Heffernan, Mark (57189591032); Song, Yun Ju Christine (55494043100); Ujdur, Goran (58644006500); Tanner, Marcel (58970213000)","57958195900; 24469250600; 57191514063; 8580073900; 7403916331; 58970670600; 35519384100; 57211686695; 17734678500; 57189591032; 55494043100; 58644006500; 58970213000","Artificial intelligence, recessionary pressures and population health; [Intelligence artificielle, pressions récessionnistes et santé des populations]; [Inteligencia artificial, presiones recesivas y salud de la población]","2025","Bulletin of the World Health Organization","103","2","","155","163","8","2","10.2471/BLT.24.291950","https://www.scopus.com/inward/record.uri?eid=2-s2.0-85217357047&doi=10.2471%2fBLT.24.291950&partnerID=40&md5=89828290f7f5bcb2d44cb5a60af3588f","Economic and labour policies have a considerable influence on health and well-being through direct financial impacts, and by shaping social and physical environments. Strong economies are important for public health investment and employment, yet the rapid rise of generative artificial intelligence (AI) has the potential to reshape economies, presenting challenges beyond mere temporary market disruption. Generative AI can perform non-routine cognitive tasks, previously unattainable though traditional automation, creating new efficiencies. While this technology offers opportunities for innovation and productivity, its labour-displacing potential raises serious concerns about economic stability and social equity, both of which are critical to health. Job displacement driven by generative AI could worsen income inequality, shrink middle-class opportunities and reduce consumer demand, triggering recessionary pressures. In this article, we propose the existence of an AI-capital-to-labour ratio threshold beyond which a self-reinforcing cycle of recessionary pressures may emerge, and which market forces alone cannot correct. Traditional responses to such pressures, like fiscal stimulus or monetary easing, may be ineffective in addressing structural disruptions to labour markets caused by generative AI. We call for a proactive global response to harness the benefits of generative AI while mitigating risks. This response should focus on reorienting economic systems towards collective well-being, as emphasized in the World Health Assembly resolution Economics of health for all and the United Nations' Global Digital Compact. Integrated strategies that combine fiscal policy, regulation and social policies are critical to ensuring generative AI advances societal health and equity while avoiding harm from excessive job displacement. © 2025 The authors; licensee World Health Organization.","World Health Organization","39882489","Article","Final","","Scopus","2-s2.0-85217357047"
