"Authors","Author full names","Author(s) ID","Title","Year","Source title","Volume","Issue","Art. No.","Page start","Page end","Page count","Cited by","DOI","Link","Abstract","Publisher","PubMed ID","Document Type","Publication Stage","Open Access","Source","EID"
"Lee J.K.; Chung T.-M.","Lee, Jun Koo (58874950700); Chung, Tai-Myoung (59269612900)","58874950700; 59269612900","Detecting Bias in Large Language Models: Fine-Tuned KcBERT","2025","Lecture Notes in Computer Science (including subseries Lecture Notes in Artificial Intelligence and Lecture Notes in Bioinformatics) ","14893 LNCS","","","76","90","14","0","10.1007/978-981-97-8705-0_6","https://www.scopus.com/inward/record.uri?eid=2-s2.0-85219166785&doi=10.1007%2f978-981-97-8705-0_6&partnerID=40&md5=66ff0ad19418ce2838eef7fcefd1f11f","The rapid advancement of large language models (LLMs) has brought their natural language processing capabilities to a level comparable to human performance. These models are now extensively used in various societal domains, including education and healthcare. However, despite their versatility, LLMs can produce subjective and normative language, potentially leading to discriminatory outcomes among social groups, particularly through the dissemination of offensive language online. In this paper, we define such phenomena as societal bias and assess ethnic, gender, and racial biases in a model fine-tuned with Korean comments using the Bidirectional Encoder Representations from Transformers (KcBERT) and Korean Language Open Data (KOLD) through template-based Masked Language Modeling (MLM). To quantitatively evaluate these biases, we use the Language Pattern Bias Score (LPBS) and Contextual Bias Score (CBS) metrics. Our results show that, compared to KcBERT, the fine-tuned model exhibits a reduction in ethnic bias but significant alterations in gender and racial biases. To mitigate these societal biases, we propose two methods: First, a data balancing approach during the pre-training phase that adjusts the uniformity of data by aligning the distribution of specific word occurrences and converting surrounding harmful words into non-harmful alternatives. Second, during the in-training phase, we apply Debiasing Regularization by adjusting dropout and regularization parameters, resulting in decreased training loss. Our work highlights the existence of societal biases in Korean language models and demonstrates the importance of language-dependent characteristics in these models. © The Author(s), under exclusive license to Springer Nature Singapore Pte Ltd. 2025.","Springer Science and Business Media Deutschland GmbH","","Conference paper","Final","","Scopus","2-s2.0-85219166785"
"Zohny H.; Allen J.W.; Wilkinson D.; Savulescu J.","Zohny, Hazem (56600819000); Allen, Jemima Winifred (58520288500); Wilkinson, Dominic (59674311200); Savulescu, Julian (59674888400)","56600819000; 58520288500; 59674311200; 59674888400","Which AI doctor would you like to see? Emulating healthcare provider–patient communication models with GPT-4: proof-of-concept and ethical exploration","2025","Journal of Medical Ethics","","","","","","","0","10.1136/jme-2024-110256","https://www.scopus.com/inward/record.uri?eid=2-s2.0-86000312342&doi=10.1136%2fjme-2024-110256&partnerID=40&md5=421274fe18c8c52ef64f0fe1fa8d9593","Large language models (LLMs) have demonstrated potential in enhancing various aspects of healthcare, including health provider–patient communication. However, some have raised the concern that such communication may adopt implicit communication norms that deviate from what patients want or need from talking with their healthcare provider. This paper explores the possibility of using LLMs to enable patients to choose their preferred communication style when discussing their medical cases. By providing a proof-of-concept demonstration using ChatGPT-4, we suggest LLMs can emulate different healthcare provider–patient communication approaches (building on Emanuel and Emanuel’s four models: paternalistic, informative, interpretive and deliberative). This allows patients to engage in a communication style that aligns with their individual needs and preferences. We also highlight potential risks associated with using LLMs in healthcare communication, such as reinforcing patients’ biases and the persuasive capabilities of LLMs that may lead to unintended manipulation. © Author(s) (or their employer(s)) 2025.","BMJ Publishing Group","","Article","Article in press","","Scopus","2-s2.0-86000312342"
"McCaffrey P.; Jackups R.; Seheult J.; Zaydman M.A.; Balis U.; Thaker H.M.; Rashidi H.; Gullapalli R.R.","McCaffrey, Peter (35491387300); Jackups, Ronald (9735074900); Seheult, Jansen (55820665300); Zaydman, Mark A. (36095096400); Balis, Ulysses (6603836901); Thaker, Harshwardhan M. (6603730674); Rashidi, Hooman (6506820780); Gullapalli, Rama R. (15765243900)","35491387300; 9735074900; 55820665300; 36095096400; 6603836901; 6603730674; 6506820780; 15765243900","Evaluating Use of Generative Artificial Intelligence in Clinical Pathology Practice Opportunities and the Way Forward","2025","Archives of Pathology and Laboratory Medicine","149","2","","130","141","11","0","10.5858/arpa.2024-0208-RA","https://www.scopus.com/inward/record.uri?eid=2-s2.0-85216494599&doi=10.5858%2farpa.2024-0208-RA&partnerID=40&md5=e6ea2b2bc3dab21b3aa35801f74b439e","• Context.—Generative artificial intelligence (GAI) technologies are likely to dramatically impact health care workflows in clinical pathology (CP). Applications in CP include education, data mining, decision support, result summaries, and patient trend assessments. Objective.—To review use cases of GAI in CP, with a particular focus on large language models. Specific examples are provided for the applications of GAI in the subspecialties of clinical chemistry, microbiology, hematopathology, and molecular diagnostics. Additionally, the review addresses potential pitfalls of GAI paradigms. Data Sources.—Current literature on GAI in health care was reviewed broadly. The use case scenarios for each CP subspecialty review common data sources generated in each subspecialty. The potential for utilization of CP data in the GAI context was subsequently assessed, focusing on issues such as future reporting paradigms, impact on quality metrics, and potential for translational research activities. Conclusions.—GAI is a powerful tool with the potential to revolutionize health care for patients and practitioners alike. However, GAI must be implemented with much caution considering various shortcomings of the technology such as biases, hallucinations, practical challenges of implementing GAI in existing CP workflows, and end-user acceptance. Human-in-the-loop models of GAI implementation have the potential to revolutionize CP by delivering deeper, meaningful insights into patient outcomes both at an individual and a population level. © 2025 College of American Pathologists. All rights reserved.","College of American Pathologists","39384182","Article","Final","","Scopus","2-s2.0-85216494599"
"Bejan C.A.; Reed A.M.; Mikula M.; Zhang S.; Xu Y.; Fabbri D.; Embí P.J.; Hsi R.S.","Bejan, Cosmin A. (13007466300); Reed, Amy M. (58260932200); Mikula, Matthew (57212563508); Zhang, Siwei (57219622713); Xu, Yaomin (57213544473); Fabbri, Daniel (51663119900); Embí, Peter J. (14061844500); Hsi, Ryan S. (55255647000)","13007466300; 58260932200; 57212563508; 57219622713; 57213544473; 51663119900; 14061844500; 55255647000","Large language models improve the identification of emergency department visits for symptomatic kidney stones","2025","Scientific Reports","15","1","3503","","","","0","10.1038/s41598-025-86632-5","https://www.scopus.com/inward/record.uri?eid=2-s2.0-85217272463&doi=10.1038%2fs41598-025-86632-5&partnerID=40&md5=3128f83fa59ee3a0124f1afb6afb9a89","Recent advancements of large language models (LLMs) like generative pre-trained transformer 4 (GPT-4) have generated significant interest among the scientific community. Yet, the potential of these models to be utilized in clinical settings remains largely unexplored. In this study, we investigated the abilities of multiple LLMs and traditional machine learning models to analyze emergency department (ED) reports and determine if the corresponding visits were due to symptomatic kidney stones. Leveraging a dataset of manually annotated ED reports, we developed strategies to enhance LLMs including prompt optimization, zero- and few-shot prompting, fine-tuning, and prompt augmentation. Further, we implemented fairness assessment and bias mitigation methods to investigate the potential disparities by LLMs with respect to race and gender. A clinical expert manually assessed the explanations generated by GPT-4 for its predictions to determine if they were sound, factually correct, unrelated to the input prompt, or potentially harmful. The best results were achieved by GPT-4 (macro-F1 = 0.833, 95% confidence interval [CI] 0.826–0.841) and GPT-3.5 (macro-F1 = 0.796, 95% CI 0.796–0.796). Ablation studies revealed that the initial pre-trained GPT-3.5 model benefits from fine-tuning. Adding demographic information and prior disease history to the prompts allows LLMs to make better decisions. Bias assessment found that GPT-4 exhibited no racial or gender disparities, in contrast to GPT-3.5, which failed to effectively model racial diversity. © The Author(s) 2025.","Nature Research","39875475","Article","Final","","Scopus","2-s2.0-85217272463"
"Baeta T.; Rocha A.L.L.; Oliveira J.A.; Couto Da Silva A.P.; Reis Z.S.N.","Baeta, Thais (57219335062); Rocha, Ana Luiza Lunardi (57195466502); Oliveira, Juliana Almeida (59009700300); Couto Da Silva, Ana Paula (59157724100); Reis, Zilma Silveira Nogueira (23029078900)","57219335062; 57195466502; 59009700300; 59157724100; 23029078900","Accuracy of machine learning and traditional statistical models in the prediction of postpartum haemorrhage: A systematic review","2025","BMJ Open","15","3","e094455","","","","0","10.1136/bmjopen-2024-094455","https://www.scopus.com/inward/record.uri?eid=2-s2.0-86000451448&doi=10.1136%2fbmjopen-2024-094455&partnerID=40&md5=0371c0d6d89cd6f802a123a3c7bf8a12","Objectives To evaluate whether postpartum haemorrhage (PPH) can be predicted using both machine learning (ML) and traditional statistical models. Design Diagnostic systematic review and meta-analysis of observational and clinical studies, prospectively registered on PROSPERO, performed accordingly to the Preferred Reporting Items for Systematic Reviews and Meta-analysis and Prediction model risk of bias assessment tool for studies developing, validating or updating prediction models, with the use of an independent analysis by a large language model (GPT-4 Open AI). Data sources MEDLINE/PubMed, LILACS-BVS, Cochrane Library, Scopus-Elsevier, Embase-Elsevier and Web of Science. Eligibility criteria for selected studies The literature search was conducted on 4 January 2024 and included observational studies and clinical trials published in the past 10 years that assessed early PPH and PPH prediction and that applied accuracy metrics for outcomes evaluation. We excluded studies that did not define PPH or had exclusive PPH subgroups evaluation. Primary and secondary outcome measures The primary outcome is the accuracy of PPH prediction using both ML and conventional statistical models. A secondary outcome is to describe the strongest risk factors of PPH identified by ML and traditional statistical models. Results Of 551 citations screened, 35 studies were eligible for inclusion. The synthesis gathered 383 648 patients in 24 studies conducted with conventional statistics (CS), 9 studies using ML models and 2 studies using both methods. Multivariate regression was a preferred modelling approach to predict PPH in CS studies, while ML approaches used multiple models and a myriad of features. ML comparison to CS was only performed in two studies, and ML models demonstrated a 95% higher likelihood of PPH prediction compared with CS when applied to the same dataset (OR 1.95, 95% CI 1.88 to 2.01, p<0.001). The I² had a value of 54%, p=0.14, indicating moderate heterogeneity between the studies. Conclusions ML models are promising for predicting PPH. Nevertheless, they often require a large number of predictors, which may limit their applicability or necessitate automation through digital systems. This poses challenges in resource-scarce settings where the majority of PPH complications occur. PROSPERO registration number CRD42024521059.  © Author(s) (or their employer(s)) 2025.","BMJ Publishing Group","40032385","Article","Final","All Open Access; Gold Open Access","Scopus","2-s2.0-86000451448"
"Dubbala K.; Prizak R.; Metzler I.; Rubeis G.","Dubbala, Keerthi (59681779500); Prizak, Roshan (37023349500); Metzler, Ingrid (36497158100); Rubeis, Giovanni (57190741534)","59681779500; 37023349500; 36497158100; 57190741534","Exploring Heart Disease–Related mHealth Apps in India: Systematic Search in App Stores and Metadata Analysis","2025","Journal of Medical Internet Research","27","","e53823","","","","0","10.2196/53823","https://www.scopus.com/inward/record.uri?eid=2-s2.0-86000462295&doi=10.2196%2f53823&partnerID=40&md5=03c90422396daddc566b44f4e4b3a1c4","Background: Smartphone mobile health (mHealth) apps have the potential to enhance access to health care services and address health care disparities, especially in low-resource settings. However, when developed without attention to equity and inclusivity, mHealth apps can also exacerbate health disparities. Understanding and creating solutions for the disparities caused by mHealth apps is crucial for achieving health equity. There is a noticeable gap in research that comprehensively assesses the entire spectrum of existing health apps and extensively explores apps for specific health priorities from a health care and public health perspective. In this context, with its vast and diverse population, India presents a unique context for studying the landscape of mHealth apps. Objective: This study aimed to create a comprehensive dataset of mHealth apps available in India with an initial focus on heart disease (HD)–related apps. Methods: We collected individual app data from apps in the “medical” and “health and fitness” categories from the Google Play Store and the Apple App Store in December 2022 and July 2023, respectively. Using natural language processing techniques, we selected HD apps, performed statistical analysis, and applied latent Dirichlet allocation for clustering and topic modeling to categorize the resulting HD apps. Results: We collected 118,555 health apps from the Apple App Store and 108,945 health apps from the Google Play Store. Within these datasets, we found that approximately 1.7% (1990/118,555) of apps on the Apple App Store and 0.5% (548/108,945) on the Google Play Store included support for Indian languages. Using monograms and bigrams related to HD, we identified 1681 HD apps from the Apple App Store and 588 HD apps from the Google Play Store. HD apps make up only a small fraction of the total number of health apps available in India. About 90% (1496/1681 on Apple App Store and 548/588 on Google Play Store) of the HD apps were free of cost. However, more than 70% (1329/1681, 79.1% on Apple App Store and 423/588, 71.9% on Google Play Store) of HD apps had no reviews and rating-scores, indicating low overall use. Conclusions: Our study proposed a robust method for collecting and analyzing metadata from a wide array of mHealth apps available in India through the Apple App Store and Google Play Store. We revealed the limited representation of India’s linguistic diversity within the health and medical app landscape, evident from the negligible presence of Indian-language apps. We observed a scarcity of mHealth apps dedicated to HD, along with a lower level of user engagement, as indicated by reviews and app ratings. While most HD apps are financially accessible, uptake remains a challenge. Further research should focus on app quality assessment and factors influencing user adoption. ©Keerthi Dubbala, Roshan Prizak, Ingrid Metzler, Giovanni Rubeis.","JMIR Publications Inc.","40063078","Article","Final","All Open Access; Gold Open Access","Scopus","2-s2.0-86000462295"
"Xie J.; Zhang Z.; Zeng S.; Hilliard J.; An G.; Tang X.; Jiang L.; Yu Y.; Wan X.; Xu D.","Xie, Jiacheng (58204567200); Zhang, Ziyang (58392141500); Zeng, Shuai (57188946534); Hilliard, Joel (58889824600); An, Guanghui (15768691500); Tang, Xiaoting (58890007300); Jiang, Lei (59041028800); Yu, Yang (59090288800); Wan, Xiufeng (9335365800); Xu, Dong (7404074295)","58204567200; 58392141500; 57188946534; 58889824600; 15768691500; 58890007300; 59041028800; 59090288800; 9335365800; 7404074295","Leveraging Large Language Models for Infectious Disease Surveillance—Using a Web Service for Monitoring COVID-19 Patterns From Self-Reporting Tweets: Content Analysis","2025","Journal of Medical Internet Research","27","","e63190","","","","0","10.2196/63190","https://www.scopus.com/inward/record.uri?eid=2-s2.0-85218728760&doi=10.2196%2f63190&partnerID=40&md5=45264307d66fcdc010ca67398d0574dc","Background: The emergence of new SARS-CoV-2 variants, the resulting reinfections, and post–COVID-19 condition continue to impact many people’s lives. Tracking websites like the one at Johns Hopkins University no longer report the daily confirmed cases, posing challenges to accurately determine the true extent of infections. Many COVID-19 cases with mild symptoms are self-assessed at home and reported on social media, which provides an opportunity to monitor and understand the progression and evolving trends of the disease. Objective: We aim to build a publicly available database of COVID-19–related tweets and extracted information about symptoms and recovery cycles from self-reported tweets. We have presented the results of our analysis of infection, reinfection, recovery, and long-term effects of COVID-19 on a visualization website that refreshes data on a weekly basis. Methods: We used Twitter (subsequently rebranded as X) to collect COVID-19–related data, from which 9 native English-speaking annotators annotated a training dataset of COVID-19–positive self-reporters. We then used large language models to identify positive self-reporters from other unannotated tweets. We used the Hibert transform to calculate the lead of the prediction curve ahead of the reported curve. Finally, we presented our findings on symptoms, recovery, reinfections, and long-term effects of COVID-19 on the Covlab website. Results: We collected 7.3 million tweets related to COVID-19 between January 1, 2020, and April 1, 2024, including 262,278 self-reported cases. The predicted number of infection cases by our model is 7.63 days ahead of the official report. In addition to common symptoms, we identified some symptoms that were not included in the list from the US Centers for Disease Control and Prevention, such as lethargy and hallucinations. Repeat infections were commonly occurring, with rates of second and third infections at 7.49% (19,644/262,278) and 1.37% (3593/262,278), respectively, whereas 0.45% (1180/262,278) also reported that they had been infected >5 times. We identified 723 individuals who shared detailed recovery experiences through tweets, indicating a substantially reduction in recovery time over the years. Specifically, the average recovery period decreased from around 30 days in 2020 to approximately 12 days in 2023. In addition, geographic information collected from confirmed individuals indicates that the temporal patterns of confirmed cases in states such as California and Texas closely mirror the overall trajectory observed across the United States. Conclusions: Although with some biases and limitations, self-reported tweet data serves as a valuable complement to clinical data, especially in the postpandemic era dominated by mild cases. Our web-based analytic platform can play a significant role in continuously tracking COVID-19, finding new uncommon symptoms, detecting and monitoring the manifestation of long-term effects, and providing necessary insights to the public and decision-makers. ©Jiacheng Xie, Ziyang Zhang, Shuai Zeng, Joel Hilliard, Guanghui An, Xiaoting Tang, Lei Jiang, Yang Yu, Xiufeng Wan, Dong Xu.","JMIR Publications Inc.","39977859","Article","Final","All Open Access; Gold Open Access","Scopus","2-s2.0-85218728760"
"Topaz M.; Davoudi A.; Evans L.; Sridharan S.; Song J.; Chae S.; Barrón Y.; Hobensack M.; Scharp D.; Cato K.; Rossetti S.C.; Kapela P.; Xu Z.; Gupta P.; Zhang Z.; Mcdonald M.V.; Bowles K.H.","Topaz, Maxim (54790231000); Davoudi, Anahita (57216397259); Evans, Lauren (57208026323); Sridharan, Sridevi (55658421300); Song, Jiyoun (57211232468); Chae, Sena (57200543066); Barrón, Yolanda (57200973704); Hobensack, Mollie (57208080605); Scharp, Danielle (57818690400); Cato, Kenrick (35071035400); Rossetti, Sarah Collins (57022911000); Kapela, Piotr (59485595000); Xu, Zidu (57393186000); Gupta, Pallavi (59485192200); Zhang, Zhihong (59485456800); Mcdonald, Margaret V. (7403020077); Bowles, Kathryn H. (7004543385)","54790231000; 57216397259; 57208026323; 55658421300; 57211232468; 57200543066; 57200973704; 57208080605; 57818690400; 35071035400; 57022911000; 59485595000; 57393186000; 59485192200; 59485456800; 7403020077; 7004543385","Building a Time-Series Model to Predict Hospitalization Risks in Home Health Care: Insights Into Development, Accuracy, and Fairness","2025","Journal of the American Medical Directors Association","26","2","105417","","","","0","10.1016/j.jamda.2024.105417","https://www.scopus.com/inward/record.uri?eid=2-s2.0-85212946037&doi=10.1016%2fj.jamda.2024.105417&partnerID=40&md5=6b1cbc96231451a8a66d2ffa581c0962","Objectives: Home health care (HHC) serves more than 5 million older adults annually in the United States, aiming to prevent unnecessary hospitalizations and emergency department (ED) visits. Despite efforts, up to 25% of patients in HHC experience these adverse events. The underutilization of clinical notes, aggregated data approaches, and potential demographic biases have limited previous HHC risk prediction models. This study aimed to develop a time-series risk model to predict hospitalizations and ED visits in patients in HHC, examine model performance over various prediction windows, identify top predictive variables and map them to data standards, and assess model fairness across demographic subgroups. Setting and Participants: A total of 27,222 HHC episodes between 2015 and 2017. Methods: The study used health care process modeling of electronic health records, including clinical notes processed with natural language processing techniques and Medicare claims data. A Light Gradient Boosting Machine algorithm was used to develop the risk prediction model, with performance evaluated using 5-fold cross-validation. Model fairness was assessed across gender, race/ethnicity, and socioeconomic subgroups. Results: The model achieved high predictive performance, with an F1 score of 0.84 for a 5-day prediction window. Twenty top predictive variables were identified, including novel indicators such as the length of nurse-patient visits and visit frequency. Eighty-five percent of these variables mapped completely to the US Core Data for Interoperability standard. Fairness assessment revealed performance disparities across demographic and socioeconomic groups, with lower model effectiveness for more historically underserved populations. Conclusions and Implications: This study developed a robust time-series risk model for predicting adverse events in patients in HHC, incorporating diverse data types and demonstrating high predictive accuracy. The findings highlight the importance of considering established and novel risk factors in HHC. Importantly, the observed performance disparities across subgroups emphasize the need for fairness adjustments to ensure equitable risk prediction across all patient populations. © 2024 Post-Acute and Long-Term Care Medical Association","Elsevier Inc.","39689864","Article","Final","","Scopus","2-s2.0-85212946037"
