"Authors","Author full names","Author(s) ID","Title","Year","Source title","Volume","Issue","Art. No.","Page start","Page end","Page count","Cited by","DOI","Link","Abstract","Publisher","PubMed ID","Document Type","Publication Stage","Open Access","Source","EID"
"De la Iglesia I.; Goenaga I.; Ramirez-Romero J.; Villa-Gonzalez J.M.; Goikoetxea J.; Barrena A.","De la Iglesia, Iker (57386565500); Goenaga, Iakes (36666260600); Ramirez-Romero, Johanna (59012749700); Villa-Gonzalez, Jose Maria (58155535800); Goikoetxea, Josu (57213223776); Barrena, Ander (55866565800)","57386565500; 36666260600; 59012749700; 58155535800; 57213223776; 55866565800","Ranking Over Scoring: Towards Reliable and Robust Automated Evaluation of LLM-Generated Medical Explanatory Arguments","2025","Proceedings - International Conference on Computational Linguistics, COLING","Part F206484-1","","","9456","9471","15","0","","https://www.scopus.com/inward/record.uri?eid=2-s2.0-85218502681&partnerID=40&md5=ed063a6dfd79703c5ebd7046cb1a0cef","Evaluating LLM-generated text has become a key challenge, especially in domain-specific contexts like the medical field. This work introduces a novel evaluation methodology for LLM-generated medical explanatory arguments, relying on Proxy Tasks and rankings to closely align results with human evaluation criteria, overcoming the biases typically seen in LLMs used as judges. We demonstrate that the proposed evaluators are robust against adversarial attacks, including the assessment of non-argumentative text. Additionally, the human-crafted arguments needed to train the evaluators are minimized to just one example per Proxy Task. By examining multiple LLM-generated arguments, we establish a methodology for determining whether a Proxy Task is suitable for evaluating LLM-generated medical explanatory arguments, requiring only five examples and two human experts. The Proxy Tasks, LM evaluators, and the code are available for reproducibility. © 2025 Association for Computational Linguistics.","Association for Computational Linguistics (ACL)","","Conference paper","Final","","Scopus","2-s2.0-85218502681"
"Farrow L.; Anderson L.; Zhong M.","Farrow, Luke (56763854800); Anderson, Lesley (10639071400); Zhong, Mingjun (56735373600)","56763854800; 10639071400; 56735373600","Managing class imbalance in the training of a large language model to predict patient selection for total knee arthroplasty: Results from the Artificial intelligence to Revolutionise the patient Care pathway in Hip and knEe aRthroplastY (ARCHERY) project","2025","Knee","54","","","1","8","7","0","10.1016/j.knee.2025.02.007","https://www.scopus.com/inward/record.uri?eid=2-s2.0-85218854087&doi=10.1016%2fj.knee.2025.02.007&partnerID=40&md5=057f436a0220f39efcc9cff0503c2338","Introduction: This study set out to test the efficacy of different techniques used to manage to class imbalance, a type of data bias, in application of a large language model (LLM) to predict patient selection for total knee arthroplasty (TKA). Methods: This study utilised data from the Artificial Intelligence to Revolutionise the Patient Care Pathway in Hip and Knee Arthroplasty (ARCHERY) project (ISRCTN18398037). Data included the pre-operative radiology reports of patients referred to secondary care for knee-related complaints from within the North of Scotland. A clinically based LLM (GatorTron) was trained regarding prediction of selection for TKA. Three methods for managing class imbalance were assessed: a standard model, use of class weighting, and majority class undersampling. Results: A total of 7707 individual knee radiology reports were included (dated from 2015 to 2022). The mean text length was 74 words (range 26–275). Only 910/7707 (11.8%) patients underwent TKA surgery (the designated ‘minority class’). Class weighting technique performed better for minority class discrimination and calibration compared with the other two techniques (Recall 0.61/AUROC 0.73 for class weighting compared with 0.54/0.70 and 0.59/0.72 for the standard model and majority class undersampling, respectively. There was also significant data loss for majority class undersampling when compared with class-weighting. Conclusion: Use of class-weighting appears to provide the optimal method of training a an LLM to perform analytical tasks on free-text clinical information in the face of significant data bias (‘class imbalance’). Such knowledge is an important consideration in the development of high-performance clinical AI models within Trauma and Orthopaedics. © 2025 The Author(s)","Elsevier B.V.","","Article","Final","","Scopus","2-s2.0-85218854087"
"Miao S.; Ji P.; Zhu Y.; Meng H.; Jing M.; Sheng R.; Zhang X.; Ding H.; Guo J.; Gao W.; Yang G.; Liu Y.","Miao, Shumei (56200452600); Ji, Pei (59578817300); Zhu, Yongqian (58299256000); Meng, Haoyu (55819685400); Jing, Mang (57218441457); Sheng, Rongrong (57215429846); Zhang, Xiaoliang (57203620419); Ding, Hailong (58691065000); Guo, Jianjun (59558625900); Gao, Wen (57215386118); Yang, Guanyu (16176923900); Liu, Yun (55899963300)","56200452600; 59578817300; 58299256000; 55819685400; 57218441457; 57215429846; 57203620419; 58691065000; 59558625900; 57215386118; 16176923900; 55899963300","The Construction and Application of a Clinical Decision Support System for Cardiovascular Diseases: Multimodal Data-Driven Development and Validation Study","2025","JMIR Medical Informatics","13","","e63186","","","","0","10.2196/63186","https://www.scopus.com/inward/record.uri?eid=2-s2.0-86000186304&doi=10.2196%2f63186&partnerID=40&md5=c2a2d87190316613b36084de256a1dd1","Background: Due to the acceleration of the aging population and the prevalence of unhealthy lifestyles, the incidence of cardiovascular diseases (CVDs) in China continues to grow. However, due to the uneven distribution of medical resources across regions and significant disparities in diagnostic and treatment levels, the diagnosis and management of CVDs face considerable challenges. Objective: The purpose of this study is to build a cardiovascular diagnosis and treatment knowledge base by using new technology, form an auxiliary decision support system, and integrate it into the doctor’s workstation, to improve the assessment rate and treatment standardization rate. This study offers new ideas for the prevention and management of CVDs. Methods: This study designed a clinical decision support system (CDSS) with data, learning, knowledge, and application layers. It integrates multimodal data from hospital laboratory information systems, hospital information systems, electronic medical records, electrocardiography, nursing, and other systems to build a knowledge model. The unstructured data were segmented using natural language processing technology, and medical entity words and entity combination relationships were extracted using IDCNN (iterated dilated convolutional neural network) and TextCNN (text convolutional neural network). The CDSS refers to global CVD assessment indicators to design quality control strategies and an intelligent treatment plan recommendation engine map, establishing a big data analysis platform to achieve multidimensional, visualized data statistics for management decision support. Results: The CDSS system is embedded and interfaced with the physician workstation, triggering in real-time during the clinical diagnosis and treatment process. It establishes a 3-tier assessment control through pop-up windows and screen domination operations. Based on the intelligent diagnostic and treatment reminders of the CDSS, patients are given intervention treatments. The important risk assessment and diagnosis rate indicators significantly improved after the system came into use, and gradually increased within 2 years. The indicators of mandatory control, directly became 100% after the CDSS was online. The CDSS enhanced the standardization of clinical diagnosis and treatment. Conclusions: This study establishes a specialized knowledge base for CVDs, combined with clinical multimodal information, to intelligently assess and stratify cardiovascular patients. It automatically recommends intervention treatments based on assessments and clinical characterizations, proving to be an effective exploration of using a CDSS to build a disease-specific intelligent system. © Shumei Miao, Pei Ji, Yongqian Zhu, Haoyu Meng, Mang Jing, Rongrong Sheng, Xiaoliang Zhang, Hailong Ding, Jianjun Guo, Wen Gao, Guanyu Yang, Yun Liu.","JMIR Publications Inc.","","Article","Final","All Open Access; Gold Open Access","Scopus","2-s2.0-86000186304"
"Bucur A.-M.; Moldovan A.-C.; Parvatikar K.; Zampieri M.; Khudabukhsh A.R.; Dinu L.P.","Bucur, Ana-Maria (57220931771); Moldovan, Andreea-Codrina (57429409200); Parvatikar, Krutika (59393707100); Zampieri, Marcos (8948587300); Khudabukhsh, Ashiqur R. (36835705200); Dinu, Liviu P. (6602512834)","57220931771; 57429409200; 59393707100; 8948587300; 36835705200; 6602512834","On the State of NLP Approaches to Modeling Depression in Social Media: A Post-COVID-19 Outlook","2025","IEEE Journal of Biomedical and Health Informatics","","","","","","","0","10.1109/JBHI.2025.3540507","https://www.scopus.com/inward/record.uri?eid=2-s2.0-86000485311&doi=10.1109%2fJBHI.2025.3540507&partnerID=40&md5=299c11a5e6e7db5216b0be2965fd90c5","Computational approaches to predicting mental health conditions in social media have been substantially explored in the past years. Multiple reviews have been published on this topic, providing the community with comprehensive accounts of the research in this area. Among all mental health conditions, depression is the most widely studied due to its worldwide prevalence. The COVID-19 global pandemic, starting in early 2020, has had a great impact on mental health worldwide. Harsh measures employed by governments to slow the spread of the virus (e.g., lockdowns) and the subsequent economic downturn experienced in many countries have significantly impacted people's lives and mental health. Studies have shown a substantial increase of above 50% in the rate of depression in the population. In this context, we present a review on natural language processing (NLP) approaches to modeling depression in social media, providing the reader with a post-COVID-19 outlook. This review contributes to the understanding of the impacts of the pandemic on modeling depression in social media. We outline how state-of-the-art approaches and new datasets have been used in the context of the COVID-19 pandemic. Finally, we also discuss ethical issues in collecting and processing mental health data, considering fairness, accountability, and ethics. © 2013 IEEE.","Institute of Electrical and Electronics Engineers Inc.","","Article","Article in press","All Open Access; Green Open Access","Scopus","2-s2.0-86000485311"
"Nanor M.A.","Nanor, Michael Ayertey (57195288888)","57195288888","Determinants of households residential mobility decision in Kumasi Ghana","2025","Environment, Development and Sustainability","","","e397","","","","0","10.1007/s10668-025-06046-1","https://www.scopus.com/inward/record.uri?eid=2-s2.0-85218270292&doi=10.1007%2fs10668-025-06046-1&partnerID=40&md5=0e17bf2c03fae6a7995f851f4db2cbb0","Household relocation choices are critical in shaping urban socio-economic landscapes, especially within the framework of the Sustainable Development Goals (SDGs). This study investigates the complex factors influencing household relocation decisions in Kumasi, Ghana, an urban center undergoing rapid growth. The aim is to understand how socio-economic conditions, environmental challenges, and urban policy dynamics interact to shape relocation intentions. Using a qualitative approach, this research use qualitative interviews and natural language processing (NLP) technique to capture the diverse push and pull factors motivating relocation. Findings indicate that push factors, such as inadequate housing, urban congestion, and environmental degradation, diminish quality of life and drive relocation. Conversely, pull factors, including employment opportunities, access to education and healthcare, and enhanced urban amenities, attract households to particular areas within Kumasi. This study situates these relocation dynamics within the SDG framework, highlighting the need for sustainable urban development strategies that address residents' aspirations and challenges. The results emphasize that aligning urban planning with principles of inclusivity, equity, and environmental sustainability can enhance urban resilience and community well-being. The study’s insights are valuable for policymakers, urban planners, and stakeholders seeking to foster urban environments conducive to sustainable development, equitable growth, and social inclusion, ultimately advancing progress toward achieving the SDGs. © The Author(s), under exclusive licence to Springer Nature B.V. 2025.","Springer Science and Business Media B.V.","","Article","Article in press","","Scopus","2-s2.0-85218270292"
"Ben-Zion Z.; Witte K.; Jagadish A.K.; Duek O.; Harpaz-Rotem I.; Khorsandian M.-C.; Burrer A.; Seifritz E.; Homan P.; Schulz E.; Spiller T.R.","Ben-Zion, Ziv (57201300042); Witte, Kristin (57226410887); Jagadish, Akshay K. (57193648204); Duek, Or (49961174700); Harpaz-Rotem, Ilan (6602624108); Khorsandian, Marie-Christine (59670307300); Burrer, Achim (57207832465); Seifritz, Erich (57203074345); Homan, Philipp (37070519500); Schulz, Eric (7202482374); Spiller, Tobias R. (57195731193)","57201300042; 57226410887; 57193648204; 49961174700; 6602624108; 59670307300; 57207832465; 57203074345; 37070519500; 7202482374; 57195731193","Assessing and alleviating state anxiety in large language models","2025","npj Digital Medicine","8","1","132","","","","0","10.1038/s41746-025-01512-6","https://www.scopus.com/inward/record.uri?eid=2-s2.0-86000059115&doi=10.1038%2fs41746-025-01512-6&partnerID=40&md5=118a7dd92bf81db8892b7ee348d08ae9","The use of Large Language Models (LLMs) in mental health highlights the need to understand their responses to emotional content. Previous research shows that emotion-inducing prompts can elevate “anxiety” in LLMs, affecting behavior and amplifying biases. Here, we found that traumatic narratives increased Chat-GPT-4’s reported anxiety while mindfulness-based exercises reduced it, though not to baseline. These findings suggest managing LLMs’ “emotional states” can foster safer and more ethical human-AI interactions. © The Author(s) 2025.","Nature Research","","Article","Final","All Open Access; Gold Open Access","Scopus","2-s2.0-86000059115"
"Ramaniharan A.K.; Pednekar A.; Parikh N.A.; Nagaraj U.D.; Manhard M.K.","Ramaniharan, Anandh Kilpattu (56294871900); Pednekar, Amol (8445326100); Parikh, Nehal A. (7006642541); Nagaraj, Usha D. (15119867600); Manhard, Mary Kate (55660510800)","56294871900; 8445326100; 7006642541; 15119867600; 55660510800","A single 1-min brain MRI scan for generating multiple synthetic image contrasts in awake children from quantitative relaxometry maps","2025","Pediatric Radiology","55","2","666020","312","323","11","0","10.1007/s00247-024-06113-1","https://www.scopus.com/inward/record.uri?eid=2-s2.0-85212428061&doi=10.1007%2fs00247-024-06113-1&partnerID=40&md5=7ca3e776bf1e4238a049140507405368","Background: Diagnostically adequate contrast and spatial resolution in brain MRI require prolonged scan times, leading to motion artifacts and image degradation in awake children. Rapid multi-parametric techniques can produce diagnostic images in awake children, which could help to avoid the need for sedation. Objective: To evaluate the utility of a rapid echo-planar imaging (EPI)–based multi-inversion spin and gradient echo (MI-SAGE) technique for generating multi-parametric quantitative brain maps and synthetic contrast images in awake pediatric participants. Materials and methods: In this prospective IRB-approved study, awake research participants 3–10 years old were scanned using MI-SAGE, MOLLI, GRASE, mGRE, and T1-, T2-, T2*-, and FLAIR-weighted sequences. The MI-SAGE T1, T2, and T2* maps and synthetic images were estimated offline. The MI-SAGE parametric values were compared to those from conventional mapping sequences including MOLLI, GRASE, and mGRE, with assessments of repeatability and reproducibility. Synthetic MI-SAGE images and conventional weighted images were reviewed by a neuroradiologist and scored using a 5-point Likert scale. Gray-to-white matter contrast ratios (GWRs) were compared between MI-SAGE synthetic and conventional weighted images. The results were analyzed using the Bland–Altman analysis and intra-class correlation coefficient (ICC). Results: A total of 24 healthy participants aged 3 years to 10 years (mean ± SD, 6.5 ± 1.9; 12 males) completed full imaging exams including the 54-s MI-SAGE acquisition and were included in the analysis. The MI-SAGE T1, T2, and T2* had biases of 32%, -4%, and 23% compared to conventional mapping methods using MOLLI, GRASE, and mGRE, respectively, with moderate to very strong correlations (ICC=0.49–0.99). All MI-SAGE maps exhibited strong to very strong repeatability and reproducibility (ICC=0.80 to 0.99). The synthetic MI-SAGE had average Likert scores of 2.1, 2.1, 2.9, and 2.0 for T1-, T2-, T2*-, and FLAIR-weighted images, respectively, while conventional acquisitions had Likert scores of 3.5, 3.6, 4.6, and 3.8 for T1-, T2-, T2*-, and FLAIR-weighted images, respectively. The MI-SAGE synthetic T1w, T2w, T2*w, and FLAIR GWRs had biases of 17%, 3%, 7%, and 1% compared to the GWR of images from conventional T1w, T2w, T2*w, and FLAIR acquisitions respectively. Conclusion: The derived T1, T2, and T2* maps were correlated with conventional mapping methods and showed strong repeatability and reproducibility. While synthetic MI-SAGE images had greater susceptibility artifacts and lower Likert scores than conventional images, the MI-SAGE technique produced synthetic weighted images with contrasts similar to conventional weighted images and achieved a ten-fold reduction in scan time. © The Author(s), under exclusive licence to Springer-Verlag GmbH Germany, part of Springer Nature 2024.","Springer Nature","39692886","Article","Final","","Scopus","2-s2.0-85212428061"
"Atmakuru A.; Shahini A.; Chakraborty S.; Seoni S.; Salvi M.; Hafeez-Baig A.; Rashid S.; Tan R.S.; Barua P.D.; Molinari F.; Acharya U.R.","Atmakuru, Anirudh (58653527900); Shahini, Alen (59002287600); Chakraborty, Subrata (56377149900); Seoni, Silvia (57213608081); Salvi, Massimo (57191596088); Hafeez-Baig, Abdul (24461808100); Rashid, Sadaf (59195362200); Tan, Ru San (7201984906); Barua, Prabal Datta (36993665100); Molinari, Filippo (7004289592); Acharya, U Rajendra (7004510847)","58653527900; 59002287600; 56377149900; 57213608081; 57191596088; 24461808100; 59195362200; 7201984906; 36993665100; 7004289592; 7004510847","Artificial intelligence-based suicide prevention and prediction: A systematic review (2019–2023)","2025","Information Fusion","114","","102673","","","","0","10.1016/j.inffus.2024.102673","https://www.scopus.com/inward/record.uri?eid=2-s2.0-85204091360&doi=10.1016%2fj.inffus.2024.102673&partnerID=40&md5=274a0486ad187e8316e1763c7580eb24","Suicide is a major global public health concern, and the application of artificial intelligence (AI) methods, such as natural language processing (NLP), machine learning (ML), and deep learning (DL), has shown promise in advancing suicide prediction and prevention efforts. Recent advancements in AI – particularly NLP and DL have opened up new avenues of research in suicide prediction and prevention. While several papers have reviewed specific detection techniques like NLP or DL, there has been no recent study that acts as a one-stop-shop, providing a comprehensive overview of all AI-based studies in this field. In this work, we conduct a systematic literature review to identify relevant studies published between 2019 and 2023, resulting in the inclusion of 156 studies. We provide a comprehensive overview of the current state of research conducted on AI-driven suicide prevention and prediction, focusing on different data types and AI techniques employed. We discuss the benefits and challenges of these approaches and propose future research directions to improve the practical application of AI in suicide research. AI is highly capable of improving the accuracy and efficiency of risk assessment, enabling personalized interventions, and enhancing our understanding of risk and protective factors. Multidisciplinary approaches combining diverse data sources and AI methods can help identify individuals at risk by analyzing social media content, patient histories, and data from mobile devices, enabling timely intervention. However, challenges related to data privacy, algorithmic bias, model interpretability, and real-world implementation must be addressed to realize the full potential of these technologies. Future research should focus on integrating prediction and prevention strategies, harnessing multimodal data, and expanding the scope to include diverse populations. Collaboration across disciplines and stakeholders is essential to ensure that AI-driven suicide prevention and prediction efforts are ethical, culturally sensitive, and person-centered. © 2024 Elsevier B.V.","Elsevier B.V.","","Article","Final","","Scopus","2-s2.0-85204091360"
"Bui N.; Nguyen G.; Nguyen N.; Vo B.; Vo L.; Huynh T.; Tang A.; Tran V.N.; Huynh T.; Nguyen H.Q.; Dinh M.","Bui, Nhat (59227827600); Nguyen, Giang (9043171900); Nguyen, Nguyen (59566164900); Vo, Bao (59565934800); Vo, Luan (59566237200); Huynh, Tom (58404701200); Tang, Arthur (57201649539); Tran, Van Nhiem (57736724900); Huynh, Tuyen (59566007800); Nguyen, Huy Quang (57459546700); Dinh, Minh (56722749600)","59227827600; 9043171900; 59566164900; 59565934800; 59566237200; 58404701200; 57201649539; 57736724900; 59566007800; 57459546700; 56722749600","Fine-tuning large language models for improved health communication in low-resource languages","2025","Computer Methods and Programs in Biomedicine","263","","108655","","","","0","10.1016/j.cmpb.2025.108655","https://www.scopus.com/inward/record.uri?eid=2-s2.0-85218354763&doi=10.1016%2fj.cmpb.2025.108655&partnerID=40&md5=1f412394ea4b574ccda2d45df676eaa8","Background: The reported study illustrates a methodology for compiling training datasets to fine-tune Large Language Models (LLMs) for healthcare information in Vietnamese, a low-resource language. The objective is to bridge the gap in medical information accessibility and enhance healthcare communication in developing countries by adapting LLMs to specific linguistic nuances and domain needs. Method: The methodology involves selecting a base model, compiling a domain-specific dataset, and fine-tuning the model with this dataset. Three open-source models were selected. The dataset, comprising approximately 337,000 prompt-response pairs in Vietnamese, was compiled using existing datasets, data crawled from Vietnamese medical online forums, and distilled from Vietnamese medical textbooks. The three models were fine-tuned using the Low-Rank adaptation (LoRA) and Quantized Low-Rank adaptation (QLoRA) techniques. Models’ performances were evaluated using BertScore score, Rouge-L score, and the ""LLM-as-a-Judge"" method. Results: The fine-tuned models showed enhancements in performance over their base versions across evaluation metrics in BertScore score, Rouge-L score and “LLM-as-a-Judge” method, confirming the effectiveness of the fine-tuning process. This study details the process of fine-tuning open-source LLMs for health information inquiries in Vietnamese, demonstrating its potential to improve healthcare communication in low-resource languages. Deploying the fine-tuned LLM on-premise enhances data privacy and security. However, the significant computing power and costs required pose challenges, especially for organizations in developing countries. Conclusion: This case study highlights the unique challenges faced by developing countries using low-resource languages. Initiatives are needed to emphasize efforts to bridge healthcare gaps in underserved areas and contribute to global health equity. © 2025 The Author(s)","Elsevier Ireland Ltd","","Article","Final","All Open Access; Hybrid Gold Open Access","Scopus","2-s2.0-85218354763"
