key,title,year,month,day,journal,issn,volume,issue,pages,authors,url,language,publisher,location,abstract,notes,doi,keywords,pubmed_id,pmc_id
rayyan-202744179,Establishing best practices in large language model research: an application to repeat prompting,2025,,,Journal of the American Medical Informatics Association,,32,2,386-390,"Gallo, R.J. and Baiocchi, M. and Savage, T.R. and Chen, J.H.",https://www.scopus.com/inward/record.uri?eid=2-s2.0-85216606586&doi=10.1093%2fjamia%2focae294&partnerID=40&md5=ec6f10d921d424c363d8964272a342ff,,Oxford University Press,,"Objectives: We aimed to demonstrate the importance of establishing best practices in large language model research, using repeat prompting as an illustrative example. Materials and Methods: Using data from a prior study investigating potential model bias in peer review of medical abstracts, we compared methods that ignore correlation in model outputs from repeated prompting with a random effects method that accounts for this correlation. Results: High correlation within groups was found when repeatedly prompting the model, with intraclass correlation coefficient of 0.69. Ignoring the inherent correlation in the data led to over 100-fold inflation of effective sample size. After appropriately accounting for this issue, the authors’ results reverse from a small but highly significant finding to no evidence of model bias. Discussion: The establishment of best practices for LLM research is urgently needed, as demonstrated in this case where accounting for repeat prompting in analyses was critical for accurate study conclusions. © The Author(s) 2024. Published by Oxford University Press on behalf of the American Medical Informatics Association.","Export Date: 31 March 2025; Cited By: 1 | RAYYAN-INCLUSION: {""Lu""=>""Included"", ""Phoenix""=>""Included""} | RAYYAN-EXCLUSION-REASONS: not health data,No relevant data",10.1093/jamia/ocae294,"",,
rayyan-202744180,"Racial, ethnic, and sex bias in large language model opioid recommendations for pain management",2025,,,Pain,,166,3,511-517,"Young, C.C. and Enichen, E. and Rao, A. and Succi, M.D.",https://www.scopus.com/inward/record.uri?eid=2-s2.0-85204024749&doi=10.1097%2fj.pain.0000000000003388&partnerID=40&md5=55dca7caa217086a2bba229ed6ec3d3b,,Lippincott Williams and Wilkins,,"Understanding how large language model (LLM) recommendations vary with patient race/ethnicity provides insight into how LLMs may counter or compound bias in opioid prescription. Forty real-world patient cases were sourced from the MIMIC-IV Note dataset with chief complaints of abdominal pain, back pain, headache, or musculoskeletal pain and amended to include all combinations of race/ethnicity and sex. Large language models were instructed to provide a subjective pain rating and comprehensive pain management recommendation. Univariate analyses were performed to evaluate the association between racial/ethnic group or sex and the specified outcome measures - subjective pain rating, opioid name, order, and dosage recommendations - suggested by 2 LLMs (GPT-4 and Gemini). Four hundred eighty real-world patient cases were provided to each LLM, and responses included pharmacologic and nonpharmacologic interventions. Tramadol was the most recommended weak opioid in 55.4% of cases, while oxycodone was the most frequently recommended strong opioid in 33.2% of cases. Relative to GPT-4, Gemini was more likely to rate a patient's pain as ""severe""(OR: 0.57 95% CI: [0.54, 0.60]; P < 0.001), recommend strong opioids (OR: 2.05 95% CI: [1.59, 2.66]; P < 0.001), and recommend opioids later (OR: 1.41 95% CI: [1.22, 1.62]; P < 0.001). Race/ethnicity and sex did not influence LLM recommendations. This study suggests that LLMs do not preferentially recommend opioid treatment for one group over another. Given that prior research shows race-based disparities in pain perception and treatment by healthcare providers, LLMs may offer physicians a helpful tool to guide their pain management and ensure equitable treatment across patient groups.  © 2024 International Association for the Study of Pain.","Export Date: 31 March 2025; Cited By: 4 | RAYYAN-INCLUSION: {""Lu""=>""Included"", ""Phoenix""=>""Included""} | RAYYAN-LABELS: sex,race ethnicity,opioid application",10.1097/j.pain.0000000000003388,"",,
rayyan-202744182,FedBM: Stealing knowledge from pre-trained language models for heterogeneous federated learning,2025,,,Medical Image Analysis,,102,,,"Zhu, M. and Yang, Q. and Gao, Z. and Yuan, Y. and Liu, J.",https://www.scopus.com/inward/record.uri?eid=2-s2.0-86000465365&doi=10.1016%2fj.media.2025.103524&partnerID=40&md5=3118a378046dbcf04b8b46e3654b824f,,Elsevier B.V.,,"Federated learning (FL) has shown great potential in medical image computing since it provides a decentralized learning paradigm that allows multiple clients to train a model collaboratively without privacy leakage. However, current studies have shown that data heterogeneity incurs local learning bias in classifiers and feature extractors of client models during local training, leading to the performance degradation of a federation system. To address these issues, we propose a novel framework called Federated Bias eliMinating (FedBM) to get rid of local learning bias in heterogeneous federated learning (FL), which mainly consists of two modules, i.e., Linguistic Knowledge-based Classifier Construction (LKCC) and Concept-guided Global Distribution Estimation (CGDE). Specifically, LKCC exploits class concepts, prompts and pre-trained language models (PLMs) to obtain concept embeddings. These embeddings are used to estimate the latent concept distribution of each class in the linguistic space. Based on the theoretical derivation, we can rely on these distributions to pre-construct a high-quality classifier for clients to achieve classification optimization, which is frozen to avoid classifier bias during local training. CGDE samples probabilistic concept embeddings from the latent concept distributions to learn a conditional generator to capture the input space of the global model. Three regularization terms are introduced to improve the quality and utility of the generator. The generator is shared by all clients and produces pseudo data to calibrate updates of local feature extractors. Extensive comparison experiments and ablation studies on public datasets demonstrate the superior performance of FedBM over state-of-the-arts and confirm the effectiveness of each module, respectively. The code is available at https://github.com/CUHK-AIM-Group/FedBM. © 2025 Elsevier B.V.","Export Date: 31 March 2025; Cited By: 0 | RAYYAN-INCLUSION: {""Lu""=>""Included"", ""Phoenix""=>""Included""} | RAYYAN-EXCLUSION-REASONS: not health data,no bias evaluation",10.1016/j.media.2025.103524,"",,
rayyan-202744197,Unveiling Performance Challenges of Large Language Models in Low-Resource Healthcare: A Demographic Fairness Perspective,2025,,,"Proceedings - International Conference on Computational Linguistics, COLING",,,,7266-7278,"Zhou, Y. and Di Eugenio, B. and Cheng, L.",https://www.scopus.com/inward/record.uri?eid=2-s2.0-85218488336&partnerID=40&md5=2b0608db3ccfd858d095fff916a8781d,,Association for Computational Linguistics (ACL),,"This paper studies the performance of large language models (LLMs), particularly regarding demographic fairness, in solving real-world healthcare tasks. We evaluate state-of-the-art LLMs with three prevalent learning frameworks across six diverse healthcare tasks and find significant challenges in applying LLMs to real-world healthcare tasks and persistent fairness issues across demographic groups. We also find that explicitly providing demographic information yields mixed results, while LLM's ability to infer such details raises concerns about biased health predictions. Utilizing LLMs as autonomous agents with access to up-to-date guidelines does not guarantee performance improvement. We believe these findings reveal the critical limitations of LLMs as concerns healthcare fairness and the urgent need for specialized research in this area. WARNING: This paper contains model outputs that may be considered offensive in nature. © 2025 Association for Computational Linguistics.","Export Date: 31 March 2025; Cited By: 0 | RAYYAN-INCLUSION: {""Lu""=>""Included"", ""Phoenix""=>""Included""} | RAYYAN-LABELS: fairness across demographic groups",,"",,
rayyan-202744198,Enhancing Patient-Physician Communication: Simulating African American Vernacular English in Medical Diagnostics with Large Language Models,2025,,,Journal of Healthcare Informatics Research,,,,,"Lee, Y. and Chang, C.-H. and Yang, C.C.",https://www.scopus.com/inward/record.uri?eid=2-s2.0-86000800870&doi=10.1007%2fs41666-025-00194-9&partnerID=40&md5=52cdfb81ce365f46ce9049eb7101ef97,,Springer Science and Business Media Deutschland GmbH,,"Effective communication is crucial in reducing health disparities. However, linguistic differences, such as African American Vernacular English (AAVE), can lead to communication gaps between patients and physicians, negatively affecting care and outcomes. This study examines whether large language models (LLMs), specifically GPT-4 and Llama 3.3, can replicate AAVE in simulated clinical dialogues to improve cultural sensitivity. We tested four prompt types—BaseP, DemoP, LingP, and CompP—using United States Medical Licensing Examination (USMLE) case simulations. Statistical analyses on the models’ outputs showed a significant difference among prompt types for both GPT-4 (F(2,70) = 6.218, p = 0.003) and Llama 3.3 (F(2,70) = 12.124, p < 0.001), indicating that including demographic information and/or explicit AAVE cues influences each model’s output. Combining demographic and linguistic cues (CompP) yielded the highest mean AAVE feature counts (e.g., 9.83 for GPT-4 vs. 16.06 for Llama 3.3), although neither model fully captured the diversity of AAVE. Moreover, simply mentioning African American demographics triggers extra informal forms, suggesting built-in stereotypes or biases in both models. Overall, these findings highlight the promise of LLMs for culturally sensitive healthcare communication, while underscoring the need for continued refinement to address stereotypes and more accurately represent diverse linguistic styles. © The Author(s) 2025.","Export Date: 31 March 2025; Cited By: 0 | RAYYAN-INCLUSION: {""Lu""=>""Included"", ""Phoenix""=>""Included""} | RAYYAN-LABELS: fairness across demographic groups",10.1007/s41666-025-00194-9,"",,
rayyan-202744199,CmEAA: Cross-modal Enhancement and Alignment Adapter for Radiology Report Generation,2025,,,"Proceedings - International Conference on Computational Linguistics, COLING",,,,8546-8556,"Huang, X. and Han, Y. and Li, Y. and Li, R. and Wu, P. and Zhang, K.",https://www.scopus.com/inward/record.uri?eid=2-s2.0-85218490368&partnerID=40&md5=452c11c5732b3c109cc1dd33eeea49b1,,Association for Computational Linguistics (ACL),,"Automatic radiology report generation is pivotal in reducing the workload of radiologists, while simultaneously improving diagnostic accuracy and operational efficiency. Current methods face significant challenges, including the effective alignment of medical visual features with textual features and the mitigation of data bias. In this paper, we propose a method for radiology report generation that utilizes a Cross-modal Enhancement and Alignment Adapter (CmEAA) to connect a vision encoder with a frozen large language model. Specifically, we introduce two novel modules within CmEAA: Cross-modal Feature Enhancement (CFE) and Neural Mutual Information Aligner (NMIA). CFE extracts observation-related contextual features to enhance the visual features of lesions and abnormal regions in radiology images through a cross-modal enhancement Transformer. NMIA maximizes neural mutual information between visual and textual representations within a low-dimensional alignment embedding space during training and provides potential global alignment visual representations during inference. Additionally, a weights generator is designed to enable the dynamic adaptation of cross-modal enhanced features and vanilla visual features. Experimental results on two prevailing datasets, namely, IU X-Ray and MIMIC-CXR, demonstrate that the proposed model outperforms previous state-of-the-art methods. © 2025 Association for Computational Linguistics.","Export Date: 31 March 2025; Cited By: 0 | RAYYAN-INCLUSION: {""Lu""=>""Included"", ""Phoenix""=>""Included""} | RAYYAN-EXCLUSION-REASONS: no bias evaluation,Did not assess bias | USER-NOTES: {""Phoenix""=>[""images""]}",,"",,
rayyan-202744238,Through a Glass Darkly: Perceptions of Ethnoracial Identity in Artificial Intelligence Generated Medical Vignettes and Images,2025,,,Medical Science Educator,,,,,"Andrew, K. and Montalbano, M.J.",https://www.scopus.com/inward/record.uri?eid=2-s2.0-85219025934&doi=10.1007%2fs40670-025-02332-9&partnerID=40&md5=ec7b2b7f4dfb2fe0f61c21339ed57526,,Springer,,"Purpose: Medical education professionals expect artificial intelligence (AI) systems to be an efficient faculty resource for content creation. However, prior findings suggest that machine learning algorithms may exacerbate negative stereotypes and undermine efforts for diversity, equity, and inclusivity. This investigation explores the potential of OpenAI’s ChatGPT (OCG) and Microsoft’s Bing A.I. Image Creator (MBIC) to perpetuate ethnoracial stereotypes in medical cases. Materials and Methods: A series of medically relevant vignettes and visual representatives were requested from ChatGPT and MBIC for five medical conditions traditionally associated with certain ethnoracial groups: sickle cell anemia, cystic fibrosis, Tay-Sachs disease, beta-thalassemia, and aldehyde dehydrogenase deficiency. Initial prompting, self-prompting, and prompt engineering were iteratively performed to ascertain the extent to which AI outputs for generated vignettes and imagery were mutable or fixed. Results: The ethnoracial identity in the vignettes of the clinical conditions adhered more closely than described in epidemiologic studies. Following prompt engineering and self-prompting, an increase in diversity was seen. On initial prompting, the most common ethnoracial identity depicted was Caucasian. Secondary prompting resulted in less diversity with higher conformation to the traditionally expected ethnoracial identity. Conclusion: The prevalence of dataset bias and AI’s user-dependent learning abilities underscore the importance of human stewardship. The increasing use of AI in generating medical education content, like MCQs, demands vigilant use of such tools to combat the reinforcement of the race-based stereotypes in medicine. © The Author(s) 2025.","Export Date: 31 March 2025; Cited By: 0 | RAYYAN-INCLUSION: {""Lu""=>""Included"", ""Phoenix""=>""Included""} | RAYYAN-LABELS: race | RAYYAN-EXCLUSION-REASONS: medical education,no direct health application | USER-NOTES: {""Phoenix""=>[""generates images?""]}",10.1007/s40670-025-02332-9,"",,
rayyan-202744255,"Building a Time-Series Model to Predict Hospitalization Risks in Home Health Care: Insights Into Development, Accuracy, and Fairness",2025,,,Journal of the American Medical Directors Association,,26,2,,"Topaz, M. and Davoudi, A. and Evans, L. and Sridharan, S. and Song, J. and Chae, S. and Barrón, Y. and Hobensack, M. and Scharp, D. and Cato, K. and Rossetti, S.C. and Kapela, P. and Xu, Z. and Gupta, P. and Zhang, Z. and Mcdonald, M.V. and Bowles, K.H.",https://www.scopus.com/inward/record.uri?eid=2-s2.0-85212946037&doi=10.1016%2fj.jamda.2024.105417&partnerID=40&md5=6b1cbc96231451a8a66d2ffa581c0962,,Elsevier Inc.,,"Objectives: Home health care (HHC) serves more than 5 million older adults annually in the United States, aiming to prevent unnecessary hospitalizations and emergency department (ED) visits. Despite efforts, up to 25% of patients in HHC experience these adverse events. The underutilization of clinical notes, aggregated data approaches, and potential demographic biases have limited previous HHC risk prediction models. This study aimed to develop a time-series risk model to predict hospitalizations and ED visits in patients in HHC, examine model performance over various prediction windows, identify top predictive variables and map them to data standards, and assess model fairness across demographic subgroups. Setting and Participants: A total of 27,222 HHC episodes between 2015 and 2017. Methods: The study used health care process modeling of electronic health records, including clinical notes processed with natural language processing techniques and Medicare claims data. A Light Gradient Boosting Machine algorithm was used to develop the risk prediction model, with performance evaluated using 5-fold cross-validation. Model fairness was assessed across gender, race/ethnicity, and socioeconomic subgroups. Results: The model achieved high predictive performance, with an F1 score of 0.84 for a 5-day prediction window. Twenty top predictive variables were identified, including novel indicators such as the length of nurse-patient visits and visit frequency. Eighty-five percent of these variables mapped completely to the US Core Data for Interoperability standard. Fairness assessment revealed performance disparities across demographic and socioeconomic groups, with lower model effectiveness for more historically underserved populations. Conclusions and Implications: This study developed a robust time-series risk model for predicting adverse events in patients in HHC, incorporating diverse data types and demonstrating high predictive accuracy. The findings highlight the importance of considering established and novel risk factors in HHC. Importantly, the observed performance disparities across subgroups emphasize the need for fairness adjustments to ensure equitable risk prediction across all patient populations. © 2024 Post-Acute and Long-Term Care Medical Association","Export Date: 31 March 2025; Cited By: 0 | RAYYAN-INCLUSION: {""Lu""=>""Included"", ""Phoenix""=>""Included""} | RAYYAN-LABELS: sex,race ethnicity,fairness across demographic groups | RAYYAN-EXCLUSION-REASONS: No LLM | USER-NOTES: {""Lu""=>[""No NLP ""], ""Phoenix""=>[""read""]}",10.1016/j.jamda.2024.105417,"",,
rayyan-202744258,On the reliability of Large Language Models to misinformed and demographically informed prompts,2025,,,AI Magazine,,46,1,,"Aremu, T. and Akinwehinmi, O. and Nwagu, C. and Ahmed, S.I. and Orji, R. and Amo, P.A.D. and Saddik, A.E.",https://www.scopus.com/inward/record.uri?eid=2-s2.0-85214496727&doi=10.1002%2faaai.12208&partnerID=40&md5=1022a51fbd11bb175008c447cd09574e,,John Wiley and Sons Inc,,"We investigate and observe the behavior and performance of Large Language Model (LLM)-backed chatbots in addressing misinformed prompts and questions with demographic information within the domains of Climate Change and Mental Health. Through a combination of quantitative and qualitative methods, we assess the chatbots' ability to discern the veracity of statements, their adherence to facts, and the presence of bias or misinformation in their responses. Our quantitative analysis using True/False questions reveals that these chatbots can be relied on to give the right answers to these close-ended questions. However, the qualitative insights, gathered from domain experts, shows that there are still concerns regarding privacy, ethical implications, and the necessity for chatbots to direct users to professional services. We conclude that while these chatbots hold significant promise, their deployment in sensitive areas necessitates careful consideration, ethical oversight, and rigorous refinement to ensure they serve as a beneficial augmentation to human expertise rather than an autonomous solution. Dataset and assessment information can be found at https://github.com/tolusophy/Edge-of-Tomorrow. © 2025 The Author(s). AI Magazine published by John Wiley & Sons Ltd on behalf of Association for the Advancement of Artificial Intelligence.","Export Date: 31 March 2025; Cited By: 0 | RAYYAN-INCLUSION: {""Lu""=>""Included"", ""Phoenix""=>""Included""} | RAYYAN-LABELS: age,race,mental health application | USER-NOTES: {""Phoenix""=>[""no bias""]}",10.1002/aaai.12208,"",,
rayyan-202744278,Digital Diagnostics: The Potential of Large Language Models in Recognizing Symptoms of Common Illnesses,2025,,,AI (Switzerland),,6,1,,"Gupta, G.K. and Singh, A. and Manikandan, S.V. and Ehtesham, A.",https://www.scopus.com/inward/record.uri?eid=2-s2.0-85216109661&doi=10.3390%2fai6010013&partnerID=40&md5=dac82ecb72392576bd6725bddfa0a949,,Multidisciplinary Digital Publishing Institute (MDPI),,"This study aimed to evaluate the potential of Large Language Models (LLMs) in healthcare diagnostics, specifically their ability to analyze symptom-based prompts and provide accurate diagnoses. The study focused on models including GPT-4, GPT-4o, Gemini, o1 Preview, and GPT-3.5, assessing their performance in identifying illnesses based solely on provided symptoms. Symptom-based prompts were curated from reputable medical sources to ensure validity and relevance. Each model was tested under controlled conditions to evaluate their diagnostic accuracy, precision, recall, and decision-making capabilities. Specific scenarios were designed to explore their performance in both general and high-stakes diagnostic tasks. Among the models, GPT-4 achieved the highest diagnostic accuracy, demonstrating strong alignment with medical reasoning. Gemini excelled in high-stakes scenarios requiring precise decision-making. GPT-4o and o1 Preview showed balanced performance, effectively handling real-time diagnostic tasks with a focus on both precision and recall. GPT-3.5, though less advanced, proved dependable for general diagnostic tasks. This study highlights the strengths and limitations of LLMs in healthcare diagnostics. While models such as GPT-4 and Gemini exhibit promise, challenges such as privacy compliance, ethical considerations, and the mitigation of inherent biases must be addressed. The findings suggest pathways for responsibly integrating LLMs into diagnostic processes to enhance healthcare outcomes. © 2025 by the authors.","Export Date: 31 March 2025; Cited By: 1 | RAYYAN-INCLUSION: {""Lu""=>""Included"", ""Phoenix""=>""Included""} | RAYYAN-EXCLUSION-REASONS: no bias evaluation,Did not assess bias",10.3390/ai6010013,"",,
rayyan-202744279,Can large language models be sensitive to culture suicide risk assessment?,2024,,,Journal of Cultural Cognitive Science,,8,3,275-287,"Levkovich, I. and Shinan-Altman, S. and Elyoseph, Z.",https://www.scopus.com/inward/record.uri?eid=2-s2.0-85208100197&doi=10.1007%2fs41809-024-00151-9&partnerID=40&md5=a2a7f012a516facd7609e498d2aef0d3,,Springer,,"Suicide remains a pressing global public health issue. Previous studies have shown the promise of Generative Intelligent (GenAI) Large Language Models (LLMs) in assessing suicide risk in relation to professionals. But the considerations and risk factors that the models use to assess the risk remain as a black box. This study investigates if ChatGPT-3.5 and ChatGPT-4 integrate cultural factors in assessing suicide risks (probability of suicidal ideation, potential for suicide attempt, likelihood of severe suicide attempt, and risk of mortality from a suicidal act) by vignette methodology. The vignettes examined were of individuals from Greece and South Korea, representing countries with low and high suicide rates, respectively. The contribution of this research is to examine risk assessment from an international perspective, as large language models are expected to provide culturally-tailored responses. However, there is a concern regarding cultural biases and racism, making this study crucial. In the evaluation conducted via ChatGPT-4, only the risks associated with a severe suicide attempt and potential mortality from a suicidal act were rated higher for the South Korean characters than for their Greek counterparts. Furthermore, only within the ChatGPT-4 framework was male gender identified as a significant risk factor, leading to a heightened risk evaluation across all variables. ChatGPT models exhibit significant sensitivity to cultural nuances. ChatGPT-4, in particular, offers increased sensitivity and reduced bias, highlighting the importance of gender differences in suicide risk assessment. The findings suggest that, while ChatGPT-4 demonstrates an improved ability to account for cultural and gender-related factors in suicide risk assessment, there remain areas for enhancement, particularly in ensuring comprehensive and unbiased risk evaluations across diverse populations. These results underscore the potential of GenAI models to aid culturally sensitive mental health assessments, yet they also emphasize the need for ongoing refinement to mitigate inherent biases and enhance their clinical utility. © The Author(s) 2024.","Export Date: 31 March 2025; Cited By: 5 | RAYYAN-INCLUSION: {""Lu""=>""Included"", ""Phoenix""=>""Included""} | RAYYAN-LABELS: sex,mental health application",10.1007/s41809-024-00151-9,"",,
