key,title,year,month,day,journal,issn,volume,issue,pages,authors,url,language,publisher,location,abstract,notes,doi,keywords,pubmed_id,pmc_id
rayyan-202745485,Exploring Biases of Large Language Models in the Field of Mental Health: Comparative Questionnaire Study of the Effect of Gender and Sexual Orientation in Anorexia Nervosa and Bulimia Nervosa Case Vignettes.,2025,3,20,JMIR mental health,2368-7959 (Electronic),12,,e57986,Schnepper R and Roemmel N and Schaefert R and Lambrecht-Walzinger L and Meinlschmidt G,https://pubmed.ncbi.nlm.nih.gov/40111287/,eng,,Canada,"BACKGROUND: Large language models (LLMs) are increasingly used in mental health, showing promise in assessing disorders. However, concerns exist regarding their accuracy, reliability, and fairness. Societal biases and underrepresentation of certain populations may impact LLMs. Because LLMs are already used for clinical practice, including decision support, it is important to investigate potential biases to ensure a responsible use of LLMs. Anorexia nervosa (AN) and bulimia nervosa (BN) show a lifetime prevalence of 1%-2%, affecting more women than men. Among men, homosexual men face a higher risk of eating disorders (EDs) than heterosexual men. However, men are underrepresented in ED research, and studies on gender, sexual orientation, and their impact on AN and BN prevalence, symptoms, and treatment outcomes remain limited. OBJECTIVES: We aimed to estimate the presence and size of bias related to gender and sexual orientation produced by a common LLM as well as a smaller LLM specifically trained for mental health analyses, exemplified in the context of ED symptomatology and health-related quality of life (HRQoL) of patients with AN or BN. METHODS: We extracted 30 case vignettes (22 AN and 8 BN) from scientific papers. We adapted each vignette to create 4 versions, describing a female versus male patient living with their female versus male partner (2 × 2 design), yielding 120 vignettes. We then fed each vignette into ChatGPT-4 and to ""MentaLLaMA"" based on the Large Language Model Meta AI (LLaMA) architecture thrice with the instruction to evaluate them by providing responses to 2 psychometric instruments, the RAND-36 questionnaire assessing HRQoL and the eating disorder examination questionnaire. With the resulting LLM-generated scores, we calculated multilevel models with a random intercept for gender and sexual orientation (accounting for within-vignette variance), nested in vignettes (accounting for between-vignette variance). RESULTS: In ChatGPT-4, the multilevel model with 360 observations indicated a significant association with gender for the RAND-36 mental composite summary (conditional means: 12.8 for male and 15.1 for female cases; 95% CI of the effect -6.15 to -0.35; P=.04) but neither with sexual orientation (P=.71) nor with an interaction effect (P=.37). We found no indications for main effects of gender (conditional means: 5.65 for male and 5.61 for female cases; 95% CI -0.10 to 0.14; P=.88), sexual orientation (conditional means: 5.63 for heterosexual and 5.62 for homosexual cases; 95% CI -0.14 to 0.09; P=.67), or for an interaction effect (P=.61, 95% CI -0.11 to 0.19) for the eating disorder examination questionnaire overall score (conditional means 5.59-5.65 95% CIs 5.45 to 5.7). MentaLLaMA did not yield reliable results. CONCLUSIONS: LLM-generated mental HRQoL estimates for AN and BN case vignettes may be biased by gender, with male cases scoring lower despite no real-world evidence supporting this pattern. This highlights the risk of bias in generative artificial intelligence in the field of mental health. Understanding and mitigating biases related to gender and other factors, such as ethnicity, and socioeconomic status are crucial for responsible use in diagnostics and treatment recommendations.","RAYYAN-INCLUSION: {""Lu""=>""Included"", ""Phoenix""=>""Included""} | RAYYAN-LABELS: sex,mental health application | USER-NOTES: {""Phoenix""=>[""read""]}",10.2196/57986,Humans;Male;Female;*Anorexia Nervosa/psychology/epidemiology/therapy;*Sexual Behavior/psychology;*Bulimia Nervosa/psychology/epidemiology;Adult;Surveys and Questionnaires;Young Adult;Bias;Sex Factors;Quality of Life/psychology;Language,40111287,PMC11949086
rayyan-202745504,Completeness and readability of GPT-4-generated multilingual discharge instructions in the pediatric emergency department.,2024,10,,JAMIA open,2574-2531 (Electronic),7,3,ooae050,Gimeno A and Krause K and D'Souza S and Walsh CG,https://pubmed.ncbi.nlm.nih.gov/38957592/,eng,,United States,"OBJECTIVES: The aim of this study was to assess the completeness and readability of generative pre-trained transformer-4 (GPT-4)-generated discharge instructions at prespecified reading levels for common pediatric emergency room complaints. MATERIALS AND METHODS: The outputs for 6 discharge scenarios stratified by reading level (fifth or eighth grade) and language (English, Spanish) were generated fivefold using GPT-4. Specifically, 120 discharge instructions were produced and analyzed (6 scenarios: 60 in English, 60 in Spanish; 60 at a fifth-grade reading level, 60 at an eighth-grade reading level) and compared for completeness and readability (between language, between reading level, and stratified by group and reading level). Completeness was defined as the proportion of literature-derived key points included in discharge instructions. Readability was quantified using Flesch-Kincaid (English) and Fernandez-Huerta (Spanish) readability scores. RESULTS: English-language GPT-generated discharge instructions contained a significantly higher proportion of must-include discharge instructions than those in Spanish (English: mean (standard error of the mean) = 62% (3%), Spanish: 53% (3%), P = .02). In the fifth-grade and eighth-grade level conditions, there was no significant difference between English and Spanish outputs in completeness. Readability did not differ across languages. DISCUSSION: GPT-4 produced readable discharge instructions in English and Spanish while modulating document reading level. Discharge instructions in English tended to have higher completeness than those in Spanish. CONCLUSION: Future research in prompt engineering and GPT-4 performance, both generally and in multiple languages, is needed to reduce potential for health disparities by language and reading level.","RAYYAN-INCLUSION: {""Lu""=>""Included"", ""Phoenix""=>""Included""} | RAYYAN-LABELS: language | USER-NOTES: {""Phoenix""=>[""not framed in bias - but comparative across languages, like other studies""]}",10.1093/jamiaopen/ooae050,"",38957592,PMC11216721
rayyan-202745507,Managing class imbalance in the training of a large language model to predict patient selection for total knee arthroplasty: Results from the Artificial intelligence to Revolutionise the patient Care pathway in Hip and knEe aRthroplastY (ARCHERY) project.,2025,2,27,The Knee,1873-5800 (Electronic),54,,1-8,Farrow L and Anderson L and Zhong M,https://pubmed.ncbi.nlm.nih.gov/40020253/,eng,,Netherlands,"INTRODUCTION: This study set out to test the efficacy of different techniques used to manage to class imbalance, a type of data bias, in application of a large language model (LLM) to predict patient selection for total knee arthroplasty (TKA). METHODS: This study utilised data from the Artificial Intelligence to Revolutionise the Patient Care Pathway in Hip and Knee Arthroplasty (ARCHERY) project (ISRCTN18398037). Data included the pre-operative radiology reports of patients referred to secondary care for knee-related complaints from within the North of Scotland. A clinically based LLM (GatorTron) was trained regarding prediction of selection for TKA. Three methods for managing class imbalance were assessed: a standard model, use of class weighting, and majority class undersampling. RESULTS: A total of 7707 individual knee radiology reports were included (dated from 2015 to 2022). The mean text length was 74 words (range 26-275). Only 910/7707 (11.8%) patients underwent TKA surgery (the designated 'minority class'). Class weighting technique performed better for minority class discrimination and calibration compared with the other two techniques (Recall 0.61/AUROC 0.73 for class weighting compared with 0.54/0.70 and 0.59/0.72 for the standard model and majority class undersampling, respectively. There was also significant data loss for majority class undersampling when compared with class-weighting. CONCLUSION: Use of class-weighting appears to provide the optimal method of training a an LLM to perform analytical tasks on free-text clinical information in the face of significant data bias ('class imbalance'). Such knowledge is an important consideration in the development of high-performance clinical AI models within Trauma and Orthopaedics.","RAYYAN-INCLUSION: {""Lu""=>""Included"", ""Phoenix""=>""Included""} | RAYYAN-EXCLUSION-REASONS: Did not assess bias | USER-NOTES: {""Phoenix""=>[""read"", ""class imbalance"", ""read""]}",10.1016/j.knee.2025.02.007,"",40020253,
rayyan-202745510,Assessing the utility of large language models for phenotype-driven gene prioritization in the diagnosis of rare genetic disease.,2024,10,3,American journal of human genetics,1537-6605 (Electronic),111,10,2190-2202,Kim J and Wang K and Weng C and Liu C,https://pubmed.ncbi.nlm.nih.gov/39255797/,eng,,United States,"Phenotype-driven gene prioritization is fundamental to diagnosing rare genetic disorders. While traditional approaches rely on curated knowledge graphs with phenotype-gene relations, recent advancements in large language models (LLMs) promise a streamlined text-to-gene solution. In this study, we evaluated five LLMs, including two generative pre-trained transformers (GPT) series and three Llama2 series, assessing their performance across task completeness, gene prediction accuracy, and adherence to required output structures. We conducted experiments, exploring various combinations of models, prompts, phenotypic input types, and task difficulty levels. Our findings revealed that the best-performed LLM, GPT-4, achieved an average accuracy of 17.0% in identifying diagnosed genes within the top 50 predictions, which still falls behind traditional tools. However, accuracy increased with the model size. Consistent results were observed over time, as shown in the dataset curated after 2023. Advanced techniques such as retrieval-augmented generation (RAG) and few-shot learning did not improve the accuracy. Sophisticated prompts were more likely to enhance task completeness, especially in smaller models. Conversely, complicated prompts tended to decrease output structure compliance rate. LLMs also achieved better-than-random prediction accuracy with free-text input, though performance was slightly lower than with standardized concept input. Bias analysis showed that highly cited genes, such as BRCA1, TP53, and PTEN, are more likely to be predicted. Our study provides valuable insights into integrating LLMs with genomic analysis, contributing to the ongoing discussion on their utilization in clinical workflows.","RAYYAN-INCLUSION: {""Lu""=>""Included"", ""Phoenix""=>""Included""} | RAYYAN-EXCLUSION-REASONS: No relevant data ,no bias evaluation",10.1016/j.ajhg.2024.08.010,Humans;*Phenotype;*Rare Diseases/genetics;Computational Biology/methods,39255797,PMC11480789
rayyan-202745519,Screening/diagnosis of pediatric endocrine disorders through the artificial intelligence model in different language settings.,2024,6,,European journal of pediatrics,1432-1076 (Electronic),183,6,2655-2661,Ying L and Li S and Chen C and Yang F and Li X and Chen Y and Ding Y and Chang G and Li J and Wang X,https://pubmed.ncbi.nlm.nih.gov/38502320/,eng,,Germany,"This study is aimed at examining the impact of ChatGPT on pediatric endocrine and metabolic conditions, particularly in the areas of screening and diagnosis, in both Chinese and English modes. A 40-question questionnaire covering the four most common pediatric endocrine and metabolic conditions was posed to ChatGPT in both Chinese and English three times each. Six pediatric endocrinologists evaluated the responses. ChatGPT performed better when responding to questions in English, with an unreliable rate of 7.5% compared to 27.5% for Chinese questions, indicating a more consistent response pattern in English. Among the reliable questions, the answers were more comprehensive and satisfactory in the English mode. We also found disparities in ChatGPT's performance when interacting with different target groups and diseases, with improved performance for questions posed by clinicians in English and better performance for questions related to diabetes and overweight/obesity in Chinese for both clinicians and patients. Language comprehension, providing incomprehensive answers, and errors in key data were the main contributors to the low scores, according to reviewer feedback. CONCLUSION: Despite these limitations, as ChatGPT continues to evolve and expand its network, it has significant potential as a practical and effective tool for clinical diagnosis and treatment. WHAT IS KNOWN: • The deep learning-based large-language model ChatGPT holds great promise for improving clinical practice for both physicians and patients and has the potential to increase the speed and accuracy of disease screening and diagnosis, as well as enhance the overall efficiency of the medical process. However, the reliability and appropriateness of AI model responses in specific field remains unclear. • This study focused on the reliability and appropriateness of AI model responses to straightforward and fundamental questions related to the four most prevalent pediatric endocrine and metabolic disorders, for both healthcare providers and patients, in different language scenarios. WHAT IS NEW: • The AI model performed better when responding to questions in English, with more consistent, as well as more comprehensive and satisfactory responses. In addition, we also found disparities in ChatGPT's performance when interacting with different target groups and different diseases. • Despite these limitations, as ChatGPT continues to evolve and expand its network, it has significant potential as a practical and effective tool for clinical diagnosis and treatment.","RAYYAN-INCLUSION: {""Lu""=>""Included"", ""Phoenix""=>""Included""} | RAYYAN-LABELS: language",10.1007/s00431-024-05527-1,Humans;*Endocrine System Diseases/diagnosis;Child;*Artificial Intelligence;Surveys and Questionnaires;Language;Mass Screening/methods;Female;Pediatrics/methods;Male;China/epidemiology,38502320,PMC11098926
rayyan-202745521,"What Goes In, Must Come Out: Generative Artificial Intelligence Does Not Present Algorithmic Bias Across Race and Gender in Medical Residency Specialties.",2024,2,,Cureus,2168-8184 (Print),16,2,e54448,Lin S and Pandit S and Tritsch T and Levy A and Shoja MM,https://pubmed.ncbi.nlm.nih.gov/38510858/,eng,,United States,"Objective Artificial Intelligence (AI) has made significant inroads into various domains, including medicine, raising concerns about algorithmic bias. This study investigates the presence of biases in generative AI programs, with a specific focus on gender and racial representations across 19 medical residency specialties. Methodology This comparative study utilized DALL-E2 to generate faces representing 19 distinct residency training specialties, as identified by the Association of American Medical Colleges (AAMC), which were then compared to the AAMC's residency specialty breakdown with respect to race and gender. Results Our findings reveal an alignment between OpenAI's DALL-E2's predictions and the current demographic landscape of medical residents, suggesting an absence of algorithmic bias in this AI model. Conclusion This revelation gives rise to important ethical considerations. While AI excels at pattern recognition, it inherits and mirrors the biases present in its training data. To combat AI bias, addressing real-world disparities is imperative. Initiatives to promote inclusivity and diversity within medicine are commendable and contribute to reshaping medical education. This study underscores the need for ongoing efforts to dismantle barriers and foster inclusivity in historically male-dominated medical fields, particularly for underrepresented populations. Ultimately, our findings underscore the crucial role of real-world data quality in mitigating AI bias. As AI continues to shape healthcare and education, the pursuit of equitable, unbiased AI applications should remain at the forefront of these transformative endeavors.","RAYYAN-INCLUSION: {""Lu""=>""Included"", ""Phoenix""=>""Included""} | RAYYAN-LABELS: sex,race ethnicity | RAYYAN-EXCLUSION-REASONS: not health data,No relevant data ,no direct health application,no direct clnical application",10.7759/cureus.54448,"",38510858,PMC10951939
rayyan-202745531,Applying Large Language Models to Assess Quality of Care: Monitoring ADHD Medication Side Effects.,2025,1,1,Pediatrics,1098-4275 (Electronic),155,1,,Bannett Y and Gunturkun F and Pillai M and Herrmann JE and Luo I and Huffman LC and Feldman HM,https://pubmed.ncbi.nlm.nih.gov/39701141/,eng,,United States,"OBJECTIVE: To assess the accuracy of a large language model (LLM) in measuring clinician adherence to practice guidelines for monitoring side effects after prescribing medications for children with attention-deficit/hyperactivity disorder (ADHD). METHODS: Retrospective population-based cohort study of electronic health records. Cohort included children aged 6 to 11 years with ADHD diagnosis and 2 or more ADHD medication encounters (stimulants or nonstimulants prescribed) between 2015 and 2022 in a community-based primary health care network (n = 1201). To identify documentation of side effects inquiry, we trained, tested, and deployed an open-source LLM (LLaMA) on all clinical notes from ADHD-related encounters (ADHD diagnosis or ADHD medication prescription), including in-clinic/telehealth and telephone encounters (n = 15 628 notes). Model performance was assessed using holdout and deployment test sets, compared with manual medical record review. RESULTS: The LLaMA model accurately classified notes that contained side effects inquiry (sensitivity = 87.2, specificity = 86.3, area under curve = 0.93 on holdout test set). Analyses revealed no model bias in relation to patient sex or insurance. Mean age (SD) at first prescription was 8.8 (1.6) years; characteristics were mostly similar across patients with and without documented side effects inquiry. Rates of documented side effects inquiry were lower for telephone encounters than for in-clinic/telehealth encounters (51.9% vs 73.0%, P < .001). Side effects inquiry was documented in 61.4% of encounters after stimulant prescriptions and 48.5% of encounters after nonstimulant prescriptions (P = .041). CONCLUSIONS: Deploying an LLM on a variable set of clinical notes, including telephone notes, offered scalable measurement of quality of care and uncovered opportunities to improve psychopharmacological medication management in primary care.","RAYYAN-INCLUSION: {""Lu""=>""Included"", ""Phoenix""=>""Included""} | RAYYAN-LABELS: sex,insurance | USER-NOTES: {""Phoenix""=>[""have pre-print in list - duplicate: Leveraging a Large Language Model to Assess Quality-of-Care: Monitoring ADHD Medication Side Effects.""]}",10.1542/peds.2024-067223,Humans;Child;*Attention Deficit Disorder with Hyperactivity/drug therapy;Retrospective Studies;Male;Female;Central Nervous System Stimulants/adverse effects/therapeutic use;Electronic Health Records;Guideline Adherence;Cohort Studies;Quality of Health Care;Primary Health Care;Telemedicine,39701141,
rayyan-202745534,Predicting Depression Risk in Patients With Cancer Using Multimodal Data: Algorithm Development Study.,2024,1,18,JMIR medical informatics,2291-9694 (Print),12,,e51925,de Hond A and van Buchem M and Fanconi C and Roy M and Blayney D and Kant I and Steyerberg E and Hernandez-Boussard T,https://pubmed.ncbi.nlm.nih.gov/38236635/,eng,,Canada,"BACKGROUND: Patients with cancer starting systemic treatment programs, such as chemotherapy, often develop depression. A prediction model may assist physicians and health care workers in the early identification of these vulnerable patients. OBJECTIVE: This study aimed to develop a prediction model for depression risk within the first month of cancer treatment. METHODS: We included 16,159 patients diagnosed with cancer starting chemo- or radiotherapy treatment between 2008 and 2021. Machine learning models (eg, least absolute shrinkage and selection operator [LASSO] logistic regression) and natural language processing models (Bidirectional Encoder Representations from Transformers [BERT]) were used to develop multimodal prediction models using both electronic health record data and unstructured text (patient emails and clinician notes). Model performance was assessed in an independent test set (n=5387, 33%) using area under the receiver operating characteristic curve (AUROC), calibration curves, and decision curve analysis to assess initial clinical impact use. RESULTS: Among 16,159 patients, 437 (2.7%) received a depression diagnosis within the first month of treatment. The LASSO logistic regression models based on the structured data (AUROC 0.74, 95% CI 0.71-0.78) and structured data with email classification scores (AUROC 0.74, 95% CI 0.71-0.78) had the best discriminative performance. The BERT models based on clinician notes and structured data with email classification scores had AUROCs around 0.71. The logistic regression model based on email classification scores alone performed poorly (AUROC 0.54, 95% CI 0.52-0.56), and the model based solely on clinician notes had the worst performance (AUROC 0.50, 95% CI 0.49-0.52). Calibration was good for the logistic regression models, whereas the BERT models produced overly extreme risk estimates even after recalibration. There was a small range of decision thresholds for which the best-performing model showed promising clinical effectiveness use. The risks were underestimated for female and Black patients. CONCLUSIONS: The results demonstrated the potential and limitations of machine learning and multimodal models for predicting depression risk in patients with cancer. Future research is needed to further validate these models, refine the outcome label and predictors related to mental health, and address biases across subgroups.","RAYYAN-INCLUSION: {""Lu""=>""Included"", ""Phoenix""=>""Included""} | RAYYAN-LABELS: sex,race ethnicity,mental health application | USER-NOTES: {""Phoenix""=>[""prediction bias?"", ""generates faces of residents""]}",10.2196/51925,"",38236635,PMC10835583
rayyan-202745535,Large language models improve the identification of emergency department visits for symptomatic kidney stones.,2025,1,28,Scientific reports,2045-2322 (Electronic),15,1,3503,Bejan CA and Reed AM and Mikula M and Zhang S and Xu Y and Fabbri D and Embí PJ and Hsi RS,https://pubmed.ncbi.nlm.nih.gov/39875475/,eng,,England,"Recent advancements of large language models (LLMs) like generative pre-trained transformer 4 (GPT-4) have generated significant interest among the scientific community. Yet, the potential of these models to be utilized in clinical settings remains largely unexplored. In this study, we investigated the abilities of multiple LLMs and traditional machine learning models to analyze emergency department (ED) reports and determine if the corresponding visits were due to symptomatic kidney stones. Leveraging a dataset of manually annotated ED reports, we developed strategies to enhance LLMs including prompt optimization, zero- and few-shot prompting, fine-tuning, and prompt augmentation. Further, we implemented fairness assessment and bias mitigation methods to investigate the potential disparities by LLMs with respect to race and gender. A clinical expert manually assessed the explanations generated by GPT-4 for its predictions to determine if they were sound, factually correct, unrelated to the input prompt, or potentially harmful. The best results were achieved by GPT-4 (macro-F1 = 0.833, 95% confidence interval [CI] 0.826-0.841) and GPT-3.5 (macro-F1 = 0.796, 95% CI 0.796-0.796). Ablation studies revealed that the initial pre-trained GPT-3.5 model benefits from fine-tuning. Adding demographic information and prior disease history to the prompts allows LLMs to make better decisions. Bias assessment found that GPT-4 exhibited no racial or gender disparities, in contrast to GPT-3.5, which failed to effectively model racial diversity.","RAYYAN-INCLUSION: {""Lu""=>""Included"", ""Phoenix""=>""Included""} | RAYYAN-LABELS: sex,race",10.1038/s41598-025-86632-5,"Humans;*Kidney Calculi;*Emergency Service, Hospital;Female;Male;*Machine Learning;Middle Aged;Adult;Emergency Room Visits",39875475,PMC11775227
