key,title,year,month,day,journal,issn,volume,issue,pages,authors,url,language,publisher,location,abstract,notes,doi,keywords,pubmed_id,pmc_id
rayyan-202744632,Seeing Beyond Borders: Evaluating LLMs in Multilingual Ophthalmological Question Answering,2024,,,"Proceedings - 2024 IEEE 12th International Conference on Healthcare Informatics, ICHI 2024",,,,565-566,"Restrepo, D. and Nakayama, L.F. and Dychiao, R.G. and Wu, C. and Mccoy, L.G. and Artiaga, J.C. and Cobanaj, M. and Matos, J. and Gallifant, J. and Bitterman, D.S. and Ferrer, V. and Aphinyanaphongs, Y. and Anthony Celi, L.",https://www.scopus.com/inward/record.uri?eid=2-s2.0-85203680920&doi=10.1109%2fICHI61247.2024.00089&partnerID=40&md5=dc062765594cb34d5c1653279e86ffe0,,Institute of Electrical and Electronics Engineers Inc.,,"Large Language Models (LLMs), such as GPT-3.5 [1] and GPT-4 [2], have significant potential for transforming several aspects of patient care from clinical note summarization to performing board-level clinical question-answering tasks [3], [4]. Ophthalmology, is a field with high patient volume and therefore holds high documentation burden for physicians but great opportunities for leveraging LLMs. Furthermore, given the critical and permanent nature of negative disease outcomes like blindness and their ensuing social and financial damage to patients, the need for reliable, accessible, and robust tools is urgent. Several studies have already showcased the practicality of GPT applications in ophthalmology [5], [6], and in specific ophthalmology subspecialties, such as glaucoma and retina [7], [8] However, the rapid integration of LLMs into healthcare systems comes with significant ethical, cultural, and technical challenges [9], [10]. LLMs are predominantly trained on data from high-income, English-speaking contexts; therefore, they risk exacerbating health inequities between high-income countries (HICs) and low- and middle-income countries (LMICs) through poor generalizability. Previous work has demonstrated disparities in LLM performance between English and other languages in general healthcare contexts [11], however the specialty-specific considerations remain underexplored. In addition to limitations in model translation of linguistic content, concerns arise regarding model ability to engage with medical questions laden with cultural context, and specifics of regional medical practice. This research critically evaluates the performance and biases of two widely used LLMs, GPT-3.5 and GPT-4, when answering ophthalmological questions across different languages. By doing so, we uncover these LLMs' technological capabilities and limitations in a healthcare context and the broader implications of their deployment in LMICs. In addition, we explore how LLMs might increase the health equity gaps and bias among underrepresented populations. First, a novel dataset of multilingual ophthalmological questions was created, composed of Spanish, English, Portuguese, and Filipino languages. These were selected to comprehensively evaluate the LLMs across diverse languages representing populations with diverse demographic and cultural backgrounds. A careful collection of 164 questions, based on the 2022 Brazilian Ophthalmological Board Exam, was formatted as multiple-choice queries with 4 options [12]. The exam consisted of two theoretical tests, basic sciences and clinical-surgical ophthalmology, with subgroups on anatomy, pharmacology, clinical optics, strabismus, cataract, uveitis, oncology, refractive surgery, contact lens, and genetics. Each question-answer pair was reviewed and curated by native speakers and board-certified ophthalmologists to ensure a robust assessment of the models' medical knowledge, language understanding, and cultural appropriateness. Each question was assessed for consistency of responses across languages, for linguistics subtleties and similarities that would hinder the LLM assessment. Each model's performance across the 4 languages (Portuguese, Spanish, English, and Filipino) was calculated with a temperature setting of 0 to ensure the model always provides the most likely response. We formulated standardized and clear prompt templates for question-answering, aiming to eliminate any confounding variables related to differences in prompts or data leakage. Our methodology also involves a detailed review of the LLMs' responses for cultural relevance and clinical accuracy, performed by a panel of multilingual ophthalmologists and language experts to ensure the integrity and applicability of our findings. The evaluation highlighted significant disparities in the LLMs' performance across languages, with the most notable underperformance in Filipino, with 51.8% accuracy using GPT-4 and 34.8% using GPT-3.5. Filipino had 9.8% less accuracy in GPT4 compared with the following language, Portuguese (61.6%); and 3.6% less than Spanish in GPT-3.5 Turbo with 38.4% of accuracy. This performance gap worsens when we break down the question types: as Table II indicates, GPT-3.5 has around 15% performance gap between English and Filipino in questions requiring clinical expertise. While the concrete composition of these models pretraining datasets is unknown, it is widely acknowledged this is largely composed of more common languages such as English in online corpora [13]. This finding pinpoints a concerning bias in these models, which tend to favor languages and dialects with extensive representation in their training datasets. The implications of such biases are profound, suggesting that without corrective measures, the deployment of LLMs in healthcare could amplify existing disparities rather than ameliorate them [9]. The analysis underscores the critical need for a more inclusive and equitable approach to developing AI technologies for healthcare. This study's findings serve as a crucial reminder of the ethical and practical challenges facing the deployment of AI in healthcare, particularly in linguistically and culturally diverse settings such as LMICs. While LLMs hold the promise of revolutionizing medical diagnostics and patient care, their current biases pose significant risks of exacerbating health disparities, particularly in LMICs. Future work will expand these results to different models across different model sizes and training datasets. Furthermore, the number of languages in this test will be expanded vastly to formulate this into a more comprehensive benchmark for LLM evaluation in Ophthalmology. To realize the full potential of AI in improving healthcare outcomes globally, it is imperative that future developments in LLMs prioritize diversity and equity, incorporating a broader array of languages and cultural contexts into their training datasets. Moreover, establishing international standards, guidelines, benchmarks, and metrics for the equitable development and deployment of AI technologies in healthcare emerges as a key recommendation from our study. © 2024 IEEE.","Export Date: 31 March 2025; Cited By: 0 | RAYYAN-INCLUSION: {""Lu""=>""Included"", ""Phoenix""=>""Included""} | RAYYAN-EXCLUSION-REASONS: wrong publication type",10.1109/ICHI61247.2024.00089,"",,
rayyan-202744659,Open (Clinical) LLMs are Sensitive to Instruction Phrasings,2024,,,"BioNLP 2024 - 23rd Meeting of the ACL Special Interest Group on Biomedical Natural Language Processing, Proceedings of the Workshop and Shared Tasks",,,,50-71,"Arroyo, A.M.C. and Munnangi, M. and Sun, J. and Zhang, K.Y.C. and McInerney, D.J. and Wallace, B.C. and Amir, S.",https://www.scopus.com/inward/record.uri?eid=2-s2.0-85204489862&partnerID=40&md5=751749f2c67d2c1dba4648aa20275509,,Association for Computational Linguistics (ACL),,"Instruction-tuned Large Language Models (LLMs) can perform a wide range of tasks given natural language instructions to do so, but they are sensitive to how such instructions are phrased. This issue is especially concerning in healthcare, as clinicians are unlikely to be experienced prompt engineers and the potential consequences of inaccurate outputs are heightened in this domain. This raises a practical question: How robust are instruction-tuned LLMs to natural variations in the instructions provided for clinical NLP tasks? We collect prompts from medical doctors across a range of tasks and quantify the sensitivity of seven LLMs—some general, others specialized—to natural (i.e., non-adversarial) instruction phrasings. We find that performance varies substantially across all models, and that—perhaps surprisingly—domain-specific models explicitly trained on clinical data are especially brittle, compared to their general domain counterparts. Further, arbitrary phrasing differences can affect fairness, e.g., valid but distinct instructions for mortality prediction yield a range both in overall performance, and in terms of differences between demographic groups.. ©2024 Association for Computational Linguistics.","Export Date: 31 March 2025; Cited By: 1 | RAYYAN-INCLUSION: {""Lu""=>""Included"", ""Phoenix""=>""Included""} | RAYYAN-LABELS: fairness across demographic groups",,"",,
rayyan-202744669,Addressing Gender Bias: A Fundamental Approach to AI in Mental Health,2024,,,"2024 5th International Conference on Big Data Analytics and Practices, IBDAP 2024",,,,107-112,"Chansiri, K. and Wei, X. and Chor, K.H.B.",https://www.scopus.com/inward/record.uri?eid=2-s2.0-85206587637&doi=10.1109%2fIBDAP62940.2024.10689686&partnerID=40&md5=5cf966e3119b2d7508885443fe298707,,Institute of Electrical and Electronics Engineers Inc.,,"While gender biases in large language models (LLMs) have been identified, their nuances in mental health contexts remain under-researched but are critical for ensuring accurate and inclusive AI diagnostics. We address this gap by investigating gender biases in GPT-3.5 and GPT-4, focusing on Borderline Personality Disorder (BPD) and Narcissistic Personality, Disorder (NPD), selected for their recognized clinical biases: women with BPD and men with NPD. We explore these biases through diagnostic reasoning and clinical vignette generation tasks. Diagnostic tests reveal that both GPT-3.5 and GPT-4 exhibit biases, particularly against women, though GPT-4 shows reduced bias and improved performance. In vignette generation, both models, especially GPT-4, frequently depict women with BPD, Vignettes featuring men with NPD score higher in positive sentiment, objectivity, and readability. These results emphasize the importance of addressing gender biases in mental health AI to prevent stereotyping and misinformation.  © 2024 IEEE.","Export Date: 31 March 2025; Cited By: 0 | RAYYAN-INCLUSION: {""Lu""=>""Included"", ""Phoenix""=>""Included""} | RAYYAN-LABELS: mental health application",10.1109/IBDAP62940.2024.10689686,"",,
rayyan-202744693,"Assessing ChatGPT's Performance in Health Fact-Checking: Performance, Biases, and Risks",2024,,,Communications in Computer and Information Science,,1957,,403-408,"Ni, Z. and Qian, Y. and Vaillant, P. and Jaulent, M.-C. and Bousquet, C.",https://www.scopus.com/inward/record.uri?eid=2-s2.0-85180150795&doi=10.1007%2f978-3-031-49212-9_50&partnerID=40&md5=4285628185cc2b63f2849b89780e8e21,,Springer Science and Business Media Deutschland GmbH,,"The increasing use of ChatGPT by the general public has prompted us to assess ChatGPT's performance in health fact-checking and uncover potential biases and risks arising from its utilization. In this study, we employed two publicly accessible datasets to evaluate ChatGPT's performance. We utilized BERTopic for clustering health claims into topics and subsequently employed the gpt-3.5-turbo API for fact-checking these claims. ChatGPT's performance was appraised on multi-class (False, Mixture, Mostly-False, Mostly-True, True) and binary (True, False) levels, with a thorough analysis of its performance across various topics. ChatGPT achieved a F1-score of 0.54 and 0.64 in the multi-class task and 0.88 and 0.85 in the binary task on the two datasets, respectively. In most health topics (e.g., vaccines, Covid-19), ChatGPT's F1-score exceeded 0.8, except for specific topics, such as novel or contentious cancer treatments, which yielded a F1-score below 0.6. We scrutinized the erroneous fact-checking labels and explanations provided by ChatGPT, revealing that it may produce inaccurate results for claims with misleading intent, inaccurate information, emerging research findings, or contentious health knowledge. © 2024, The Author(s), under exclusive license to Springer Nature Switzerland AG.","Export Date: 31 March 2025; Cited By: 0 | RAYYAN-INCLUSION: {""Lu""=>""Included"", ""Phoenix""=>""Included""} | RAYYAN-EXCLUSION-REASONS: no bias evaluation",10.1007/978-3-031-49212-9_50,"",,
rayyan-202744717,Probing into the Fairness of Large Language Models: A Case Study of ChatGPT,2024,,,"2024 58th Annual Conference on Information Sciences and Systems, CISS 2024",,,,,"Li, Y. and Zhang, L. and Zhang, Y.",https://www.scopus.com/inward/record.uri?eid=2-s2.0-85190625609&doi=10.1109%2fCISS59072.2024.10480206&partnerID=40&md5=acc25c478b3c33320cec40f52c3df86c,,Institute of Electrical and Electronics Engineers Inc.,,"Understanding and addressing unfairness in LLMs are crucial for responsible AI deployment. However, there is a limited number of quantitative analyses and in-depth studies regarding fairness evaluations in LLMs, especially when applying LLMs to high-stakes fields. This work aims to fill this gap by providing a systematic evaluation of the effectiveness and fairness of LLMs using ChatGPT as a study case. We focus on assessing ChatGPT's performance in high-takes fields including education, criminology, finance and healthcare. To conduct a thorough evaluation, we consider both group fairness and individual fairness metrics. We also observe the disparities in ChatGPT's outputs under a set of biased or unbiased prompts. This work contributes to a deeper understanding of LLMs' fairness performance, facilitates bias mitigation and fosters the development of responsible AI systems. Code and data are open-sourced on GitHub. © 2024 IEEE.","Export Date: 31 March 2025; Cited By: 1 | RAYYAN-INCLUSION: {""Lu""=>""Included"", ""Phoenix""=>""Included""}",10.1109/CISS59072.2024.10480206,"",,
rayyan-202744723,ChatGPT as a Tool for Oral Health Education: A Systematic Evaluation of ChatGPT Responses to Patients' Oral Health-related Queries,2024,,,Journal of Nature and Science of Medicine,,7,3,154-157,"Praveen, G. and Poornima, U.L.S. and Akkaloori, A. and Bharathi, V.",https://www.scopus.com/inward/record.uri?eid=2-s2.0-85199507001&doi=10.4103%2fjnsm.jnsm_208_23&partnerID=40&md5=c2a5676b1c6c3f7d73d59ad40d30b484,,Wolters Kluwer Medknow Publications,,"Background: ChatGPT holds promise in oral health education, provided valid concerns are proactively examined and addressed. Hence, this study was conducted to evaluate ChatGPT responses to patients' most common queries about their oral health. Methods: A cross-sectional study was conducted to gather a dataset of oral health-related queries from patients attending a dental institution. The dataset was preprocessed and formatted to remove any irrelevant or duplicate queries. Then, we supplied the dataset to ChatGPT to generate responses. We asked two dental public health experts to independently review the ChatGPT responses for clarity, accuracy, relevance, comprehensiveness, consistency, acceptance, and bias using a 5-point Likert scale. The intraclass correlation coefficient (ICC) was used to evaluate interrater reliability. Scores were summarized using descriptive statistics. Results: A total of 563 oral health-related queries were gathered from 120 patients. After removing the irrelevant or duplicate queries, 105 were included in the final dataset. The ICC value of 0.878 (95% confidence interval range from 0.841 to 0.910) showed good reliability between the reviewers. The majority of ChatGPT responses had a clear understanding (95.24%), were scientifically accurate and relevant to the query (87.62%), were comprehensive (83.81%), were consistent (84.76%), and were acceptable without any edits (86.67%). The reviewers strongly agreed that only 40.96% of the responses had no bias. The overall score was high with a mean value of 4.72 ± 0.30. The qualitative analysis of comments on ChatGPT responses revealed that the responses were rather long and more comprehensive. Conclusions: ChatGPT generated clear, scientifically accurate and relevant, comprehensive, and consistent responses to diverse oral health-related queries despite some significant limitations. Copyright © 2024 Journal of Nature and Science of Medicine.","Export Date: 31 March 2025; Cited By: 1 | RAYYAN-INCLUSION: {""Lu""=>""Included"", ""Phoenix""=>""Included""}",10.4103/jnsm.jnsm_208_23,"",,
rayyan-202744728,Addressing Healthcare-related Racial and LGBTQ+ Biases in Pretrained Language Models,2024,,,Findings of the Association for Computational Linguistics: NAACL 2024 - Findings,,,,4451-4464,"Xie, S. and Hassanpour, S. and Vosoughi, S.",https://www.scopus.com/inward/record.uri?eid=2-s2.0-85197860837&partnerID=40&md5=2afeff2f6c62ec7dcf001812d003310a,,Association for Computational Linguistics (ACL),,"Recent studies have highlighted the issue of Pretrained Language Models (PLMs) inadvertently propagating social stigmas and stereotypes, a critical concern given their widespread use. This is particularly problematic in sensitive areas like healthcare, where such biases could lead to detrimental outcomes. Our research addresses this by adapting two intrinsic bias benchmarks to quantify racial and LGBTQ+ biases in prevalent PLMs. We also empirically evaluate the effectiveness of various debiasing methods in mitigating these biases. Furthermore, we assess the impact of debiasing on both Natural Language Understanding and specific biomedical applications. Our findings reveal that while PLMs commonly exhibit healthcare-related racial and LGBTQ+ biases, the applied debiasing techniques successfully reduce these biases without compromising the models' performance in downstream tasks. © 2024 Association for Computational Linguistics.","Export Date: 31 March 2025; Cited By: 0 | RAYYAN-INCLUSION: {""Lu""=>""Included"", ""Phoenix""=>""Included""} | USER-NOTES: {""Phoenix""=>[""read"", ""not applied""]}",,"",,
rayyan-202744743,The Large Language Model ChatGPT-4 Exhibits Excellent Triage Capabilities and Diagnostic Performance for Patients Presenting With Various Causes of Knee Pain,2024,,,Arthroscopy - Journal of Arthroscopic and Related Surgery,,,,,"Kunze, K.N. and Varady, N.H. and Mazzucco, M. and Lu, A.Z. and Chahla, J. and Martin, R.K. and Ranawat, A.S. and Pearle, A.D. and Williams, R.J.",https://www.scopus.com/inward/record.uri?eid=2-s2.0-85200318191&doi=10.1016%2fj.arthro.2024.06.021&partnerID=40&md5=c88fd9edcb660e979127bca897f71c69,,W.B. Saunders,,"Purpose: To provide a proof-of-concept analysis of the appropriateness and performance of ChatGPT-4 to triage, synthesize differential diagnoses, and generate treatment plans concerning common presentations of knee pain. Methods: Twenty knee complaints warranting triage and expanded scenarios were input into ChatGPT-4, with memory cleared prior to each new input to mitigate bias. For the 10 triage complaints, ChatGPT-4 was asked to generate a differential diagnosis that was graded for accuracy and suitability in comparison to a differential created by 2 orthopaedic sports medicine physicians. For the 10 clinical scenarios, ChatGPT-4 was prompted to provide treatment guidance for the patient, which was again graded. To test the higher-order capabilities of ChatGPT-4, further inquiry into these specific management recommendations was performed and graded. Results: All ChatGPT-4 diagnoses were deemed appropriate within the spectrum of potential pathologies on a differential. The top diagnosis on the differential was identical between surgeons and ChatGPT-4 for 70% of scenarios, and the top diagnosis provided by the surgeon appeared as either the first or second diagnosis in 90% of scenarios. Overall, 16 of 30 diagnoses (53.3%) in the differential were identical. When provided with 10 expanded vignettes with a single diagnosis, the accuracy of ChatGPT-4 increased to 100%, with the suitability of management graded as appropriate in 90% of cases. Specific information pertaining to conservative management, surgical approaches, and related treatments was appropriate and accurate in 100% of cases. Conclusions: ChatGPT-4 provided clinically reasonable diagnoses to triage patient complaints of knee pain due to various underlying conditions that were generally consistent with differentials provided by sports medicine physicians. Diagnostic performance was enhanced when providing additional information, allowing ChatGPT-4 to reach high predictive accuracy for recommendations concerning management and treatment options. However, ChatGPT-4 may show clinically important error rates for diagnosis depending on prompting strategy and information provided; therefore, further refinements are necessary prior to implementation into clinical workflows. Clinical Relevance: Although ChatGPT-4 is increasingly being used by patients for health information, the potential for ChatGPT-4 to serve as a clinical support tool is unclear. In this study, we found that ChatGPT-4 was frequently able to diagnose and triage knee complaints appropriately as rated by sports medicine surgeons, suggesting that it may eventually be a useful clinical support tool. © 2024 Arthroscopy Association of North America","Export Date: 31 March 2025; Cited By: 7 | RAYYAN-INCLUSION: {""Lu""=>""Included"", ""Phoenix""=>""Included""} | RAYYAN-EXCLUSION-REASONS: no bias evaluation,Did not assess bias | USER-NOTES: {""Phoenix""=>[""prompt bias? doesn't define bias by what groups.""]}",10.1016/j.arthro.2024.06.021,"",,
rayyan-202744744,Automatic Annotation of Dream Report’s Emotional Content with Large Language Models,2024,,,"CLPsych 2024 - 9th Workshop on Computational Linguistics and Clinical Psychology, Proceedings of the Workshop",,,,92-107,"Bertolini, L. and Elce, V. and Michalak, A. and Widhoelzl, H.-S. and Bernardi, G. and Weeds, J.",https://www.scopus.com/inward/record.uri?eid=2-s2.0-85189754581&partnerID=40&md5=b2b572010764e2a653af05910d81ff12,,Association for Computational Linguistics (ACL),,"In psychology and neuroscience, dreams are extensively studied both as a model to understand the neural bases of consciousness and for their relationship with psycho-physical well-being. The study of dream content typically relies on the analysis of verbal reports provided upon awakening. This task is classically performed through manual scoring provided by trained annotators, at a great time expense. While a consistent body of work suggests that natural language processing (NLP) tools can support the automatic analysis of dream reports, proposed methods lacked the ability to reason over a report’s full context and required extensive data pre-processing. Furthermore, in most cases, these methods were not validated against standard manual scoring approaches. In this work, we address these limitations by adopting large language models (LLMs) to study and replicate the manual annotation of dream reports, with a focus on reports’ emotions. Our results show that a text classification method based on BERT can achieve high performance, is resistant to biases, and shows promising results on data from a clinical population. Overall, results indicate that LLMs and NLP could find multiple successful applications in the analysis of large dream datasets and may favour reproducibility and comparability of results across research. ©2024 Association for Computational Linguistic.","Export Date: 31 March 2025; Cited By: 3 | RAYYAN-INCLUSION: {""Lu""=>""Included"", ""Phoenix""=>""Included""} | RAYYAN-EXCLUSION-REASONS: not health data,No relevant data ,no direct health application",,"",,
rayyan-202744774,ChatGPT for Mental Health Applications: A study on biases,2023,,,ACM International Conference Proceeding Series,,,,,"Soun, R.S. and Nair, A.",https://www.scopus.com/inward/record.uri?eid=2-s2.0-85194846035&doi=10.1145%2f3639856.3639894&partnerID=40&md5=3e2905cd1a1c73925db0f4afeea797f0,,Association for Computing Machinery,,"Suicide is a serious global issue taking 800,000 lives every year. AI-assisted early detection of suicide risk and stress levels using a user's activity on online forums and social media websites has shown great promise previously. In addition to this, emerging large language models have shown massive potential to provide state-of-the-art-performance for downstream tasks like text classification. Therefore, we attempt to apply one such large language model, GPT3.5 turbo to mental health applications with 3 datasets spanning suicide risk severity and stress presence classification. We also study the inherent demographic biases induced in these models as a result of polluted pretraining data and find that the model consistently estimates the mental health status of young females between the ages of 18 and 30 years best.  © 2023 ACM.","Export Date: 31 March 2025; Cited By: 0 | RAYYAN-INCLUSION: {""Lu""=>""Included"", ""Phoenix""=>""Included""} | RAYYAN-LABELS: age,sex,mental health application | USER-NOTES: {""Phoenix""=>[""read""]}",10.1145/3639856.3639894,"",,
