key,title,year,month,day,journal,issn,volume,issue,pages,authors,url,language,publisher,location,abstract,notes,doi,keywords,pubmed_id,pmc_id
rayyan-202745245,Bias and Inaccuracy in AI Chatbot Ophthalmologist Recommendations.,2023,9,,Cureus,2168-8184 (Print),15,9,e45911,Oca MC and Meller L and Wilson K and Parikh AO and McCoy A and Chang J and Sudharshan R and Gupta S and Zhang-Nunes S,https://pubmed.ncbi.nlm.nih.gov/37885556/,eng,,United States,"PURPOSE AND DESIGN: To evaluate the accuracy and bias of ophthalmologist recommendations made by three AI chatbots, namely ChatGPT 3.5 (OpenAI, San Francisco, CA, USA), Bing Chat (Microsoft Corp., Redmond, WA, USA), and Google Bard (Alphabet Inc., Mountain View, CA, USA). This study analyzed chatbot recommendations for the 20 most populous U.S. cities. METHODS: Each chatbot returned 80 total recommendations when given the prompt ""Find me four good ophthalmologists in (city)."" Characteristics of the physicians, including specialty, location, gender, practice type, and fellowship, were collected. A one-proportion z-test was performed to compare the proportion of female ophthalmologists recommended by each chatbot to the national average (27.2% per the Association of American Medical Colleges (AAMC)). Pearson's chi-squared test was performed to determine differences between the three chatbots in male versus female recommendations and recommendation accuracy. RESULTS: Female ophthalmologists recommended by Bing Chat (1.61%) and Bard (8.0%) were significantly less than the national proportion of 27.2% practicing female ophthalmologists (p<0.001, p<0.01, respectively). ChatGPT recommended fewer female (29.5%) than male ophthalmologists (p<0.722). ChatGPT (73.8%), Bing Chat (67.5%), and Bard (62.5%) gave high rates of inaccurate recommendations. Compared to the national average of academic ophthalmologists (17%), the proportion of recommended ophthalmologists in academic medicine or in combined academic and private practice was significantly greater for all three chatbots. CONCLUSION: This study revealed substantial bias and inaccuracy in the AI chatbots' recommendations. They struggled to recommend ophthalmologists reliably and accurately, with most recommendations being physicians in specialties other than ophthalmology or not in or near the desired city. Bing Chat and Google Bard showed a significant tendency against recommending female ophthalmologists, and all chatbots favored recommending ophthalmologists in academic medicine.","RAYYAN-INCLUSION: {""Lu""=>""Included"", ""Phoenix""=>""Included""}",10.7759/cureus.45911,"",37885556,PMC10599183
rayyan-202745259,Evaluation and mitigation of cognitive biases in medical language models.,2024,10,21,NPJ digital medicine,2398-6352 (Electronic),7,1,295,Schmidgall S and Harris C and Essien I and Olshvang D and Rahman T and Kim JW and Ziaei R and Eshraghian J and Abadir P and Chellappa R,https://pubmed.ncbi.nlm.nih.gov/39433945/,eng,,England,"Increasing interest in applying large language models (LLMs) to medicine is due in part to their impressive performance on medical exam questions. However, these exams do not capture the complexity of real patient-doctor interactions because of factors like patient compliance, experience, and cognitive bias. We hypothesized that LLMs would produce less accurate responses when faced with clinically biased questions as compared to unbiased ones. To test this, we developed the BiasMedQA dataset, which consists of 1273 USMLE questions modified to replicate common clinically relevant cognitive biases. We assessed six LLMs on BiasMedQA and found that GPT-4 stood out for its resilience to bias, in contrast to Llama 2 70B-chat and PMC Llama 13B, which showed large drops in performance. Additionally, we introduced three bias mitigation strategies, which improved but did not fully restore accuracy. Our findings highlight the need to improve LLMs' robustness to cognitive biases, in order to achieve more reliable applications of LLMs in healthcare.","RAYYAN-INCLUSION: {""Lu""=>""Included"", ""Phoenix""=>""Included""} | USER-NOTES: {""Phoenix""=>[""cognitive bias""]}",10.1038/s41746-024-01283-6,"",39433945,PMC11494053
rayyan-202745260,ChatGPT-4 Turbo and Meta's LLaMA 3.1: A Relative Analysis of Answering Radiology Text-Based Questions.,2024,11,,Cureus,2168-8184 (Print),16,11,e74359,Abdul Sami M and Abdul Samad M and Parekh K and Suthar PP,https://pubmed.ncbi.nlm.nih.gov/39720391/,eng,,United States,"AIMS AND OBJECTIVES: This study aimed to compare the accuracy of two AI models - OpenAI's GPT-4 Turbo (San Francisco, CA) and Meta's LLaMA 3.1 (Menlo Park, CA) - when answering a standardized set of pediatric radiology questions. The primary objective was to evaluate the overall accuracy of each model, while the secondary objective was to assess their performance within subsections. METHODS AND MATERIALS: A total of 79 text-based pediatric radiology questions were selected out of 302 total questions for this comparison. The questions covered seven subsections, including musculoskeletal, chest, and neuroradiology, among others. Image-based questions were excluded to focus on text interpretation and to minimize the sampling bias within each model. Each model was tested independently on the same question set, and the percent accuracy was calculated for both overall performance as well as individual subsections. RESULTS: GPT-4 Turbo performed at an overall accuracy of 88.6% (70/79 questions), outperforming LLaMA 3.1's 77.2% (61/79). Within subsections, GPT-4 Turbo had higher accuracy in most areas, except for equal accuracy in the neuroradiology section. The subsections with the greatest accuracy for GPT-4 Turbo, in descending order, were chest and cardiac radiology (100%), musculoskeletal system (93.3%), and genitourinary system (92.9%). LLaMA 3.1's highest performance was 86.7% in the musculoskeletal system, while its lowest was 50.0% in chest radiology. CONCLUSION: GPT-4 Turbo consistently outperformed LLaMA 3.1 in answering pediatric radiology questions, both overall and within most subsections. These findings suggest that GPT-4 Turbo may offer more accurate responses in specialized medical education, in contrast to LLaMA 3.1's efficient performance, although future research should further evaluate AI models' performance within other fields.","RAYYAN-INCLUSION: {""Lu""=>""Included"", ""Phoenix""=>""Included""} | RAYYAN-EXCLUSION-REASONS: Did not assess bias | USER-NOTES: {""Phoenix""=>[""accuracy across subsections -> bias?"", ""read"", ""performance across different LLMs""]}",10.7759/cureus.74359,"",39720391,PMC11668536
rayyan-202745261,Comparative analysis of large language models in medical counseling: A focus on Helicobacter pylori infection.,2024,1,,Helicobacter,1523-5378 (Electronic),29,1,e13055,Kong QZ and Ju KP and Wan M and Liu J and Wu XQ and Li YY and Zuo XL and Li YQ,https://pubmed.ncbi.nlm.nih.gov/39078641/,eng,,England,"BACKGROUND: Large language models (LLMs) are promising medical counseling tools, but the reliability of responses remains unclear. We aimed to assess the feasibility of three popular LLMs as counseling tools for Helicobacter pylori infection in different counseling languages. MATERIALS AND METHODS: This study was conducted between November 20 and December 1, 2023. Three large language models (ChatGPT 4.0 [LLM1], ChatGPT 3.5 [LLM2], and ERNIE Bot 4.0 [LLM3]) were input 15 H. pylori related questions each, once in English and once in Chinese. Each chat was conducted using the ""New Chat"" function to avoid bias from correlation interference. Responses were recorded and blindly assigned to three reviewers for scoring on three established Likert scales: accuracy (ranged 1-6 point), completeness (ranged 1-3 point), and comprehensibility (ranged 1-3 point). The acceptable thresholds for the scales were set at a minimum of 4, 2, and 2, respectively. Final various source and interlanguage comparisons were made. RESULTS: The overall mean (SD) accuracy score was 4.80 (1.02), while 1.82 (0.78) for completeness score and 2.90 (0.36) for comprehensibility score. The acceptable proportions for the accuracy, completeness, and comprehensibility of the responses were 90%, 45.6%, and 100%, respectively. The acceptable proportion of overall completeness score for English responses was better than for Chinese responses (p = 0.034). For accuracy, the English responses of LLM3 were better than the Chinese responses (p = 0.0055). As for completeness, the English responses of LLM1 was better than the Chinese responses (p = 0.0257). For comprehensibility, the English responses of LLM1 was better than the Chinese responses (p = 0.0496). No differences were found between the various LLMs. CONCLUSIONS: The LLMs responded satisfactorily to questions related to H. pylori infection. But further improving completeness and reliability, along with considering language nuances, is crucial for optimizing overall performance.","RAYYAN-INCLUSION: {""Lu""=>""Included"", ""Phoenix""=>""Included""} | RAYYAN-LABELS: language | RAYYAN-EXCLUSION-REASONS: Did not assess bias | USER-NOTES: {""Lu""=>[""The paper does not explicitly frame this as bias assessment. ""]}",10.1111/hel.13055,Humans;*Helicobacter Infections/diagnosis;*Counseling;*Helicobacter pylori;*Language;Reproducibility of Results;Surveys and Questionnaires,39078641,
rayyan-202745267,Evaluating Large Language Model-Supported Instructions for Medication Use: First Steps Toward a Comprehensive Model.,2024,12,,Mayo Clinic proceedings. Digital health,2949-7612 (Electronic),2,4,632-644,Reis ZSN and Pagano AS and Ramos de Oliveira IJ and Dias CDS and Lage EM and Mineiro EF and Varella Pereira GM and de Carvalho Gomes I and Basilio VA and Cruz-Correia RJ and de Jesus DDR and de Souza Júnior AP and da Rocha LCD,https://pubmed.ncbi.nlm.nih.gov/39679140/,eng,,Netherlands,"OBJECTIVE: To assess the support of large language models (LLMs) in generating clearer and more personalized medication instructions to enhance e-prescription. PATIENTS AND METHODS: We established patient-centered guidelines for adequate, acceptable, and personalized directions to enhance e-prescription. A dataset comprising 104 outpatient scenarios, with an array of medications, administration routes, and patient conditions, was developed following the Brazilian national e-prescribing standard. Three prompts were submitted to a closed-source LLM. The first prompt involved a generic command, the second one was calibrated for content enhancement and personalization, and the third one requested bias mitigation. The third prompt was submitted to an open-source LLM. Outputs were assessed using automated metrics and human evaluation. We conducted the study between March 1, 2024 and September 10, 2024. RESULTS: Adequacy scores of our closed-source LLM's output showed the third prompt outperforming the first and second one. Full and partial acceptability was achieved in 94.3% of texts with the third prompt. Personalization was rated highly, especially with the second and third prompts. The 2 LLMs showed similar adequacy results. Lack of scientific evidence and factual errors were infrequent and unrelated to a particular prompt or LLM. The frequency of hallucinations was different for each LLM and concerned prescriptions issued upon symptom manifestation and medications requiring dosage adjustment or involving intermittent use. Gender bias was found in our closed-source LLM's output for the first and second prompts, with the third one being bias-free. The second LLM's output was bias-free. CONCLUSION: This study demonstrates the potential of LLM-supported generation to produce prescription directions and improve communication between health professionals and patients within the e-prescribing system.","RAYYAN-INCLUSION: {""Lu""=>""Included"", ""Phoenix""=>""Included""} | RAYYAN-LABELS: sex",10.1016/j.mcpdig.2024.09.006,"",39679140,PMC11638470
rayyan-202745272,The utility of ChatGPT as a generative medical translator.,2024,11,,European archives of oto-rhino-laryngology : official journal of the European           Federation of Oto-Rhino-Laryngological Societies (EUFOS) : affiliated with the            German Society for Oto-Rhino-Laryngology - Head and Neck Surgery,1434-4726 (Electronic),281,11,6161-6165,Grimm DR and Lee YJ and Hu K and Liu L and Garcia O and Balakrishnan K and Ayoub NF,https://pubmed.ncbi.nlm.nih.gov/38705894/,eng,,Germany,"PURPOSE: Large language models continue to dramatically change the medical landscape. We aimed to explore the utility of ChatGPT in providing accurate, actionable, and understandable generative medical translations in English, Spanish, and Mandarin pertaining to Otolaryngology. METHODS: Responses of GPT-4 to commonly asked patient questions listed on official otolaryngology clinical practice guidelines (CPG) were evaluated with the Patient Education materials Assessment Tool-printable (PEMAT-P.) Additional critical elements were identified a priori to evaluate ChatGPT's accuracy and thoroughness in its responses. Multiple fluent speakers of English, Mandarin, and Spanish evaluated each response generated by ChatGPT. RESULTS: Total PEMAT-P scores differed between English, Mandarin, and Spanish GPT-4 generated responses depicting a moderate effect size of language, Eta-Square 0.07 with scores ranging from 73 to 77 (P-value = 0.03). Overall understandability scores did not differ between English, Mandarin, and Spanish depicting a small effect size of language, Eta-Square 0.02 scores ranging from 76 to 79 (P-value = 0.17), nor did overall actionability scores Eta-Square 0 score ranging 66-73 (P-value = 0.44). Overall a priori procedure-specific responses similarly did not differ between English, Spanish, and Mandarin Eta-Square 0.02 scores ranging 61-78 (P-value = 0.22). CONCLUSION: GPT-4 produces accurate, understandable, and actionable outputs in English, Spanish, and Mandarin. Responses generated by GPT-4 in Spanish and Mandarin are comparable to English counterparts indicating a novel use for these models within Otolaryngology, and implications for bridging healthcare access and literacy gaps. LEVEL OF EVIDENCE: IV.","RAYYAN-INCLUSION: {""Lu""=>""Included"", ""Phoenix""=>""Included""} | RAYYAN-LABELS: language",10.1007/s00405-024-08708-8,Humans;*Otolaryngology;Translating;Language;Patient Education as Topic/methods;Translations;Comprehension,38705894,
rayyan-202745273,"ChatGPT's Attitude, Knowledge, and Clinical Application in Geriatrics Practice and Education: Exploratory Observational Study.",2025,1,3,JMIR formative research,2561-326X (Electronic),9,,e63494,Cheng HY,https://pubmed.ncbi.nlm.nih.gov/39752214/,eng,,Canada,"BACKGROUND: The increasing use of ChatGPT in clinical practice and medical education necessitates the evaluation of its reliability, particularly in geriatrics. OBJECTIVE: This study aimed to evaluate ChatGPT's trustworthiness in geriatrics through 3 distinct approaches: evaluating ChatGPT's geriatrics attitude, knowledge, and clinical application with 2 vignettes of geriatric syndromes (polypharmacy and falls). METHODS: We used the validated University of California, Los Angeles, geriatrics attitude and knowledge instruments to evaluate ChatGPT's geriatrics attitude and knowledge and compare its performance with that of medical students, residents, and geriatrics fellows from reported results in the literature. We also evaluated ChatGPT's application to 2 vignettes of geriatric syndromes (polypharmacy and falls). RESULTS: The mean total score on geriatrics attitude of ChatGPT was significantly lower than that of trainees (medical students, internal medicine residents, and geriatric medicine fellows; 2.7 vs 3.7 on a scale from 1-5; 1=strongly disagree; 5=strongly agree). The mean subscore on positive geriatrics attitude of ChatGPT was higher than that of the trainees (medical students, internal medicine residents, and neurologists; 4.1 vs 3.7 on a scale from 1 to 5 where a higher score means a more positive attitude toward older adults). The mean subscore on negative geriatrics attitude of ChatGPT was lower than that of the trainees and neurologists (1.8 vs 2.8 on a scale from 1 to 5 where a lower subscore means a less negative attitude toward aging). On the University of California, Los Angeles geriatrics knowledge test, ChatGPT outperformed all medical students, internal medicine residents, and geriatric medicine fellows from validated studies (14.7 vs 11.3 with a score range of -18 to +18 where +18 means that all questions were answered correctly). Regarding the polypharmacy vignette, ChatGPT not only demonstrated solid knowledge of potentially inappropriate medications but also accurately identified 7 common potentially inappropriate medications and 5 drug-drug and 3 drug-disease interactions. However, ChatGPT missed 5 drug-disease and 1 drug-drug interaction and produced 2 hallucinations. Regarding the fall vignette, ChatGPT answered 3 of 5 pretests correctly and 2 of 5 pretests partially correctly, identified 6 categories of fall risks, followed fall guidelines correctly, listed 6 key physical examinations, and recommended 6 categories of fall prevention methods. CONCLUSIONS: This study suggests that ChatGPT can be a valuable supplemental tool in geriatrics, offering reliable information with less age bias, robust geriatrics knowledge, and comprehensive recommendations for managing 2 common geriatric syndromes (polypharmacy and falls) that are consistent with evidence from guidelines, systematic reviews, and other types of studies. ChatGPT's potential as an educational and clinical resource could significantly benefit trainees, health care providers, and laypeople. Further research using GPT-4o, larger geriatrics question sets, and more geriatric syndromes is needed to expand and confirm these findings before adopting ChatGPT widely for geriatrics education and practice.","RAYYAN-INCLUSION: {""Lu""=>""Included"", ""Phoenix""=>""Included""} | RAYYAN-LABELS: age | USER-NOTES: {""Phoenix""=>[""age bias...but educational?""]}",10.2196/63494,"Adult;Female;Humans;Male;Clinical Competence;*Geriatrics/education;*Health Knowledge, Attitudes, Practice;Reproducibility of Results;Students, Medical/psychology;Surveys and Questionnaires;*Artificial Intelligence;*Practice Patterns, Physicians';Aged",39752214,PMC11742095
rayyan-202745274,ChatGPT's ability to comprehend and answer cirrhosis related questions in Arabic.,2023,8,,Arab journal of gastroenterology : the official publication of the Pan-Arab           Association of Gastroenterology,2090-2387 (Electronic),24,3,145-148,Samaan JS and Yeo YH and Ng WH and Ting PS and Trivedi H and Vipani A and Yang JD and Liran O and Spiegel B and Kuo A and Ayoub WS,https://pubmed.ncbi.nlm.nih.gov/37673708/,eng,,Egypt,"BACKGROUND AND STUDY AIMS: Cirrhosis is a chronic progressive disease which requires complex care. Its incidence is rising in the Arab countries making it the 7th leading cause of death in the Arab League in 2010. ChatGPT is a large language model with a growing body of literature demonstrating its ability to answer clinical questions. We examined ChatGPT's accuracy in responding to cirrhosis related questions in Arabic and compared its performance to English. MATERIALS AND METHODS: ChatGPTs responses to 91 questions in Arabic and English were graded by a transplant hepatologist fluent in both languages. Accuracy of responses was assessed using the scale: 1. Comprehensive, 2. Correct but inadequate, 3. Mixed with correct and incorrect/outdated data, and 4. Completely incorrect.Accuracy of Arabic compared to English responses was assessed using the scale: 1. Arabic response is more accurate, 2. Similar accuracy, 3. Arabic response is less accurate. RESULTS: The model provided 22 (24.2%) comprehensive, 44 (48.4%) correct but inadequate, 13 (14.3%) mixed with correct and incorrect/outdated data and 12 (13.2%) completely incorrect Arabic responses. When comparing the accuracy of Arabic and English responses, 9 (9.9%) of the Arabic responses were graded as more accurate, 52 (57.1%) similar in accuracy and 30 (33.0%) as less accurate compared to English. CONCLUSION: ChatGPT has the potential to serve as an adjunct source of information for Arabic speaking patients with cirrhosis. The model provided correct responses in Arabic to 72.5% of questions, although its performance in Arabic was less accurate than in English. The model produced completely incorrect responses to 13.2% of questions, reinforcing its potential role as an adjunct and not replacement of care by licensed healthcare professionals. Future studies to refine this technology are needed to help Arabic speaking patients with cirrhosis across the globe understand their disease and improve their outcomes.","RAYYAN-INCLUSION: {""Lu""=>""Included"", ""Phoenix""=>""Included""} | RAYYAN-LABELS: language | USER-NOTES: {""Lu""=>[""PDF rrequested"", ""No PDF & Not in English""], ""Phoenix""=>[""doesn't frame it in terms of bias""]}",10.1016/j.ajg.2023.08.001,"",37673708,
rayyan-202745282,Leveraging a Large Language Model to Assess Quality-of-Care: Monitoring ADHD Medication Side Effects.,2024,4,24,medRxiv : the preprint server for health sciences,,,,,Bannett Y and Gunturkun F and Pillai M and Herrmann JE and Luo I and Huffman LC and Feldman HM,https://pubmed.ncbi.nlm.nih.gov/38712037/,eng,,United States,"OBJECTIVE: To assess the accuracy of a large language model (LLM) in measuring clinician adherence to practice guidelines for monitoring side effects after prescribing medications for children with attention-deficit/hyperactivity disorder (ADHD). METHODS: Retrospective population-based cohort study of electronic health records. Cohort included children aged 6-11 years with ADHD diagnosis and ≥2 ADHD medication encounters (stimulants or non-stimulants prescribed) between 2015-2022 in a community-based primary healthcare network (n=1247). To identify documentation of side effects inquiry, we trained, tested, and deployed an open-source LLM (LLaMA) on all clinical notes from ADHD-related encounters (ADHD diagnosis or ADHD medication prescription), including in-clinic/telehealth and telephone encounters (n=15,593 notes). Model performance was assessed using holdout and deployment test sets, compared to manual chart review. RESULTS: The LLaMA model achieved excellent performance in classifying notes that contain side effects inquiry (sensitivity= 87.2%, specificity=86.3/90.3%, area under curve (AUC)=0.93/0.92 on holdout/deployment test sets). Analyses revealed no model bias in relation to patient age, sex, or insurance. Mean age (SD) at first prescription was 8.8 (1.6) years; patient characteristics were similar across patients with and without documented side effects inquiry. Rates of documented side effects inquiry were lower in telephone encounters than in-clinic/telehealth encounters (51.9% vs. 73.0%, p<0.01). Side effects inquiry was documented in 61% of encounters following stimulant prescriptions and 48% of encounters following non-stimulant prescriptions (p<0.01). CONCLUSIONS: Deploying an LLM on a variable set of clinical notes, including telephone notes, offered scalable measurement of quality-of-care and uncovered opportunities to improve psychopharmacological medication management in primary care.","RAYYAN-INCLUSION: {""Lu""=>""Included"", ""Phoenix""=>""Included""} | RAYYAN-LABELS: sex,insurance | USER-NOTES: {""Lu""=>[""Analyses revealed no model bias but interested in seeing how they evaluated bias.""]}",10.1101/2024.04.23.24306225,"",38712037,PMC11071552
rayyan-202745284,"ChatGPT and Vaccine Hesitancy: A Comparison of English, Spanish, and French Responses Using a Validated Scale.",2024,,,AMIA Joint Summits on Translational Science proceedings. AMIA Joint Summits on           Translational Science,2153-4063 (Electronic),2024,,266-275,Joshi S and Ha E and Rivera Y and Singh VK,https://pubmed.ncbi.nlm.nih.gov/38827059/,eng,,United States,"ChatGPT is a popular information system (over 1 billion visits in August 2023) that can generate natural language responses to user queries. It is important to study the quality and equity of its responses on health-related topics, such as vaccination, as they may influence public health decision-making. We use the Vaccine Hesitancy Scale (VHS) proposed by Shapiro et al.(1) to measure the hesitancy of ChatGPT responses in English, Spanish, and French. We find that: (a) ChatGPT responses indicate less hesitancy than those reported for human respondents in past literature; (b) ChatGPT responses vary significantly across languages, with English responses being the most hesitant on average and Spanish being the least; (c) ChatGPT responses are largely consistent across different model parameters but show some variations across the scale factors (vaccine competency, risk). Results have implications for researchers interested in evaluating and improving the quality and equity of health-related web information.","RAYYAN-INCLUSION: {""Lu""=>""Included"", ""Phoenix""=>""Included""} | RAYYAN-LABELS: language",,"",38827059,PMC11141820
